189810,2017096285,PHONE,Public Works,Public Works-Capital Projects-,Public Works,Service Issue / Problem,08/01/2017,06:38 PM,"OPEN ",N,NULL,NULL,5906 E 18TH ST,64126,West Blue Valley,NULL,East,21148,39.089353,-94.513023,Capital Projects,NULL,NULL,NULL,2017-08-01,2024-01-30 20:56:04,DAMG7370_Lakshmi
121903,2020049836,PHONE,Water Services,Water Services-Line Maintenance-Leaf Brush,Leaf / Brush,Missed Pick Up,04/08/2020,01:16 PM,"OPEN ",Y,NULL,NULL,4040 Benton Blvd,64130,Oak Park Southwest,Jackson,East,29604,39.051942,-94.547295,Trash,Recycling,NULL,NULL,2020-04-08,2024-01-30 20:56:04,DAMG7370_Lakshmi
1208566,2016148384,PHONE,NHS,NHS-Neighborhood Preservation-,Property Maintenance,Other Property Issue,12/05/2016,03:37 PM,"OPEN ",Y,NULL,NULL,325 Bellaire Ave,64123,South Indian Mound,Jackson,East,46170,39.1095,-94.513008,Property,Buildings,Construction,NULL,2016-12-05,2024-01-30 20:56:05,DAMG7370_Lakshmi
94571,2016084311,EMAIL,NHS,NHS-Neighborhood Preservation-,Property Maintenance,Other Property Issue,07/20/2016,11:09 AM,"OPEN ",Y,NULL,NULL,7803 E 112th St,64134,Ruskin Heights,Jackson,South,72118,38.92492,-94.498874,Property,Buildings,Construction,NULL,2016-07-20,2024-01-30 20:56:04,DAMG7370_Lakshmi
129448,2020051085,PHONE,NHS,NHS-Neighborhood Preservation-,Nuisance,Trash on Private Property,04/10/2020,11:55 AM,"OPEN ",Y,NULL,NULL,2836 Baldwin Ave,64129,Blue Valley Industrial,Jackson,East,21223,39.072827,-94.505391,Trash,Recycling,NULL,NULL,2020-04-10,2024-01-30 20:56:04,DAMG7370_Lakshmi
81499,2019090945,PHONE,NHS,NHS-Neighborhood Preservation-,Private / Commercial,Lot - Structure,05/09/2019,04:28 PM,"OPEN ",Y,NULL,NULL,8729 E 97th Ter,64134,Robandee South,Jackson,South,70107,38.94724,-94.485017,Mowing,Weeds,NULL,NULL,2019-05-09,2024-01-30 20:56:04,DAMG7370_Lakshmi
178335,2021022213,"WEB  ",Public Works,Public Works-Street and Traffic-District 1,Pothole,District 1,03/02/2021,08:57 PM,"OPEN ",Y,NULL,NULL,6600 N Evans Ave,64151,Line Creek And Northern Heights,Platte,North,164672,39.214248,-94.607816,Streets,Roadways,Alleys,NULL,2021-03-02,2024-01-30 20:56:04,DAMG7370_Lakshmi
194147,2019121067,PHONE,NHS,NHS-Neighborhood Preservation-,Nuisance,Trash on Private Property,06/25/2019,10:38 AM,"OPEN ",Y,NULL,NULL,6919 E 17th St,64126,East Blue Valley,Jackson,East,20908,39.089738,-94.50142,Trash,Recycling,NULL,NULL,2019-06-25,2024-01-30 20:56:04,DAMG7370_Lakshmi
1531214,2019121369,"WEB  ",NHS,NHS-Neighborhood Preservation-,Private / Commercial,Lot - Vacant,06/25/2019,02:54 PM,"OPEN ",Y,NULL,NULL,4039 Euclid Ave,64130,Ivanhoe Southeast,Jackson,Central,136685,39.052486,-94.56037,Mowing,Weeds,NULL,NULL,2019-06-25,2024-01-30 20:56:06,DAMG7370_Lakshmi
1389754,2018101389,PHONE,NHS,NHS-Neighborhood Preservation-,Property Maintenance,Other Property Issue,07/30/2018,08:36 AM,"OPEN ",Y,NULL,NULL,4902 E Linwood Blvd,64128,Knoches Park,Jackson,East,22805,39.067532,-94.527696,Property,Buildings,Construction,NULL,2018-07-30,2024-01-30 20:56:06,DAMG7370_Lakshmi
162389,2020053977,PHONE,NHS,NHS-Solid Waste-,Trash Collection,Missed by City,04/16/2020,02:17 PM,"OPEN ",Y,NULL,NULL,3118 Cypress Ave,64128,Knoches Park,Jackson,East,22936,39.068442,-94.531368,Trash,Recycling,NULL,NULL,2020-04-16,2024-01-30 20:56:04,DAMG7370_Lakshmi
1443954,2019001861,"WEB  ",NHS,NHS-Neighborhood Preservation-,Property Maintenance,Graffiti,01/06/2019,11:30 AM,"OPEN ",Y,NULL,NULL,4904 Independence Ave,64124,South Indian Mound,Jackson,East,44638,39.106314,-94.523713,Property,Buildings,Construction,NULL,2019-01-06,2024-01-30 20:56:06,DAMG7370_Lakshmi
122758,2020105073,"WEB  ",NHS,NHS-Neighborhood Preservation-,Property Maintenance,Other Property Issue,07/31/2020,11:40 PM,"OPEN ",Y,NULL,NULL,3623 Windsor Ave,64123,Scarritt Point,Jackson,East,40513,39.113871,-94.537567,Property,Buildings,Construction,NULL,2020-07-31,2024-01-30 20:56:04,DAMG7370_Lakshmi
194272,2017110320,PHONE,Water Services,Water Services-Meter and Field Services-,Leak,Emergency Off / Flooding,08/28/2017,11:05 AM,"OPEN ",N,NULL,NULL,9415 MANCHESTER AVE,64138,Fairwood And Robandee,NULL,South,69371,38.952342,-94.497704,Water,NULL,NULL,NULL,2017-08-28,2024-01-30 20:56:04,DAMG7370_Lakshmi
112076,2020140370,EMAIL,NHS,NHS-Neighborhood Preservation-,Property Maintenance,Fence Issue,10/29/2020,08:30 AM,"OPEN ",N,NULL,NULL,142 Kensington Ave,64123,South Indian Mound,Jackson,East,44195,39.111347,-94.530767,Property,Buildings,Construction,NULL,2020-10-29,2024-01-30 20:56:04,DAMG7370_Lakshmi
142184,2020053075,PHONE,Water Services,Water Services-Line Maintenance-Leaf Brush,Leaf / Brush,Missed Pick Up,04/15/2020,09:54 AM,"OPEN ",N,NULL,NULL,7240 Jarboe St,64114,Ward Parkway,Jackson,Metro,110857,38.996665,-94.60241,Trash,Recycling,NULL,NULL,2020-04-15,2024-01-30 20:56:04,DAMG7370_Lakshmi
15991,2021024849,PHONE,NHS,NHS-Neighborhood Preservation-,Property Maintenance,Other Property Issue,04/06/2021,09:11 AM,"OPEN ",Y,NULL,NULL,3109 E 9th St,64127,Independence Plaza,Jackson,East,10841,39.102024,-94.545354,Property,Buildings,Construction,NULL,2021-04-06,2024-01-30 20:56:04,DAMG7370_Lakshmi
141160,2020051544,"WEB  ",City Managers Office,City Managers Office-KCPD-,Police,Other,04/11/2020,11:48 PM,"OPEN ",N,NULL,NULL,4412 Garfield Ave,64130,Ivanhoe Southeast,Jackson,Central,137285,39.046097,-94.560219,Public Safety,NULL,NULL,NULL,2020-04-11,2024-01-30 20:56:04,DAMG7370_Lakshmi
56380,2020008364,PHONE,NHS,NHS-Solid Waste-,Trash Collection,Missed by Contractor South,01/21/2020,09:45 AM,"OPEN ",N,NULL,NULL,6206 E 95th Ter,64134,Fairlane,Jackson,South,56460,38.952027,-94.516925,Trash,Recycling,NULL,NULL,2020-01-21,2024-01-30 20:56:04,DAMG7370_Lakshmi
191016,2019163241,PHONE,NHS,NHS-Solid Waste-Administration,Services,Feedback,09/09/2019,03:59 PM,"OPEN ",N,NULL,NULL,5811 Charlotte St,64110,Western 49-63,Jackson,Metro,145181,39.021319,-94.577289,Trash,Recycling,NULL,NULL,2019-09-09,2024-01-30 20:56:04,DAMG7370_Lakshmi
187651,2016035883,PHONE,NHS,NHS-Neighborhood Preservation-,Property Maintenance,Other Property Issue,04/07/2016,04:29 PM,"OPEN ",Y,NULL,NULL,5412 Virginia Ave,64110,Eastern 49-63,Jackson,Metro,146378,39.02834,-94.570572,Property,Buildings,Construction,NULL,2016-04-07,2024-01-30 20:56:04,DAMG7370_Lakshmi
126075,2020017541,PHONE,NHS,NHS-Neighborhood Preservation-,Property Maintenance,Main Structure,02/04/2020,03:39 PM,"OPEN ",N,NULL,NULL,8321 Manchester Ave,64138,Park Farms,Jackson,Metro,53920,38.972939,-94.497382,Property,Buildings,Construction,NULL,2020-02-04,2024-01-30 20:56:04,DAMG7370_Lakshmi
30778,2014067495,PHONE,NHS,NHS-Neighborhood Preservation-,Property Maintenance,Other Property Issue,05/30/2014,02:36 PM,"OPEN ",Y,NULL,NULL,5540 BELLEFONTAINE AVE,64130,North Town Fork Creek,Jackson,Metro,36475,39.024877,-94.549491,Property,Buildings,Construction,NULL,2014-05-30,2024-01-30 20:56:04,DAMG7370_Lakshmi
1383950,2018089439,PHONE,NHS,NHS-Dangerous Buildings-,Dangerous Building,Standard,07/09/2018,08:50 AM,"OPEN ",Y,NULL,NULL,5337 EUCLID AVE,64130,Blue Hills,Jackson,Metro,145750,39.029018,-94.561678,Property,Buildings,Construction,NULL,2018-07-09,2024-01-30 20:56:06,DAMG7370_Lakshmi
171084,2020157133,PHONE,NHS,NHS-Neighborhood Preservation-,Nuisance,Trash on Private Property,12/21/2020,10:01 AM,"OPEN ",N,NULL,NULL,319 W 79th Ter,64114,Waldo Homes,Jackson,Metro,118878,38.983884,-94.593769,Trash,Recycling,NULL,NULL,2020-12-21,2024-01-30 20:56:04,DAMG7370_Lakshmi
44582,2018097708,PHONE,NHS,NHS-Neighborhood Preservation-,Parked on Unapproved Surface,Car Private Property,07/20/2018,02:50 PM,"OPEN ",Y,NULL,NULL,2636 Euclid Ave,64127,Wendell Phillips,Jackson,Central,14560,39.077798,-94.559731,Vehicles,Parking,NULL,NULL,2018-07-20,2024-01-30 20:56:04,DAMG7370_Lakshmi
49125,2013074689,PHONE,NHS,NHS-Neighborhood Preservation-,Private / Commercial,Lot - Vacant,06/03/2013,11:55 AM,"OPEN ",Y,NULL,NULL,2916 Highland Ave,64109,Mount Hope,Jackson,Central,27520,39.073218,-94.563424,Mowing,Weeds,NULL,NULL,2013-06-03,2024-01-30 20:56:04,DAMG7370_Lakshmi
122889,2020083096,PHONE,NHS,NHS-Neighborhood Preservation-,Property Maintenance,Other Property Issue,06/16/2020,08:59 AM,"OPEN ",N,NULL,NULL,2208 E 58th St,64130,Blue Hills,Jackson,Metro,148345,39.021478,-94.559501,Property,Buildings,Construction,NULL,2020-06-16,2024-01-30 20:56:04,DAMG7370_Lakshmi
56474,2020078467,EMAIL,Public Works,Public Works-Capital Projects-Traffic Control,Traffic Sign,New Sign Request,06/06/2020,11:31 AM,"OPEN ",N,NULL,NULL,4306 Bell St,64111,West Plaza,Jackson,Central,141361,39.049813,-94.606701,Signs,NULL,NULL,NULL,2020-06-06,2024-01-30 20:56:04,DAMG7370_Lakshmi
972500,2014068080,"SYS  ",NHS,NHS-Neighborhood Preservation-,Private Property,All,06/02/2014,10:32 AM,"OPEN ",Y,NULL,NULL,416 OAKLEY AVE,64123,South Indian Mound,Jackson,East,45393,39.108098,-94.516953,Property Violations,NULL,NULL,NULL,2014-06-02,2024-01-30 20:56:05,DAMG7370_Lakshmi
113247,2018064276,PHONE,NHS,NHS-Neighborhood Preservation-,Property Maintenance,Main Structure,05/21/2018,01:11 PM,"OPEN ",Y,NULL,NULL,9105 STARK AVE,64138,White Oak,Jackson,South,68387,38.957705,-94.48508,Property,Buildings,Construction,NULL,2018-05-21,2024-01-30 20:56:04,DAMG7370_Lakshmi
154550,2020086195,PHONE,NHS,NHS-Neighborhood Preservation-,Private / Commercial,Lot - Structure,06/22/2020,03:51 PM,"OPEN ",Y,NULL,NULL,1601 W 75th St,64114,Ward Parkway,Jackson,Metro,120381,38.99276,-94.607186,Mowing,Weeds,NULL,NULL,2020-06-22,2024-01-30 20:56:04,DAMG7370_Lakshmi
161154,2020054290,PHONE,NHS,NHS-Solid Waste-,Trash Collection,Missed by City,04/17/2020,10:02 AM,"OPEN ",N,NULL,NULL,5908 Charlotte St,64110,Western 49-63,Jackson,Metro,105776,39.019657,-94.578032,Trash,Recycling,NULL,NULL,2020-04-17,2024-01-30 20:56:04,DAMG7370_Lakshmi
1018331,2015006703,PHONE,NHS,NHS-Neighborhood Preservation-,Property Maintenance,Main Structure,01/21/2015,11:18 AM,"OPEN ",Y,NULL,NULL,338 Oakley Ave,64123,South Indian Mound,Jackson,East,44663,39.109172,-94.516885,Property,Buildings,Construction,NULL,2015-01-21,2024-01-30 20:56:05,DAMG7370_Lakshmi
176941,2020103494,PHONE,Water Services,Water Services-Meter and Field Services-,No Water / Pressure,No Water,07/29/2020,11:25 AM,"OPEN ",N,NULL,NULL,10719 N McKinley St,64157,Shoal Creek,Clay,Shoal Creek,99048,39.285963,-94.472954,Water,NULL,NULL,NULL,2020-07-29,2024-01-30 20:56:04,DAMG7370_Lakshmi
155344,2020116376,PHONE,NHS,NHS-Neighborhood Preservation-,Property Maintenance,Main Structure,08/27/2020,12:18 PM,"OPEN ",Y,NULL,NULL,5014 Bellefontaine Ave,64130,North Town Fork Creek,Jackson,Metro,35378,39.0348,-94.549221,Property,Buildings,Construction,NULL,2020-08-27,2024-01-30 20:56:04,DAMG7370_Lakshmi
139907,2020018868,PHONE,NHS,NHS-Neighborhood Preservation-,Property Maintenance,Main Structure,02/07/2020,07:07 AM,"OPEN ",N,NULL,NULL,7732 Walnut St,64114,Tower Homes,Jackson,Metro,118550,38.987249,-94.588931,Property,Buildings,Construction,NULL,2020-02-07,2024-01-30 20:56:04,DAMG7370_Lakshmi
50561,2019187129,PHONE,NHS,NHS-Neighborhood Preservation-,Private / Commercial,Lot - Structure,10/31/2019,09:31 AM,"OPEN ",N,NULL,NULL,3903 Forest Ave,64110,Manheim Park,Jackson,Central,135621,39.055768,-94.57052,Mowing,Weeds,NULL,NULL,2019-10-31,2024-01-30 20:56:04,DAMG7370_Lakshmi
67345,2020124033,EMAIL,NHS,NHS-Neighborhood Preservation-,Property Maintenance,Other Property Issue,09/15/2020,04:28 PM,"OPEN ",N,NULL,NULL,3608 Lexington Ave,64124,Scarritt Point,Jackson,East,41695,39.110661,-94.538348,Property,Buildings,Construction,NULL,2020-09-15,2024-01-30 20:56:04,DAMG7370_Lakshmi
1483915,2019052277,"WEB  ",NHS,NHS-Neighborhood Preservation-,Nuisance,Trash on Private Property,03/13/2019,04:57 PM,"OPEN ",Y,NULL,NULL,528 ASKEW AVE,64124,Scarritt Point,Jackson,East,41952,39.106304,-94.539227,Trash,Recycling,NULL,NULL,2019-03-13,2024-01-30 20:56:06,DAMG7370_Lakshmi
193193,2017088652,PHONE,Water Services,Water Services-Administration-,Services,Service Issue / Problem,07/18/2017,06:03 PM,"OPEN ",N,NULL,NULL,1850 E 77TH TER,64132,East Meyer 7,NULL,Metro,115753,38.98621,-94.563608,Water,NULL,NULL,NULL,2017-07-18,2024-01-30 20:56:04,DAMG7370_Lakshmi
106595,2020049632,PHONE,NHS,NHS-Neighborhood Preservation-,Property Maintenance,Other Property Issue,04/08/2020,09:50 AM,"OPEN ",Y,NULL,NULL,2305 Michigan Ave,64127,Wendell Phillips,Jackson,Central,14315,39.084365,-94.559943,Property,Buildings,Construction,NULL,2020-04-08,2024-01-30 20:56:04,DAMG7370_Lakshmi
1374799,2018064315,"SYS  ",NHS,NHS-Neighborhood Preservation-,Property Maintenance,Other Property Issue,05/21/2018,01:49 PM,"OPEN ",Y,NULL,NULL,4063 E 69TH TER,64132,Foxtown East,Jackson,Metro,2549,38.99977,-94.538595,Property,Buildings,Construction,NULL,2018-05-21,2024-01-30 20:56:06,DAMG7370_Lakshmi
113238,2020153798,PHONE,NHS,NHS-Neighborhood Preservation-,Nuisance,Trash on Private Property,12/09/2020,12:02 PM,"OPEN ",Y,NULL,NULL,4012 Vineyard Rd,64130,Vineyard,Jackson,East,32131,39.052379,-94.525671,Trash,Recycling,NULL,NULL,2020-12-09,2024-01-30 20:56:04,DAMG7370_Lakshmi
129718,2020017284,PHONE,NHS,NHS-Neighborhood Preservation-,Property Maintenance,Other Property Issue,02/04/2020,11:09 AM,"OPEN ",Y,NULL,NULL,3226 Karnes Blvd,64111,Coleman Highlands,Jackson,Central,129312,39.068542,-94.596352,Property,Buildings,Construction,NULL,2020-02-04,2024-01-30 20:56:04,DAMG7370_Lakshmi
91908,2017066618,PHONE,NHS,NHS-Neighborhood Preservation-,Private / Commercial,Lot - Structure,06/06/2017,01:52 PM,"OPEN ",Y,NULL,NULL,3944 FLORA AVE,64110,Ivanhoe Southwest,Jackson,Central,135511,39.05429,-94.566722,Mowing,Weeds,NULL,NULL,2017-06-06,2024-01-30 20:56:04,DAMG7370_Lakshmi
122952,2020124731,"WEB  ",NHS,NHS-Neighborhood Preservation-,Private / Commercial,Lot - Structure,09/16/2020,05:52 PM,"OPEN ",N,NULL,NULL,8210 Oak St,64114,Waldo Homes,Jackson,Metro,119095,38.978336,-94.586197,Mowing,Weeds,NULL,NULL,2020-09-16,2024-01-30 20:56:04,DAMG7370_Lakshmi
1359389,2018053474,PHONE,NHS,NHS-Neighborhood Preservation-,Property Maintenance,Other Property Issue,05/01/2018,12:45 PM,"OPEN ",Y,NULL,NULL,4044 Bellefontaine Ave,64130,Oak Park Southwest,Jackson,East,29515,39.051881,-94.548387,Property,Buildings,Construction,NULL,2018-05-01,2024-01-30 20:56:06,DAMG7370_Lakshmi
147088,2020019380,PHONE,NHS,NHS-Neighborhood Preservation-,Property Maintenance,Main Structure,02/07/2020,03:12 PM,"OPEN ",N,NULL,NULL,2621 Agnes Ave,64127,Washington Wheatley,Jackson,East,16633,39.077933,-94.547429,Property,Buildings,Construction,NULL,2020-02-07,2024-01-30 20:56:04,DAMG7370_Lakshmi
134476,2020001329,EMAIL,City Planning and Development,City Planning and Development-Dev Comp-Zoning,Commercial Signs / Ads,Billboard,01/03/2020,04:30 PM,"OPEN ",Y,NULL,NULL,3608 Main St,64111,Hanover Place,Jackson,Central,251992,39.061559,-94.586231,Signs,NULL,NULL,NULL,2020-01-03,2024-01-30 20:56:04,DAMG7370_Lakshmi
30728,2018102731,PHONE,NHS,NHS-Neighborhood Preservation-,Nuisance,Trash on Private Property,08/01/2018,08:35 AM,"OPEN ",Y,NULL,NULL,2628 Cleveland Ave,64127,Washington Wheatley,Jackson,East,17285,39.077361,-94.539029,Trash,Recycling,NULL,NULL,2018-08-01,2024-01-30 20:56:04,DAMG7370_Lakshmi
115586,2020030946,"WEB  ",NHS,NHS-Neighborhood Preservation-,Property Maintenance,Main Structure,03/01/2020,10:42 AM,"OPEN ",N,NULL,NULL,5241 Wayne Ave,64110,Blue Hills,Jackson,Metro,146242,39.030793,-94.566257,Property,Buildings,Construction,NULL,2020-03-01,2024-01-30 20:56:04,DAMG7370_Lakshmi
44269,2020092105,PHONE,NHS,NHS-Neighborhood Preservation-,Nuisance,Trash on Private Property,07/06/2020,02:11 PM,"OPEN ",Y,NULL,NULL,7026 Bales Ave,64132,Self Help Neighborhood Council,Jackson,Metro,2405,38.998926,-94.546694,Trash,Recycling,NULL,NULL,2020-07-06,2024-01-30 20:56:04,DAMG7370_Lakshmi
50370,2021014650,PHONE,Water Services,Water Services-Administration-,Services,Service Issue / Problem,02/16/2021,10:44 AM,"OPEN ",N,NULL,NULL,1639 Guinotte Ave,64120,Northeast Industrial District,Jackson,Central,39635,39.115954,-94.562311,Water,NULL,NULL,NULL,2021-02-16,2024-01-30 20:56:04,DAMG7370_Lakshmi
58939,2020064174,EMAIL,Parks and Rec,Parks and Rec-North Region-,Right of Way (ROW),Region - North,05/07/2020,04:43 PM,"OPEN ",N,NULL,NULL,393 NE 94th,64155,Sherrydale,Clay,North,283874,35.797519,-103.890579,Mowing,Weeds,NULL,NULL,2020-05-07,2024-01-30 20:56:04,DAMG7370_Lakshmi
1476693,2019034206,PHONE,NHS,NHS-Neighborhood Preservation-,Property Maintenance,Main Structure,02/14/2019,02:36 PM,"OPEN ",Y,NULL,NULL,8252 Paseo,64131,Marlborough Heights/Marlborough Pride,Jackson,Metro,116768,38.977206,-94.56754,Property,Buildings,Construction,NULL,2019-02-14,2024-01-30 20:56:06,DAMG7370_Lakshmi
11648,2021025426,"SYS  ",NHS,NHS-Neighborhood Preservation-,Property Maintenance,Other Property Issue,04/14/2021,11:23 AM,"OPEN ",N,NULL,NULL,7100 E 86th St,64138,Oldham Farms,Jackson,Metro,55282,38.969414,-94.505609,Property,Buildings,Construction,NULL,2021-04-14,2024-01-30 20:56:04,DAMG7370_Lakshmi
102035,2020110223,PHONE,NHS,NHS-Neighborhood Preservation-,Property Maintenance,Main Structure,08/13/2020,10:05 AM,"OPEN ",N,NULL,NULL,8327 Madison Ave,64114,West Waldo,Jackson,Metro,121319,38.977187,-94.600418,Property,Buildings,Construction,NULL,2020-08-13,2024-01-30 20:56:04,DAMG7370_Lakshmi
8818,2015120443,"WEB  ",NHS,NHS-Neighborhood Preservation-,Private / Commercial,Lot - Structure,10/06/2015,04:32 AM,"OPEN ",Y,NULL,NULL,6502 Paseo,64131,Neighbors United For Action,Jackson,Metro,105481,39.009195,-94.568788,Mowing,Weeds,NULL,NULL,2015-10-06,2024-01-30 20:56:04,DAMG7370_Lakshmi
31849,2020004864,"WEB  ",NHS,NHS-Solid Waste-Illegal Dumping,Early Set Out,South,01/13/2020,07:24 AM,"OPEN ",Y,NULL,NULL,2125 E 70th Ter,64132,Blenheim Square Research Hospital,Jackson,Metro,114130,38.998903,-94.561665,Trash,Recycling,NULL,NULL,2020-01-13,2024-01-30 20:56:04,DAMG7370_Lakshmi
145868,2020035008,"BOT  ",Public Works,Public Works-Street and Traffic-District 3,Pothole,District 3,03/09/2020,08:08 AM,"OPEN ",N,NULL,NULL,4912 E Red Bridge Rd,64137,Royal Oaks,Jackson,South,61077,38.924188,-94.532534,Streets,Roadways,Alleys,NULL,2020-03-09,2024-01-30 20:56:04,DAMG7370_Lakshmi
172807,2020102521,PHONE,NHS,NHS-Neighborhood Preservation-,Property Maintenance,Main Structure,07/27/2020,02:51 PM,"OPEN ",N,NULL,NULL,1921 E 83rd Ter,64132,Marlborough Heights/Marlborough Pride,Jackson,Metro,122137,38.975105,-94.565217,Property,Buildings,Construction,NULL,2020-07-27,2024-01-30 20:56:04,DAMG7370_Lakshmi
30654,2020036519,"WEB  ",NHS,NHS-Neighborhood Preservation-,Property Maintenance,Main Structure,03/10/2020,04:45 PM,"OPEN ",Y,NULL,NULL,5746 Woodland Ave,64110,Blue Hills,Jackson,Metro,147401,39.02159,-94.565129,Property,Buildings,Construction,NULL,2020-03-10,2024-01-30 20:56:04,DAMG7370_Lakshmi
174162,2021023486,PHONE,NHS,NHS-Neighborhood Preservation-,Disabled/Unlicensed on Private Property,Car Private Property,03/12/2021,01:21 PM,"OPEN ",N,NULL,NULL,4501 NE 48th Ter,64119,Glenhaven,Clay,Shoal Creek,81212,39.182618,-94.526374,Vehicles,Parking,NULL,NULL,2021-03-12,2024-01-30 20:56:04,DAMG7370_Lakshmi
1554520,2019165521,PHONE,NHS,NHS-Neighborhood Preservation-,Private / Commercial,Lot - Vacant,09/13/2019,10:03 AM,"OPEN ",N,NULL,NULL,2008 E 41st St,64130,Ivanhoe Southeast,Jackson,Central,136689,39.052291,-94.560199,Mowing,Weeds,NULL,NULL,2019-09-13,2024-01-30 20:56:06,DAMG7370_Lakshmi
8917,2018141301,"WEB  ",NHS,NHS-Neighborhood Preservation-,Nuisance,Trash on Private Property,10/21/2018,07:56 AM,"OPEN ",Y,NULL,NULL,7704 Longview Rd,64134,Ruskin Heights,Jackson,South,72581,38.915135,-94.501784,Trash,Recycling,NULL,NULL,2018-10-21,2024-01-30 20:56:04,DAMG7370_Lakshmi
1387765,2018097609,PHONE,NHS,NHS-Neighborhood Preservation-,Private / Commercial,Lot - Structure,07/20/2018,12:59 PM,"OPEN ",Y,NULL,NULL,2805 E 6th St,64124,Independence Plaza,Jackson,East,10427,39.105057,-94.54795,Mowing,Weeds,NULL,NULL,2018-07-20,2024-01-30 20:56:06,DAMG7370_Lakshmi
138239,2020033537,"WEB  ",NHS,NHS-Neighborhood Preservation-,Nuisance,Trash on Private Property,03/05/2020,10:15 AM,"OPEN ",Y,NULL,NULL,432 Montgall Ave,64124,Pendleton Heights,Jackson,Central,41016,39.108889,-94.549364,Trash,Recycling,NULL,NULL,2020-03-05,2024-01-30 20:56:04,DAMG7370_Lakshmi
48910,2019200616,"WEB  ",City Managers Office,City Managers Office-311 Call Center-Support,Public Works,Service Issue / Problem,12/06/2019,10:37 AM,"OPEN ",Y,NULL,NULL,401 White Ave,64123,South Indian Mound,Jackson,East,46257,39.108456,-94.511358,Capital Projects,NULL,NULL,NULL,2019-12-06,2024-01-30 20:56:04,DAMG7370_Lakshmi
780407,2012058545,PHONE,NHS,NHS-Dangerous Buildings-,Dangerous Building,Standard,05/04/2012,08:27 AM,"OPEN ",Y,NULL,NULL,1826 FOREST AVE,64108,NULL,Jackson,Central,13345,39.090598,-94.569372,Property,Buildings,Construction,NULL,2012-05-04,2024-01-30 20:56:05,DAMG7370_Lakshmi
130393,2020017918,PHONE,NHS,NHS-Neighborhood Preservation-,Nuisance,Trash on Private Property,02/05/2020,10:39 AM,"OPEN ",Y,NULL,NULL,633 W 88th Ter,64114,Western Hills,Jackson,Metro,148985,38.967877,-94.599825,Trash,Recycling,NULL,NULL,2020-02-05,2024-01-30 20:56:04,DAMG7370_Lakshmi
75868,2020064047,EMAIL,NHS,NHS-Neighborhood Preservation-,Private Property,Dead,05/07/2020,03:05 PM,"OPEN ",Y,NULL,NULL,1333 E 84th Ter,64131,Marlborough Heights/Marlborough Pride,Jackson,Metro,122392,38.973868,-94.572746,Trees,NULL,NULL,NULL,2020-05-07,2024-01-30 20:56:04,DAMG7370_Lakshmi
1520651,2019104040,PHONE,NHS,NHS-Neighborhood Preservation-,Property Maintenance,Other Property Issue,05/30/2019,02:42 PM,"OPEN ",Y,NULL,NULL,3726 Cleveland Ave,64128,Palestine West And Oak Park Northeast,Jackson,East,28107,39.057537,-94.539973,Property,Buildings,Construction,NULL,2019-05-30,2024-01-30 20:56:06,DAMG7370_Lakshmi
78609,2020123126,PHONE,NHS,NHS-Neighborhood Preservation-,Property Maintenance,Other Property Issue,09/14/2020,01:11 PM,"OPEN ",N,NULL,NULL,2408 E 68th St,64132,Blenheim Square Research Hospital,Jackson,Metro,113773,39.003818,-94.558422,Property,Buildings,Construction,NULL,2020-09-14,2024-01-30 20:56:04,DAMG7370_Lakshmi
184451,2020148620,PHONE,NHS,NHS-Dangerous Buildings-,Dangerous Building,Standard,11/23/2020,11:28 AM,"OPEN ",N,NULL,NULL,3337 Flora Ave,64109,Linwood Homeowners-Ivanhoe,Jackson,Central,126000,39.065274,-94.565427,Property,Buildings,Construction,NULL,2020-11-23,2024-01-30 20:56:04,DAMG7370_Lakshmi
1222325,2017012925,PHONE,NHS,NHS-Neighborhood Preservation-,Property Maintenance,Other Property Issue,02/02/2017,03:49 PM,"OPEN ",Y,NULL,NULL,4414 THOMPSON AVE,64124,South Indian Mound,Jackson,East,44420,39.107553,-94.52979,Property,Buildings,Construction,NULL,2017-02-02,2024-01-30 20:56:05,DAMG7370_Lakshmi
1562617,2018151257,"WEB  ",NHS,NHS-Neighborhood Preservation-,Parked on Unapproved Surface,Car Private Property,11/15/2018,08:12 AM,"OPEN ",Y,NULL,NULL,8033 Wabash Ave,64132,Marlborough Heights/Marlborough Pride,Jackson,Metro,117017,38.980589,-94.559003,Vehicles,Parking,NULL,NULL,2018-11-15,2024-01-30 20:56:06,DAMG7370_Lakshmi
108911,2018148941,"WEB  ",NHS,NHS-Neighborhood Preservation-,Property Maintenance,Main Structure,11/07/2018,03:48 PM,"OPEN ",Y,NULL,NULL,5701 Bales Ave,64130,North Town Fork Creek,Jackson,Metro,37177,39.022108,-94.544843,Property,Buildings,Construction,NULL,2018-11-07,2024-01-30 20:56:04,DAMG7370_Lakshmi
9303,2020022034,PHONE,Water Services,Water Services-Meter and Field Services-,Leak,Meter,02/12/2020,06:06 PM,"OPEN ",N,NULL,NULL,12508 E 56th St,64133,Fairway Hills,Jackson,East,228950,39.020629,-94.433731,Water,NULL,NULL,NULL,2020-02-12,2024-01-30 20:56:04,DAMG7370_Lakshmi
144829,2020142398,PHONE,Public Works,Public Works-Capital Projects-Signs,Markings / Paint,Lane Lines,11/04/2020,12:49 PM,"OPEN ",N,NULL,NULL,4725 Prospect Ave,64130,North Town Fork Creek,Jackson,East,35013,39.039621,-94.554064,Streets,Roadways,Alleys,NULL,2020-11-04,2024-01-30 20:56:04,DAMG7370_Lakshmi
188329,2018114456,"WEB  ",NHS,NHS-Neighborhood Preservation-,Property Maintenance,Other Property Issue,08/26/2018,04:20 AM,"OPEN ",Y,NULL,NULL,3303 NE 43rd St,64117,Chaumiere,Clay,Shoal Creek,77385,39.17098,-94.540999,Property,Buildings,Construction,NULL,2018-08-26,2024-01-30 20:56:04,DAMG7370_Lakshmi
197835,2018049544,PHONE,City Managers Office,City Managers Office-311 Call Center-Administratio,Bulky Pick Up,Address Validation,04/23/2018,04:03 PM,"OPEN ",N,NULL,NULL,9412 N DALTON AVE,64154,KCI & 2nd Creek,Platte,North,263973,39.265536,-94.647884,Trash,Recycling,NULL,NULL,2018-04-23,2024-01-30 20:56:04,DAMG7370_Lakshmi
115993,2019054945,PHONE,NHS,NHS-Neighborhood Preservation-Administration,NHS (Neighborhood Housing Services),No Known Property Owner,03/18/2019,12:48 PM,"OPEN ",Y,NULL,NULL,4210 St John Ave,64123,North Indian Mound,Jackson,East,43574,39.11322,-94.532022,Government,NULL,NULL,NULL,2019-03-18,2024-01-30 20:56:04,DAMG7370_Lakshmi
1404289,2018120325,"WEB  ",NHS,NHS-Neighborhood Preservation-,Nuisance,Trash on Private Property,09/07/2018,09:52 AM,"OPEN ",Y,NULL,NULL,2217 Drury Ave,64127,South Blue Valley,Jackson,East,18054,39.084389,-94.518363,Trash,Recycling,NULL,NULL,2018-09-07,2024-01-30 20:56:06,DAMG7370_Lakshmi
183054,2021005598,"WEB  ",NHS,NHS-Neighborhood Preservation-,Obstructed / Closure,Blocked,01/16/2021,05:06 PM,"OPEN ",Y,NULL,NULL,2712 Campbell St,64109,Longfellow,Jackson,Central,262144,39.077346,-94.574106,Sidewalks,Curbs,Ditch,NULL,2021-01-16,2024-01-30 20:56:04,DAMG7370_Lakshmi
871700,2013072380,"WEB  ",NHS,NHS-Neighborhood Preservation-,Private Property,All,05/29/2013,06:57 PM,"OPEN ",Y,NULL,NULL,7220 CLEVELAND AVE,64132,Noble And Gregory Ridge,Jackson,Metro,4094,38.994856,-94.543416,Property Violations,NULL,NULL,NULL,2013-05-29,2024-01-30 20:56:05,DAMG7370_Lakshmi
65426,2020064649,"WEB  ",NHS,NHS-Neighborhood Preservation-,Private / Commercial,Lot - Structure,05/08/2020,12:59 PM,"OPEN ",Y,NULL,NULL,6200 E 99th St,64134,Fairlane,Jackson,South,56763,38.945783,-94.517423,Mowing,Weeds,NULL,NULL,2020-05-08,2024-01-30 20:56:04,DAMG7370_Lakshmi
52606,2020136544,PHONE,NHS,NHS-Neighborhood Preservation-,Private / Commercial,Lot - Structure,10/16/2020,12:01 PM,"OPEN ",N,NULL,NULL,4075 Vineyard Dr,64130,Vineyard,Jackson,East,31890,39.050366,-94.530012,Mowing,Weeds,NULL,NULL,2020-10-16,2024-01-30 20:56:04,DAMG7370_Lakshmi
64377,2020025365,"WEB  ",NHS,NHS-Neighborhood Preservation-,Property Maintenance,Main Structure,02/19/2020,09:25 PM,"OPEN ",N,NULL,NULL,3949 St John Ave,64123,Scarritt Point,Jackson,East,41584,39.112725,-94.534791,Property,Buildings,Construction,NULL,2020-02-19,2024-01-30 20:56:04,DAMG7370_Lakshmi
993450,2014112138,"WEB  ",NHS,NHS-Neighborhood Preservation-,Private / Commercial,Lot - Structure,08/28/2014,12:36 PM,"OPEN ",Y,NULL,NULL,9605 RICHMOND AVE,64134,Bannister Acres,Jackson,South,69552,38.949321,-94.502217,Mowing,Weeds,NULL,NULL,2014-08-28,2024-01-30 20:56:05,DAMG7370_Lakshmi
147038,2020072295,PHONE,NHS,NHS-Neighborhood Preservation-,Disabled/Unlicensed on Private Property,Car Private Property,05/26/2020,11:30 AM,"OPEN ",N,NULL,NULL,2812 E 73rd St,64132,Noble And Gregory Ridge,Jackson,Metro,3583,38.994573,-94.554088,Vehicles,Parking,NULL,NULL,2020-05-26,2024-01-30 20:56:04,DAMG7370_Lakshmi
81756,2020045705,PHONE,Health,Health-Healthy Homes-,Services,Healthy Homes Information,03/31/2020,11:34 AM,"OPEN ",N,NULL,NULL,3432 Gillham Rd,64111,Broadway Gillham,Jackson,Central,127893,39.064371,-94.581191,Public Health,NULL,NULL,NULL,2020-03-31,2024-01-30 20:56:04,DAMG7370_Lakshmi
165509,2020146105,PHONE,Health,Health-Communicable Disease Control-,Disease Control,All,11/16/2020,03:01 PM,"OPEN ",N,NULL,NULL,11901 Wornall Rd,64114,Red Bridge South,Jackson,South,157321,38.912186,-94.591416,Public Health,NULL,NULL,NULL,2020-11-16,2024-01-30 20:56:04,DAMG7370_Lakshmi
165025,2020157101,PHONE,Public Works,Public Works-Street and Traffic-Administration,Street Services,Service Issue / Problem,12/21/2020,09:25 AM,"OPEN ",N,NULL,NULL,908 Grand Blvd,64106,CBD Downtown,Jackson,Central,12760,39.103304,-94.581126,Streets,Roadways,Alleys,NULL,2020-12-21,2024-01-30 20:56:04,DAMG7370_Lakshmi
94986,2013067637,PHONE,NHS,NHS-Neighborhood Preservation-,Private Property,Tree Debris,05/21/2013,11:13 AM,"OPEN ",Y,NULL,NULL,1701 E 36th St,64109,Linwood Homeowners-Ivanhoe,Jackson,Central,134649,39.060959,-94.563535,Trees,NULL,NULL,NULL,2013-05-21,2024-01-30 20:56:04,DAMG7370_Lakshmi
117264,2020099872,PHONE,City Planning and Development,City Planning and Development-Dev Comp-Zoning,Land Use / Zoning Issue,Number of Dwelling Units,07/21/2020,01:25 PM,"OPEN ",Y,NULL,NULL,301 N Quincy Ave,64123,North Indian Mound,Jackson,East,42792,39.114485,-94.521741,Property,Buildings,Construction,NULL,2020-07-21,2024-01-30 20:56:04,DAMG7370_Lakshmi
103913,2020068017,PHONE,Water Services,Water Services-Meter and Field Services-,No Water / Pressure,Low Pressure,05/15/2020,01:16 PM,"OPEN ",N,NULL,NULL,943 W 33rd Ter,64111,Coleman Highlands,Jackson,Central,129480,39.066654,-94.598203,Water,NULL,NULL,NULL,2020-05-15,2024-01-30 20:56:04,DAMG7370_Lakshmi
30127,2020008802,"BOT  ",NHS,NHS-Solid Waste-,Trash Collection,Missed by Contractor South,01/21/2020,04:44 PM,"OPEN ",N,NULL,NULL,6206 E 99th St,64134,Fairlane,Jackson,South,56762,38.945731,-94.517035,Trash,Recycling,NULL,NULL,2020-01-21,2024-01-30 20:56:04,DAMG7370_Lakshmi
64686,2019190934,EMAIL,Water Services,Water Services-Line Maintenance-Wastewater,Sewer Backup / Leak,Outside,11/08/2019,05:58 PM,"OPEN ",N,NULL,NULL,14900 US 71 Hwy,64147,Richards Gebaur,Jackson,South,74994,38.855568,-94.530145,Storm Water,Sewer,NULL,NULL,2019-11-08,2024-01-30 20:56:04,DAMG7370_Lakshmi
125226,2018120992,"WEB  ",NHS,NHS-Neighborhood Preservation-,Private / Commercial,Lot - Structure,09/10/2018,08:41 AM,"OPEN ",Y,NULL,NULL,4433 Highland Ave,64110,Ivanhoe Southwest,Jackson,Central,137659,39.045636,-94.564235,Mowing,Weeds,NULL,NULL,2018-09-10,2024-01-30 20:56:04,DAMG7370_Lakshmi
32368,2020151187,PHONE,NHS,NHS-Neighborhood Preservation-,Property Maintenance,Main Structure,12/02/2020,10:51 AM,"OPEN ",N,NULL,NULL,5329 South Benton Ave,64130,North Town Fork Creek,Jackson,Metro,36190,39.028824,-94.551225,Property,Buildings,Construction,NULL,2020-12-02,2024-01-30 20:56:04,DAMG7370_Lakshmi
63160,2019137479,"WEB  ",NHS,NHS-Neighborhood Preservation-,Property Maintenance,Other Property Issue,07/23/2019,12:02 PM,"OPEN ",Y,NULL,NULL,446 Booth Ave,64125,North Blue Ridge,Jackson,East,46802,39.107988,-94.482359,Property,Buildings,Construction,NULL,2019-07-23,2024-01-30 20:56:04,DAMG7370_Lakshmi
77767,2020138595,PHONE,NHS,NHS-Neighborhood Preservation-Abatement,Land Bank,Tree Debris,10/22/2020,04:19 PM,"OPEN ",Y,NULL,NULL,2327 Bellefontaine Ave,64127,Washington Wheatley,Jackson,East,15918,39.083293,-94.54622,Trees,NULL,NULL,NULL,2020-10-22,2024-01-30 20:56:04,DAMG7370_Lakshmi
176789,2020101948,"WEB  ",NHS,NHS-Regulated Industries-,Regulated Industries,Question / Feedback,07/24/2020,04:48 PM,"OPEN ",N,NULL,NULL,901 E 27th St,64109,Longfellow,Jackson,Central,126802,39.077584,-94.573246,Public Safety,NULL,NULL,NULL,2020-07-24,2024-01-30 20:56:04,DAMG7370_Lakshmi
180051,2020129130,PHONE,NHS,NHS-Neighborhood Preservation-Abatement,Nuisance,Land Bank,09/28/2020,04:38 PM,"OPEN ",Y,NULL,NULL,3205 E 25th St,64127,Washington Wheatley,Jackson,East,16794,39.080305,-94.545339,Trash,Recycling,NULL,NULL,2020-09-28,2024-01-30 20:56:04,DAMG7370_Lakshmi
120393,2020072591,PHONE,NHS,NHS-Neighborhood Preservation-,Nuisance,Open Storage,05/26/2020,04:26 PM,"OPEN ",Y,NULL,NULL,1212 E 80th St,64131,Marlborough Heights/Marlborough Pride,Jackson,Metro,116666,38.983452,-94.574132,Trash,Recycling,NULL,NULL,2020-05-26,2024-01-30 20:56:04,DAMG7370_Lakshmi
41564,2018162962,PHONE,NHS,NHS-Neighborhood Preservation-,Property Maintenance,Main Structure,12/06/2018,08:54 AM,"OPEN ",Y,NULL,NULL,7002 E 102nd St,64134,Bannister Acres,Jackson,South,58409,38.939933,-94.507532,Property,Buildings,Construction,NULL,2018-12-06,2024-01-30 20:56:04,DAMG7370_Lakshmi
1530,2021011677,PHONE,NHS,NHS-Neighborhood Preservation-,Nuisance,Trash on Private Property,02/05/2021,07:54 AM,"OPEN ",Y,NULL,NULL,8309 E 110th St,64134,Ruskin Hills,Jackson,South,71440,38.923849,-94.494446,Trash,Recycling,NULL,NULL,2021-02-05,2024-01-30 20:56:04,DAMG7370_Lakshmi
1320320,2017151983,PHONE,NHS,NHS-Neighborhood Preservation-,Property Maintenance,Main Structure,12/05/2017,01:59 PM,"OPEN ",Y,NULL,NULL,4417 FOREST AVE,64110,Manheim Park,Jackson,Central,137724,39.046559,-94.571016,Property,Buildings,Construction,NULL,2017-12-05,2024-01-30 20:56:06,DAMG7370_Lakshmi
8032,2017057469,PHONE,NHS,NHS-Neighborhood Preservation-,Private / Commercial,Lot - Vacant,05/17/2017,11:15 AM,"OPEN ",Y,NULL,NULL,3709 Brooklyn Ave,64109,Ivanhoe Northeast,Jackson,Central,134366,39.05908,-94.557551,Mowing,Weeds,NULL,NULL,2017-05-17,2024-01-30 20:56:04,DAMG7370_Lakshmi
5214,2020089028,PHONE,NHS,NHS-Regulated Industries-,Regulated Industries,Alcohol Business,06/29/2020,08:25 AM,"OPEN ",N,NULL,NULL,6278 NW Barry Rd,64154,Coves North,Platte,North,160437,39.247554,-94.653324,Public Safety,NULL,NULL,NULL,2020-06-29,2024-01-30 20:56:04,DAMG7370_Lakshmi
1561077,2019170513,PHONE,NHS,NHS-Neighborhood Preservation-,Property Maintenance,Other Property Issue,09/24/2019,11:12 AM,"OPEN ",N,NULL,NULL,3928 South Benton Ave,64130,Oak Park Southwest,Jackson,East,29655,39.054275,-94.550523,Property,Buildings,Construction,NULL,2019-09-24,2024-01-30 20:56:06,DAMG7370_Lakshmi
86951,2016047276,"WEB  ",NHS,NHS-Neighborhood Preservation-,Parked on Unapproved Surface,Car Private Property,05/04/2016,02:08 PM,"OPEN ",Y,NULL,NULL,2901 Hunter Ave,64129,Western Blue Township,Jackson,East,47463,39.070776,-94.474682,Vehicles,Parking,NULL,NULL,2016-05-04,2024-01-30 20:56:04,DAMG7370_Lakshmi
207168,2019163624,PHONE,Public Works,Public Works-Capital Projects-Traffic Control,Markings / Paint,New Marking Request,09/10/2019,11:17 AM,"OPEN ",N,NULL,NULL,11801 Summit St,64114,Verona Hills,Jackson,South,156353,38.914048,-94.604144,Streets,Roadways,Alleys,NULL,2019-09-10,2024-01-30 20:56:04,DAMG7370_Lakshmi
161838,2020049523,"WEB  ",NHS,NHS-Neighborhood Preservation-,Property Maintenance,Graffiti,04/08/2020,08:18 AM,"OPEN ",Y,NULL,NULL,2001 Vine St,64108,Wendell Phillips,Jackson,Central,228107,39.087785,-94.562334,Property,Buildings,Construction,NULL,2020-04-08,2024-01-30 20:56:04,DAMG7370_Lakshmi
678316,2011051972,"SYS  ",NHS,NHS-Neighborhood Preservation-,Property Maintenance,Other Property Issue,02/28/2011,11:10 AM,"OPEN ",Y,NULL,NULL,7916 VIRGINIA AVE,64131,Marlborough Heights/Marlboroug,Jackson,Metro,116631,38.983522,-94.572512,Property,Buildings,Construction,NULL,2011-02-28,2024-01-30 20:56:05,DAMG7370_Lakshmi
51016,2019187154,PHONE,NHS,NHS-Neighborhood Preservation-,Private / Commercial,Lot - Structure,10/31/2019,09:40 AM,"OPEN ",N,NULL,NULL,2908 Flora Ave,64109,Mount Hope,Jackson,Central,27440,39.073561,-94.565724,Mowing,Weeds,NULL,NULL,2019-10-31,2024-01-30 20:56:04,DAMG7370_Lakshmi
138579,2020052833,PHONE,Public Works,Public Works-Capital Projects-Traffic Permits,Cut / Permit,District 1,04/14/2020,05:02 PM,"OPEN ",Y,NULL,NULL,6213 N Mattox Rd,64151,Parkdale And Walden,Platte,North,166777,39.20806,-94.645947,Streets,Roadways,Alleys,NULL,2020-04-14,2024-01-30 20:56:04,DAMG7370_Lakshmi
92982,2020096138,PHONE,NHS,NHS-Neighborhood Preservation-,Property Maintenance,Main Structure,07/14/2020,12:58 PM,"OPEN ",N,NULL,NULL,817 White Ave,64125,Sheffield,Jackson,East,5553,39.101995,-94.511093,Property,Buildings,Construction,NULL,2020-07-14,2024-01-30 20:56:04,DAMG7370_Lakshmi
55892,2020093596,PHONE,NHS,NHS-Neighborhood Preservation-,Property Maintenance,Main Structure,07/08/2020,03:50 PM,"OPEN ",N,NULL,NULL,2542 Wabash Ave,64127,Wendell Phillips,Jackson,Central,14665,39.079248,-94.553854,Property,Buildings,Construction,NULL,2020-07-08,2024-01-30 20:56:04,DAMG7370_Lakshmi
79401,2013108770,"WEB  ",NHS,NHS-Neighborhood Preservation-,Data Not Available,Data Not Available,08/04/2013,01:59 PM,"OPEN ",Y,NULL,NULL,1820 EWING AVE,64126,Central Blue Valley And Park Tower Gardens,Jackson,East,20868,39.08747,-94.503931,Data Not Available,NULL,NULL,NULL,2013-08-04,2024-01-30 20:56:04,DAMG7370_Lakshmi
173003,2020126999,"WEB  ",NHS,NHS-Neighborhood Preservation-,Private Property,Tree Debris,09/22/2020,02:18 PM,"OPEN ",Y,NULL,NULL,4720 Pittman Rd,64133,Stayton Meadows,Jackson,East,50112,39.035271,-94.462444,Trees,NULL,NULL,NULL,2020-09-22,2024-01-30 20:56:04,DAMG7370_Lakshmi
139699,2020051744,PHONE,Water Services,Water Services-Line Maintenance-Leaf Brush,Leaf / Brush,Missed Pick Up,04/13/2020,09:35 AM,"OPEN ",N,NULL,NULL,7319 Jarboe St,64114,Ward Parkway,Jackson,Metro,110940,38.995564,-94.601829,Trash,Recycling,NULL,NULL,2020-04-13,2024-01-30 20:56:04,DAMG7370_Lakshmi
110688,2020066350,"WEB  ",NHS,NHS-Neighborhood Preservation-,Property Maintenance,Main Structure,05/12/2020,04:06 PM,"OPEN ",N,NULL,NULL,210 Wyandotte St,64105,River Market,Jackson,Central,148502,39.109614,-94.586109,Property,Buildings,Construction,NULL,2020-05-12,2024-01-30 20:56:04,DAMG7370_Lakshmi
1259740,2017064281,"WEB  ",NHS,NHS-Neighborhood Preservation-,Property Maintenance,Main Structure,06/01/2017,09:47 AM,"OPEN ",Y,NULL,NULL,2044 Holly St,64102,Westside North,Jackson,Central,124068,39.088466,-94.598389,Property,Buildings,Construction,NULL,2017-06-01,2024-01-30 20:56:05,DAMG7370_Lakshmi
33012,2020022804,PHONE,NHS,NHS-Neighborhood Preservation-,Property Maintenance,Other Property Issue,02/14/2020,09:40 AM,"OPEN ",Y,NULL,NULL,1815 E 36th St,64109,Linwood Homeowners-Ivanhoe,Jackson,Central,133950,39.060865,-94.56168,Property,Buildings,Construction,NULL,2020-02-14,2024-01-30 20:56:04,DAMG7370_Lakshmi
153288,2016121265,PHONE,NHS,NHS-Neighborhood Preservation-Administration,NHS (Neighborhood Housing Services),No Known Property Owner,09/28/2016,04:30 PM,"OPEN ",Y,NULL,NULL,3013 Jarboe St,64108,Westside South,Jackson,Central,128843,39.072802,-94.597628,Government,NULL,NULL,NULL,2016-09-28,2024-01-30 20:56:04,DAMG7370_Lakshmi
114454,2020048732,PHONE,NHS,NHS-Neighborhood Preservation-,Property Maintenance,Other Property Issue,04/06/2020,04:25 PM,"OPEN ",N,NULL,NULL,4217 Chestnut Ave,64130,Oak Park Southwest,Jackson,East,29987,39.049244,-94.551266,Property,Buildings,Construction,NULL,2020-04-06,2024-01-30 20:56:04,DAMG7370_Lakshmi
182878,2021023057,PHONE,NHS,NHS-Neighborhood Preservation-,Nuisance,Open Storage,03/08/2021,11:50 AM,"OPEN ",Y,NULL,NULL,6008 Larson Ave,64133,Little Blue,Jackson,East,64588,39.012531,-94.43636,Trash,Recycling,NULL,NULL,2021-03-08,2024-01-30 20:56:04,DAMG7370_Lakshmi
152277,2020114458,PHONE,NHS,NHS-Neighborhood Preservation-,Private / Commercial,Lot - Vacant,08/24/2020,10:42 AM,"OPEN ",N,NULL,NULL,4129 Virginia Ave,64110,Manheim Park,Jackson,Central,135960,39.051441,-94.56854,Mowing,Weeds,NULL,NULL,2020-08-24,2024-01-30 20:56:04,DAMG7370_Lakshmi
78574,2020138443,PHONE,NHS,NHS-Neighborhood Preservation-,Property Maintenance,Other Property Issue,10/22/2020,11:56 AM,"OPEN ",N,NULL,NULL,2914 Nicholson Ave,64120,Northeast Industrial District,Jackson,East,38658,39.124429,-94.545341,Property,Buildings,Construction,NULL,2020-10-22,2024-01-30 20:56:04,DAMG7370_Lakshmi
160348,2021020955,"WEB  ",Public Works,Public Works-Street and Traffic-District 3,Pothole,District 3,02/28/2021,09:03 PM,"OPEN ",Y,NULL,NULL,1001 W 85th St,64114,Western Hills,Jackson,Metro,148601,38.974205,-94.602209,Streets,Roadways,Alleys,NULL,2021-02-28,2024-01-30 20:56:04,DAMG7370_Lakshmi
172747,2020131153,PHONE,NHS,NHS-Neighborhood Preservation-,Parked on Unapproved Surface,Other Private Property,10/02/2020,03:21 PM,"OPEN ",N,NULL,NULL,5343 N Virginia Ave,64118,Davidson,Clay,Shoal Creek,87005,39.192139,-94.563552,Vehicles,Parking,NULL,NULL,2020-10-02,2024-01-30 20:56:04,DAMG7370_Lakshmi
109214,2021002901,EMAIL,City Planning and Development,City Planning and Development-Dev Comp-Zoning,Commercial Vehicle,On Private Property,01/07/2021,03:43 PM,"OPEN ",Y,NULL,NULL,7957 NE 55th St,64119,Gracemor-Randolph Corners,Clay,Shoal Creek,90569,39.192146,-94.483905,Vehicles,Parking,NULL,NULL,2021-01-07,2024-01-30 20:56:04,DAMG7370_Lakshmi
44063,2019178738,PHONE,Water Services,Water Services-Line Maintenance-Wastewater,Sinkhole,Yard,10/11/2019,11:12 AM,"OPEN ",N,NULL,NULL,3939 Charlotte St,64110,South Hyde Park,Jackson,Central,133011,39.054876,-94.575364,Storm Water,Sewer,NULL,NULL,2019-10-11,2024-01-30 20:56:04,DAMG7370_Lakshmi
1557099,2019146773,PHONE,NHS,NHS-Neighborhood Preservation-,Nuisance,Trash on Private Property,08/08/2019,02:38 PM,"OPEN ",Y,NULL,NULL,713 N Agnes Ave,64120,Northeast Industrial District,Jackson,East,38929,39.121567,-94.545146,Trash,Recycling,NULL,NULL,2019-08-08,2024-01-30 20:56:06,DAMG7370_Lakshmi
56827,2019046542,PHONE,NHS,NHS-Neighborhood Preservation-,Property Maintenance,Other Property Issue,03/06/2019,08:42 AM,"OPEN ",Y,NULL,NULL,2817 Spruce Ave,64128,East Community Team South,Jackson,East,22395,39.073964,-94.533072,Property,Buildings,Construction,NULL,2019-03-06,2024-01-30 20:56:04,DAMG7370_Lakshmi
4828,2020103277,"WEB  ",NHS,NHS-Neighborhood Preservation-,Property Maintenance,Main Structure,07/28/2020,11:13 PM,"OPEN ",Y,NULL,NULL,8034 NE 50th St,64119,Gracemor-Randolph Corners,Clay,Shoal Creek,91151,39.185493,-94.485378,Property,Buildings,Construction,NULL,2020-07-28,2024-01-30 20:56:04,DAMG7370_Lakshmi
195471,2018033209,PHONE,NHS,NHS-Solid Waste-,Bulky Pick Up,Missed Pick Up,03/19/2018,02:32 PM,"OPEN ",N,NULL,NULL,4424 BENTON BLVD,64130,Oak Park Southwest,Jackson,East,34476,39.045258,-94.547596,Trash,Recycling,NULL,NULL,2018-03-19,2024-01-30 20:56:04,DAMG7370_Lakshmi
111150,2020110855,EMAIL,NHS,NHS-Neighborhood Preservation-,Property Maintenance,Other Property Issue,08/14/2020,10:53 AM,"OPEN ",N,NULL,NULL,712 E 43rd St,64110,South Hyde Park,Jackson,Central,133628,39.049192,-94.576403,Property,Buildings,Construction,NULL,2020-08-14,2024-01-30 20:56:04,DAMG7370_Lakshmi
196733,2017109082,PHONE,NHS,NHS-Neighborhood Preservation-,Property Maintenance,Main Structure,08/24/2017,06:33 PM,"OPEN ",Y,NULL,NULL,3217 Peery Ave,64127,Lykins,Jackson,East,10976,39.099237,-94.543553,Property,Buildings,Construction,NULL,2017-08-24,2024-01-30 20:56:04,DAMG7370_Lakshmi
122491,2020036217,PHONE,NHS,NHS-Neighborhood Preservation-,Nuisance,Trash on Private Property,03/10/2020,12:40 PM,"OPEN ",N,NULL,NULL,710 Belmont Ave,64125,Sheffield,Jackson,East,5507,39.10313,-94.509728,Trash,Recycling,NULL,NULL,2020-03-10,2024-01-30 20:56:04,DAMG7370_Lakshmi
22987,2019128510,PHONE,NHS,NHS-Neighborhood Preservation-,Property Maintenance,Main Structure,07/08/2019,06:47 PM,"OPEN ",Y,NULL,NULL,5416 E 29th St,64128,South Blue Valley,Jackson,East,21686,39.072612,-94.519206,Property,Buildings,Construction,NULL,2019-07-08,2024-01-30 20:56:04,DAMG7370_Lakshmi
1428294,2018144595,PHONE,NHS,NHS-Neighborhood Preservation-,Nuisance,Trash on Private Property,10/29/2018,08:32 AM,"OPEN ",Y,NULL,NULL,401 Jackson Ave,64124,South Indian Mound,Jackson,East,44453,39.109142,-94.532536,Trash,Recycling,NULL,NULL,2018-10-29,2024-01-30 20:56:06,DAMG7370_Lakshmi
124501,2020083296,PHONE,NHS,NHS-Neighborhood Preservation-,Nuisance,Trash on Private Property,06/16/2020,12:10 PM,"OPEN ",N,NULL,NULL,2536 College Ave,64127,Washington Wheatley,Jackson,East,16645,39.079093,-94.5449,Trash,Recycling,NULL,NULL,2020-06-16,2024-01-30 20:56:04,DAMG7370_Lakshmi
15859,2021025693,PHONE,NHS,NHS-Dangerous Buildings-,Dangerous Building,Standard,04/20/2021,08:14 AM,"OPEN ",N,NULL,NULL,2922 E 27th St,64127,Washington Wheatley,Jackson,East,16496,39.077114,-94.548115,Property,Buildings,Construction,NULL,2021-04-20,2024-01-30 20:56:04,DAMG7370_Lakshmi
177795,2021021772,"WEB  ",Public Works,Public Works-Street and Traffic-District 1,Pothole,District 1,03/02/2021,10:24 AM,"OPEN ",Y,NULL,NULL,9555 N Oak Trfy,64155,Gashland,Clay,Shoal Creek,99952,39.266923,-94.574397,Streets,Roadways,Alleys,NULL,2021-03-02,2024-01-30 20:56:04,DAMG7370_Lakshmi
134764,2020050059,"WEB  ",NHS,NHS-Neighborhood Preservation-,Property Maintenance,Main Structure,04/08/2020,04:26 PM,"OPEN ",Y,NULL,NULL,3401 South Benton Ave,64128,Oak Park Northwest,Jackson,East,25445,39.064192,-94.549329,Property,Buildings,Construction,NULL,2020-04-08,2024-01-30 20:56:04,DAMG7370_Lakshmi
122759,2020070451,PHONE,Water Services,Water Services-Administration-,Services,Service Issue / Problem,05/20/2020,04:01 PM,"OPEN ",N,NULL,NULL,3028 Drury Ave,64128,South Blue Valley,Jackson,East,22012,39.069969,-94.519706,Water,NULL,NULL,NULL,2020-05-20,2024-01-30 20:56:04,DAMG7370_Lakshmi
193163,2017057254,PHONE,NHS,NHS-Neighborhood Preservation-,Nuisance,Trash on Private Property,05/17/2017,08:37 AM,"OPEN ",N,NULL,NULL,1229 BELLEFONTAINE AVE,64127,Independence Plaza,NULL,East,11100,39.097595,-94.545891,Trash,Recycling,NULL,NULL,2017-05-17,2024-01-30 20:56:04,DAMG7370_Lakshmi
84819,2020008968,"WEB  ",Public Works,Public Works-Street and Traffic-Streetlights,Street Light,1 Light Out,01/22/2020,06:59 AM,"OPEN ",N,NULL,NULL,2201 E Linwood Blvd,64109,Key Coalition,Jackson,Central,126188,39.067726,-94.556998,Lights,Signals,NULL,NULL,2020-01-22,2024-01-30 20:56:04,DAMG7370_Lakshmi
192816,2017034426,PHONE,NHS,NHS-Solid Waste-,Bulky Pick Up,Missed Pick Up,03/28/2017,05:05 PM,"OPEN ",N,NULL,NULL,8164 NE 51ST ST,64119,Gracemor-Randolph Corners,NULL,Shoal Creek,90654,39.18795,-94.481821,Trash,Recycling,NULL,NULL,2017-03-28,2024-01-30 20:56:04,DAMG7370_Lakshmi
97847,2018168442,"WEB  ",NHS,NHS-Neighborhood Preservation-,Nuisance,Open Storage,12/20/2018,10:01 AM,"OPEN ",Y,NULL,NULL,718 NE 115th St,64155,Nashua,Clay,Shoal Creek,100628,39.302084,-94.569592,Trash,Recycling,NULL,NULL,2018-12-20,2024-01-30 20:56:04,DAMG7370_Lakshmi
1279993,2017101882,PHONE,NHS,NHS-Neighborhood Preservation-,Nuisance,Trash on Private Property,08/11/2017,11:12 AM,"OPEN ",Y,NULL,NULL,8705 COUNTRYSHIRE LN,64138,Park Farms,Jackson,Metro,53401,38.985897,-94.485652,Trash,Recycling,NULL,NULL,2017-08-11,2024-01-30 20:56:05,DAMG7370_Lakshmi
174271,2020112907,PHONE,NHS,NHS-Neighborhood Preservation-,Private / Commercial,Lot - Structure,08/19/2020,01:15 PM,"OPEN ",Y,NULL,NULL,7611 Sycamore Ave,64138,Park Farms,Jackson,Metro,53548,38.986033,-94.494311,Mowing,Weeds,NULL,NULL,2020-08-19,2024-01-30 20:56:04,DAMG7370_Lakshmi
22775,2019171611,PHONE,NHS,NHS-Neighborhood Preservation-,Property Maintenance,Other Property Issue,09/25/2019,06:14 PM,"OPEN ",Y,NULL,NULL,4008 E 18th Pl,64127,East Community Team North,Jackson,East,14839,39.090436,-94.534637,Property,Buildings,Construction,NULL,2019-09-25,2024-01-30 20:56:04,DAMG7370_Lakshmi
154870,2020054348,PHONE,Water Services,Water Services-Line Maintenance-Wastewater,Sewer Backup / Leak,In A House,04/17/2020,11:09 AM,"OPEN ",N,NULL,NULL,1015 NE 45th St,64116,Crestview,Clay,Shoal Creek,82892,39.175543,-94.567366,Storm Water,Sewer,NULL,NULL,2020-04-17,2024-01-30 20:56:04,DAMG7370_Lakshmi
6903,2019176230,PHONE,NHS,NHS-Dangerous Buildings-,Dangerous Building,Standard,10/07/2019,08:41 AM,"OPEN ",N,NULL,NULL,711 Monroe Ave,64124,Lykins,Jackson,East,9682,39.10364,-94.538633,Property,Buildings,Construction,NULL,2019-10-07,2024-01-30 20:56:04,DAMG7370_Lakshmi
134644,2019105100,PHONE,NHS,NHS-Neighborhood Preservation-,Private / Commercial,Lot - Structure,05/31/2019,03:37 PM,"OPEN ",Y,NULL,NULL,5727 Virginia Ave,64110,Eastern 49-63,Jackson,Metro,147171,39.022387,-94.570234,Mowing,Weeds,NULL,NULL,2019-05-31,2024-01-30 20:56:04,DAMG7370_Lakshmi
192539,2017107132,PHONE,Water Services,Water Services-Line Maintenance-Stormwater,Storm Drain / Catch Basin,Damaged / Broken,08/22/2017,01:33 PM,"OPEN ",Y,NULL,NULL,3633 N ANTIOCH RD,64117,Cooley Highlands S,NULL,Shoal Creek,78250,39.160997,-94.546459,Storm Water,Sewer,NULL,NULL,2017-08-22,2024-01-30 20:56:04,DAMG7370_Lakshmi
22191,2019177160,PHONE,NHS,NHS-Neighborhood Preservation-,Private / Commercial,Lot - Vacant,10/08/2019,01:57 PM,"OPEN ",N,NULL,NULL,1847 Benton Blvd,64127,Washington Wheatley,Jackson,East,15381,39.089098,-94.549209,Mowing,Weeds,NULL,NULL,2019-10-08,2024-01-30 20:56:04,DAMG7370_Lakshmi
136946,2020071027,PHONE,NHS,NHS-Neighborhood Preservation-,Private / Commercial,Lot - Vacant,05/21/2020,03:05 PM,"OPEN ",N,NULL,NULL,1315 Monroe Ave,64127,Lykins,Jackson,East,11417,39.096431,-94.538522,Mowing,Weeds,NULL,NULL,2020-05-21,2024-01-30 20:56:04,DAMG7370_Lakshmi
83907,2020139101,PHONE,Public Works,Public Works-Capital Projects-Traffic Permits,Plate,Missing / Displaced,10/25/2020,02:50 PM,"OPEN ",N,NULL,NULL,629 Benton Blvd,64124,Lykins,Jackson,East,10392,39.104747,-94.543752,Streets,Roadways,Alleys,NULL,2020-10-25,2024-01-30 20:56:04,DAMG7370_Lakshmi
1043459,2015041490,"SYS  ",NHS,NHS-Neighborhood Preservation-,Private Property,All,04/21/2015,02:38 PM,"OPEN ",Y,NULL,NULL,2331 HOLLY ST,64108,Westside South,Jackson,Central,124349,39.084831,-94.598127,Property Violations,NULL,NULL,NULL,2015-04-21,2024-01-30 20:56:05,DAMG7370_Lakshmi
120605,2018012465,PHONE,NHS,NHS-Neighborhood Preservation-,Property Maintenance,Other Property Issue,01/26/2018,12:29 PM,"OPEN ",Y,NULL,NULL,4028 E 69TH ST,64132,Foxtown East,Jackson,Metro,2175,39.001136,-94.539136,Property,Buildings,Construction,NULL,2018-01-26,2024-01-30 20:56:04,DAMG7370_Lakshmi
53878,2019186686,PHONE,City Planning and Development,City Planning and Development-Dev Comp-Zoning,Commercial Signs / Ads,Billboard,10/30/2019,11:49 AM,"OPEN ",Y,NULL,NULL,7016 Troost Ave,64131,Holmes Park,Jackson,Metro,111542,38.99995,-94.575616,Signs,NULL,NULL,NULL,2019-10-30,2024-01-30 20:56:04,DAMG7370_Lakshmi
87546,2019091953,EMAIL,NHS,NHS-Neighborhood Preservation-,Nuisance,Trash on Private Property,05/13/2019,05:20 AM,"OPEN ",Y,NULL,NULL,429 BRIGHTON AVE,64124,South Indian Mound,Jackson,East,45040,39.107861,-94.523306,Trash,Recycling,NULL,NULL,2019-05-13,2024-01-30 20:56:04,DAMG7370_Lakshmi
99207,2019194045,PHONE,City Planning and Development,City Planning and Development-Elevators-,Elevator Inspection,Private / Commercial,11/19/2019,10:52 AM,"OPEN ",N,NULL,NULL,904 E 68th St,64131,Holmes Park,Jackson,Metro,111136,39.004763,-94.576903,Property,Buildings,Construction,NULL,2019-11-19,2024-01-30 20:56:04,DAMG7370_Lakshmi
1310443,2017150363,PHONE,NHS,NHS-Neighborhood Preservation-,Nuisance,Trash on Private Property,12/01/2017,07:40 AM,"OPEN ",Y,NULL,NULL,5343 Brooklyn Ave,64130,Blue Hills,Jackson,Metro,145895,39.02875,-94.559349,Trash,Recycling,NULL,NULL,2017-12-01,2024-01-30 20:56:06,DAMG7370_Lakshmi
35600,2020008317,PHONE,Water Services,Water Services-Meter and Field Services-,Leak,Emergency Off / Flooding,01/21/2020,09:05 AM,"OPEN ",N,NULL,NULL,4605 South Benton Ave,64130,Oak Park Southwest,Jackson,East,34720,39.042437,-94.550763,Water,NULL,NULL,NULL,2020-01-21,2024-01-30 20:56:04,DAMG7370_Lakshmi
84886,2020009093,PHONE,NHS,NHS-Solid Waste-,Trash Collection,Missed by Contractor South,01/22/2020,09:55 AM,"OPEN ",N,NULL,NULL,16401 Poplar St,64136,Little Blue,Jackson,East,73289,38.993075,-94.388983,Trash,Recycling,NULL,NULL,2020-01-22,2024-01-30 20:56:04,DAMG7370_Lakshmi
21587,2016138255,"WEB  ",NHS,NHS-Neighborhood Preservation-Administration,NHS (Neighborhood Housing Services),No Known Property Owner,11/05/2016,11:14 AM,"OPEN ",Y,NULL,NULL,5349 Rockhill Rd,64110,Western 49-63,Jackson,Metro,143514,39.029218,-94.57562,Government,NULL,NULL,NULL,2016-11-05,2024-01-30 20:56:04,DAMG7370_Lakshmi
112508,2020015332,INSPE,NHS,NHS-Neighborhood Preservation-,Nuisance,Trash on Private Property,01/30/2020,03:44 PM,"OPEN ",N,NULL,NULL,7701 Brooklyn Ave,64132,East Meyer 7,Jackson,Metro,115791,38.98705,-94.5614,Trash,Recycling,NULL,NULL,2020-01-30,2024-01-30 20:56:04,DAMG7370_Lakshmi
85056,2020009467,"BOT  ",NHS,NHS-Solid Waste-,Trash Collection,Missed by Contractor South,01/22/2020,04:35 PM,"OPEN ",N,NULL,NULL,7118 Monroe Ave,64132,Noble And Gregory Ridge,Jackson,Metro,4198,38.99701,-94.544437,Trash,Recycling,NULL,NULL,2020-01-22,2024-01-30 20:56:04,DAMG7370_Lakshmi
969044,2014085525,PHONE,NHS,NHS-Neighborhood Preservation-,Private / Commercial,Lot - Vacant,07/03/2014,10:35 AM,"OPEN ",Y,NULL,NULL,6022 E 11TH ST,64126,Sheffield,Jackson,East,5755,39.099607,-94.510328,Mowing,Weeds,NULL,NULL,2014-07-03,2024-01-30 20:56:05,DAMG7370_Lakshmi
25571,2021026134,PHONE,NHS,NHS-Neighborhood Preservation-,Disabled/Unlicensed on Private Property,Car Private Property,04/27/2021,07:19 AM,"OPEN ",N,NULL,NULL,16 E 79th St,64114,Tower Homes,Jackson,Metro,118498,38.985118,-94.589045,Vehicles,Parking,NULL,NULL,2021-04-27,2024-01-30 20:56:04,DAMG7370_Lakshmi
1562555,2019059057,"WEB  ",NHS,NHS-Neighborhood Preservation-,Property Maintenance,Main Structure,03/23/2019,04:41 PM,"OPEN ",Y,NULL,NULL,8044 Euclid Ave,64132,Marlborough Heights/Marlborough Pride,Jackson,Metro,117412,38.980181,-94.565053,Property,Buildings,Construction,NULL,2019-03-23,2024-01-30 20:56:06,DAMG7370_Lakshmi
182336,2020149262,"WEB  ",NHS,NHS-Neighborhood Preservation-,Property Maintenance,Other Property Issue,11/24/2020,04:01 PM,"OPEN ",N,NULL,NULL,8804 E 47th St,64129,Eastwood Hills East,Jackson,East,50011,39.038502,-94.480562,Property,Buildings,Construction,NULL,2020-11-24,2024-01-30 20:56:04,DAMG7370_Lakshmi
140473,2020051953,PHONE,Public Works,Public Works-Street and Traffic-District 3,Other-Maintenance,District 3,04/13/2020,01:05 PM,"OPEN ",N,NULL,NULL,5240 Elmwood Ave,64130,Sheraton Estates,Jackson,Metro,37559,39.029882,-94.530261,Streets,Roadways,Alleys,NULL,2020-04-13,2024-01-30 20:56:04,DAMG7370_Lakshmi
89724,2014022226,PHONE,NHS,NHS-Neighborhood Preservation-,Nuisance,Open Storage,02/20/2014,11:04 AM,"OPEN ",Y,NULL,NULL,2907 Lockridge St,64128,Santa Fe,Jackson,East,24601,39.07553,-94.548193,Trash,Recycling,NULL,NULL,2014-02-20,2024-01-30 20:56:04,DAMG7370_Lakshmi
159516,2019124858,"WEB  ",NHS,NHS-Neighborhood Preservation-,Property Maintenance,Main Structure,07/01/2019,02:34 PM,"OPEN ",Y,NULL,NULL,1221 W 38th St,64111,Volker,Jackson,Central,130357,39.058138,-94.601226,Property,Buildings,Construction,NULL,2019-07-01,2024-01-30 20:56:04,DAMG7370_Lakshmi
126761,2018138904,EMAIL,NHS,NHS-Neighborhood Preservation-,Property Maintenance,Main Structure,10/15/2018,03:10 PM,"OPEN ",Y,NULL,NULL,9707 Holmes Rd,64131,Linden Hills And Indian Heights,Jackson,South,152316,38.950846,-94.581842,Property,Buildings,Construction,NULL,2018-10-15,2024-01-30 20:56:04,DAMG7370_Lakshmi
1247882,2017054010,"WEB  ",NHS,NHS-Neighborhood Preservation-,Parked on Unapproved Surface,Trailer Private Property,05/10/2017,09:57 AM,"OPEN ",Y,NULL,NULL,811 W 85th St,64114,Western Hills,Jackson,Metro,148694,38.974148,-94.600797,Vehicles,Parking,NULL,NULL,2017-05-10,2024-01-30 20:56:05,DAMG7370_Lakshmi
162278,2020054585,PHONE,NHS,NHS-Solid Waste-,Trash Collection,Missed by Contractor South,04/17/2020,04:14 PM,"OPEN ",N,NULL,NULL,11402 Herrick Ave,64134,Ruskin Heights,Jackson,South,72939,38.916164,-94.49688,Trash,Recycling,NULL,NULL,2020-04-17,2024-01-30 20:56:04,DAMG7370_Lakshmi
84705,2020008075,"WEB  ",Parks and Rec,Parks and Rec-Landscape Services-Forestry,Removal,Stump,01/20/2020,08:50 AM,"OPEN ",N,NULL,NULL,4108 Norledge Ave,64123,Scarritt Point,Jackson,East,40564,39.116298,-94.533547,Trees,NULL,NULL,NULL,2020-01-20,2024-01-30 20:56:04,DAMG7370_Lakshmi
158532,2020129622,PHONE,NHS,NHS-Neighborhood Preservation-Abatement,Dumping,Right of Way LB Central,09/29/2020,03:29 PM,"OPEN ",Y,NULL,NULL,2000 Lister Ave,64127,East Community Team North,Jackson,East,18886,39.087005,-94.527724,Trash,Recycling,NULL,NULL,2020-09-29,2024-01-30 20:56:04,DAMG7370_Lakshmi
155418,2018072276,PHONE,NHS,NHS-Neighborhood Preservation-,Private / Commercial,Lot - Structure,06/05/2018,01:21 PM,"OPEN ",Y,NULL,NULL,4030 Wabash Ave,64130,Ivanhoe Southeast,Jackson,Central,136485,39.052587,-94.555192,Mowing,Weeds,NULL,NULL,2018-06-05,2024-01-30 20:56:04,DAMG7370_Lakshmi
32984,2020004865,"WEB  ",NHS,NHS-Neighborhood Preservation-,Parked on Unapproved Surface,Car Private Property,01/13/2020,07:25 AM,"OPEN ",N,NULL,NULL,1902 E 70th Ter,64132,Neighbors United For Action,Jackson,Metro,114116,38.99955,-94.564812,Vehicles,Parking,NULL,NULL,2020-01-13,2024-01-30 20:56:04,DAMG7370_Lakshmi
34850,2020007121,PHONE,Water Services,Water Services-Line Maintenance-Wastewater,Sewer Backup / Leak,In A House,01/16/2020,02:12 PM,"OPEN ",N,NULL,NULL,1915 NE 107th Ter,64155,Shoal Creek,Clay,Shoal Creek,263823,39.289032,-94.555378,Storm Water,Sewer,NULL,NULL,2020-01-16,2024-01-30 20:56:04,DAMG7370_Lakshmi
185512,2020158778,PHONE,NHS,NHS-Neighborhood Preservation-,Private / Commercial,Lot - Structure,12/28/2020,12:02 PM,"OPEN ",N,NULL,NULL,4110 Prospect Ave,64130,Ivanhoe Southeast,Jackson,East,258820,39.051433,-94.554162,Mowing,Weeds,NULL,NULL,2020-12-28,2024-01-30 20:56:04,DAMG7370_Lakshmi
189870,2019168028,PHONE,Public Works,Public Works-Capital Projects-Traffic Control,Street Name Signs,New Sign Request,09/18/2019,02:24 PM,"OPEN ",N,NULL,NULL,2100 Holly St,64102,Westside North,Jackson,Central,124026,39.087976,-94.598606,Signs,NULL,NULL,NULL,2019-09-18,2024-01-30 20:56:04,DAMG7370_Lakshmi
1045702,2015043624,"SYS  ",NHS,NHS-Neighborhood Preservation-,Data Not Available,Data Not Available,04/27/2015,11:26 AM,"OPEN ",Y,NULL,NULL,7348 Wayne Ave,64131,East Meyer 6,Jackson,Metro,114919,38.993323,-94.569007,Data Not Available,NULL,NULL,NULL,2015-04-27,2024-01-30 20:56:05,DAMG7370_Lakshmi
24273,2021026017,PHONE,NHS,NHS-Neighborhood Preservation-,Parked on Unapproved Surface,Car Private Property,04/26/2021,08:23 AM,"OPEN ",N,NULL,NULL,7408 Park Ave,64132,East Meyer 7,Jackson,Metro,115490,38.992353,-94.560996,Vehicles,Parking,NULL,NULL,2021-04-26,2024-01-30 20:56:04,DAMG7370_Lakshmi
190645,2017060945,"WEB  ",NHS,NHS-Neighborhood Preservation-,Nuisance,Trash on Private Property,05/24/2017,11:39 AM,"OPEN ",N,NULL,NULL,8300 TROOST AVE,64131,Rockhill Manor,NULL,Metro,121542,38.97631,-94.576832,Trash,Recycling,NULL,NULL,2017-05-24,2024-01-30 20:56:04,DAMG7370_Lakshmi
118574,2017135347,PHONE,NHS,NHS-Dangerous Buildings-,Dangerous Building,Standard,10/23/2017,07:54 AM,"OPEN ",Y,NULL,NULL,3303 Harrison St,64109,North Hyde Park,Jackson,Central,128433,39.066733,-94.572532,Property,Buildings,Construction,NULL,2017-10-23,2024-01-30 20:56:04,DAMG7370_Lakshmi
65694,2020026267,"WEB  ",NHS,NHS-Neighborhood Preservation-,Disabled/Unlicensed on Private Property,Car Private Property,02/20/2020,10:36 PM,"OPEN ",N,NULL,NULL,4002 South Benton Ave,64130,Oak Park Southwest,Jackson,East,29735,39.053305,-94.550573,Vehicles,Parking,NULL,NULL,2020-02-20,2024-01-30 20:56:04,DAMG7370_Lakshmi
161591,2020054402,"BOT  ",NHS,NHS-Solid Waste-,Trash Collection,Missed by Contractor North,04/17/2020,12:09 PM,"OPEN ",N,NULL,NULL,6438 N Merrimac Ave,64151,Park Plaza,Platte,North,164548,39.212541,-94.62952,Trash,Recycling,NULL,NULL,2020-04-17,2024-01-30 20:56:04,DAMG7370_Lakshmi
1343697,2018029110,PHONE,NHS,NHS-Neighborhood Preservation-,Property Maintenance,Main Structure,03/09/2018,09:23 AM,"OPEN ",Y,NULL,NULL,2310 BENTON BLVD,64127,Washington Wheatley,Jackson,East,16167,39.084009,-94.549074,Property,Buildings,Construction,NULL,2018-03-09,2024-01-30 20:56:06,DAMG7370_Lakshmi
1381757,2018078863,"WEB  ",NHS,NHS-Neighborhood Preservation-,Property Maintenance,Other Property Issue,06/17/2018,12:30 AM,"OPEN ",Y,NULL,NULL,1122 W 41ST ST,64111,Volker,Jackson,Central,131265,39.054446,-94.599671,Property,Buildings,Construction,NULL,2018-06-17,2024-01-30 20:56:06,DAMG7370_Lakshmi
183113,2021021898,PHONE,NHS,NHS-Neighborhood Preservation-,Property Maintenance,Main Structure,03/02/2021,12:25 PM,"OPEN ",Y,NULL,NULL,3801 N Bales Ave,64117,Cooley Highlands S,Clay,Shoal Creek,77927,39.163574,-94.53898,Property,Buildings,Construction,NULL,2021-03-02,2024-01-30 20:56:04,DAMG7370_Lakshmi
1201651,2016133789,PHONE,NHS,NHS-Solid Waste-Administration,Trash Collection,Repeat Missed,10/26/2016,06:14 PM,"CANC ",N,09/30/2019,NULL,501 E 97th Ter,64131,Willow Creek,Jackson,South,152291,38.950346,-94.586085,Trash,Recycling,NULL,2019-09-30,2016-10-26,2024-01-30 20:56:05,DAMG7370_Lakshmi
1187373,2016122103,PHONE,Public Works,Public Works-Street and Traffic-District 2,Pothole,District 2,09/30/2016,10:45 AM,RESOL,N,10/03/2016,3,1350 E 17th St,64108,NULL,Jackson,Central,12252,39.092472,-94.567172,Streets,Roadways,Alleys,2016-10-03,2016-09-30,2024-01-30 20:56:05,DAMG7370_Lakshmi
362743,2008184541,PHONE,NHS,NHS-Animal Health and Safety-,Emergency,*Select one,07/24/2008,11:33 AM,RESOL,N,07/24/2008,0,7417 Prospect Ave,64132,NULL,NULL,NULL,0,35.797519,-103.890579,Animal,NULL,NULL,2008-07-24,2008-07-24,2024-01-30 20:56:05,DAMG7370_Lakshmi
76911,2020013901,PHONE,Water Services,Water Services-Meter and Field Services-,No Water / Pressure,Low Pressure,01/28/2020,04:52 PM,"CANC ",N,02/01/2020,NULL,5528 Agnes Ave,64130,North Town Fork Creek,Jackson,Metro,36536,39.025328,-94.551402,Water,NULL,NULL,2020-02-01,2020-01-28,2024-01-30 20:56:04,DAMG7370_Lakshmi
140859,2020051990,EMAIL,Public Works,Public Works-Street and Traffic-District 3,Pothole,District 3,04/13/2020,01:46 PM,"OPEN ",N,NULL,NULL,12018 E 57th Ter,64133,Fairway Hills,Jackson,East,63673,39.018163,-94.43879,Streets,Roadways,Alleys,NULL,2020-04-13,2024-01-30 20:56:04,DAMG7370_Lakshmi
90031,2020046246,EMAIL,Parks and Rec,Parks and Rec-Administration-,Services,Service Issue / Problem,04/01/2020,08:44 AM,RESOL,N,04/01/2020,0,6700 Swope Pkwy,64132,NULL,Jackson,Metro,22,39.007821,-94.530853,Parks & Recreation,NULL,NULL,2020-04-01,2020-04-01,2024-01-30 20:56:04,DAMG7370_Lakshmi
192862,2009230929,PHONE,NHS,NHS-Animal Health and Safety-,Other,Non Emergency,08/20/2009,07:02 PM,RESOL,N,08/21/2009,1,134 N Quincy Ave,64123,NULL,NULL,NULL,0,35.797519,-103.890579,Animal,NULL,NULL,2009-08-21,2009-08-20,2024-01-30 20:56:04,DAMG7370_Lakshmi
561589,2010063092,PHONE,Water Services,Water Services-Line Maintenance-Wastewater,All,All,02/16/2010,12:54 PM,RESOL,Y,04/23/2010,66,5110 NE 44th St,64117,NULL,NULL,NULL,0,39.173932,-94.520006,Sewer,NULL,NULL,2010-04-23,2010-02-16,2024-01-30 20:56:05,DAMG7370_Lakshmi
301347,2008039667,INSPE,NHS,NHS-Neighborhood Preservation-,Private Property,All,02/20/2008,03:56 PM,"CANC ",Y,09/30/2019,NULL,3039 NORTON AVE,64128,Ingleside,Jackson,East,24170,39.06977,-94.535275,Property & Nuisance Violations,NULL,NULL,2019-09-30,2008-02-20,2024-01-30 20:56:05,DAMG7370_Lakshmi
1046863,2015044140,PHONE,Public Works,Public Works-Capital Projects-Signs,Street,Traffic,04/28/2015,09:46 AM,RESOL,N,04/30/2015,2,1801 GROVE ST,64108,NULL,Jackson,Central,260757,39.090984,-94.56534,Markings,NULL,NULL,2015-04-30,2015-04-28,2024-01-30 20:56:05,DAMG7370_Lakshmi
486657,2009185233,PHONE,NHS,NHS-Neighborhood Preservation-,Private Property,All,07/08/2009,12:29 PM,RESOL,N,07/09/2009,1,3116 E 72nd St,64132,NULL,NULL,NULL,0,35.797519,-103.890579,Nuisance Violations,NULL,NULL,2009-07-09,2009-07-08,2024-01-30 20:56:05,DAMG7370_Lakshmi
484140,2009123564,PHONE,Public Works,Public Works-Capital Projects-Traffic Signals,Malfunction,Signal,05/13/2009,12:19 PM,RESOL,Y,05/18/2009,5,310 W 106th St,64114,NULL,NULL,NULL,0,35.797519,-103.890579,Signal,NULL,NULL,2009-05-18,2009-05-13,2024-01-30 20:56:05,DAMG7370_Lakshmi
319955,2008104970,PHONE,NHS,NHS-Animal Health and Safety-,Other,Non Emergency,05/02/2008,02:09 PM,RESOL,N,05/02/2008,0,1 ARROWHEAD DR,64129,NULL,Jackson,East,47927,39.051612,-94.492843,Animal,NULL,NULL,2008-05-02,2008-05-02,2024-01-30 20:56:05,DAMG7370_Lakshmi
1025529,2015016858,PHONE,Water Services,Water Services-Line Maintenance-Ice Abatement,Icing,*SELECT ONE,02/19/2015,03:28 PM,"CANC ",N,09/30/2019,NULL,6903 Oak St,64113,Holmes Park,Jackson,Metro,111413,39.002332,-94.583193,Water Leak,NULL,NULL,2019-09-30,2015-02-19,2024-01-30 20:56:05,DAMG7370_Lakshmi
147354,2020052703,EMAIL,Water Services,Water Services-Line Maintenance-Leaf Brush,Leaf / Brush,Missed Pick Up,04/14/2020,02:51 PM,"OPEN ",N,NULL,NULL,7735 Jefferson St,64114,Ward Parkway,Jackson,Metro,120231,38.987452,-94.597226,Trash,Recycling,NULL,NULL,2020-04-14,2024-01-30 20:56:04,DAMG7370_Lakshmi
358536,2008225698,PHONE,NHS,NHS-Solid Waste-Administration,Administration,All,09/08/2008,04:10 PM,RESOL,N,09/09/2008,1,619 E 117TH ST,64131,NULL,NULL,NULL,0,35.797519,-103.890579,Public Works,NULL,NULL,2008-09-09,2008-09-08,2024-01-30 20:56:05,DAMG7370_Lakshmi
58473,2021000391,"WEB  ",Public Works,Public Works-Street and Traffic-Snow,Snow / Ice,District 2,01/04/2021,06:57 AM,RESOL,N,01/05/2021,1,1430 Genessee St,64102,NULL,Jackson,Central,123299,39.096651,-94.605345,Streets,Roadways,Alleys,2021-01-05,2021-01-04,2024-01-30 20:56:04,DAMG7370_Lakshmi
418294,2009000103,PHONE,Water Services,Water Services-Administration-,Administration,All,01/02/2009,08:39 AM,RESOL,N,01/02/2009,0,2118 Wabash Ave,64127,NULL,NULL,NULL,0,35.797519,-103.890579,Water Services,NULL,NULL,2009-01-02,2009-01-02,2024-01-30 20:56:05,DAMG7370_Lakshmi
1029917,2015026356,PHONE,Water Services,Water Services-Line Maintenance-Pipeline,Hydrant Repair,Central Region,03/16/2015,04:03 PM,RESOL,N,03/23/2015,7,1217 Union Ave,64101,NULL,Jackson,Central,123171,39.102194,-94.599202,Water Leak,NULL,NULL,2015-03-23,2015-03-16,2024-01-30 20:56:05,DAMG7370_Lakshmi
180494,2019133373,"WEB  ",NHS,NHS-Neighborhood Preservation-,Nuisance,Trash on Private Property,07/16/2019,02:33 PM,"OPEN ",Y,NULL,NULL,6622 Park Ave,64132,Blenheim Square Research Hospital,Jackson,Metro,105699,39.005872,-94.56031,Trash,Recycling,NULL,NULL,2019-07-16,2024-01-30 20:56:04,DAMG7370_Lakshmi
24150,2007078943,PHONE,NHS,NHS-Tow Services-,Abandoned,All,07/06/2007,02:45 PM,RESOL,N,07/09/2007,3,4114 E 6TH ST,64124,NULL,Jackson,NULL,0,35.797519,-103.890579,Vehicle,NULL,NULL,2007-07-09,2007-07-06,2024-01-30 20:56:04,DAMG7370_Lakshmi
150615,2020053351,PHONE,NHS,NHS-Solid Waste-,Trash Collection,Missed by City,04/15/2020,02:14 PM,"OPEN ",Y,NULL,NULL,511 Norton Ave,64124,Scarritt Point,Jackson,East,42286,39.107063,-94.533808,Trash,Recycling,NULL,NULL,2020-04-15,2024-01-30 20:56:04,DAMG7370_Lakshmi
389990,2008254256,PHONE,NHS,NHS-Solid Waste-,Bulky,Appointment,10/13/2008,08:57 AM,RESOL,N,12/01/2008,49,1304 E 108TH ST,64131,NULL,Jackson,NULL,0,35.797519,-103.890579,Trash,NULL,NULL,2008-12-01,2008-10-13,2024-01-30 20:56:05,DAMG7370_Lakshmi
1217163,2016147176,PHONE,Water Services,Water Services-Line Maintenance-Stormwater,Storm Drain / Catch Basin,Damaged / Broken,12/01/2016,03:10 PM,RESOL,Y,02/13/2017,74,1300 W 13th St,64101,NULL,Jackson,Central,123223,39.099908,-94.600692,Storm Water,Sewer,NULL,2017-02-13,2016-12-01,2024-01-30 20:56:05,DAMG7370_Lakshmi
537414,2010004032,PHONE,Water Services,Water Services-Laboratory Services-,Laboratory Service,All,01/05/2010,03:39 PM,RESOL,N,01/06/2010,1,5502 E 101ST ST,64137,NULL,NULL,NULL,0,35.797519,-103.890579,Water Quality,NULL,NULL,2010-01-06,2010-01-05,2024-01-30 20:56:05,DAMG7370_Lakshmi
255259,2007096941,PHONE,NHS,NHS-Neighborhood Preservation-,Private Property,All,08/09/2007,04:55 PM,RESOL,N,09/10/2007,32,9813 Wallace Ave,64134,NULL,NULL,NULL,0,35.797519,-103.890579,Property & Nuisance Violations,NULL,NULL,2007-09-10,2007-08-09,2024-01-30 20:56:05,DAMG7370_Lakshmi
488785,2009163859,PHONE,Water Services,Water Services-Line Maintenance-Wastewater,All,All,06/19/2009,10:22 AM,RESOL,Y,09/16/2009,89,4327 N Claymont DR,64116,NULL,NULL,NULL,0,35.797519,-103.890579,Sewer,NULL,NULL,2009-09-16,2009-06-19,2024-01-30 20:56:05,DAMG7370_Lakshmi
1282750,2017102818,"WEB  ",Water Services,Water Services-Meter and Field Services-,Leak,At Curb / In Yard,08/14/2017,01:53 PM,"CANC ",N,09/30/2019,NULL,9428 N Baltimore Ave,64155,Sherrydale,Clay,North,263619,39.264283,-94.581308,Water,NULL,NULL,2019-09-30,2017-08-14,2024-01-30 20:56:05,DAMG7370_Lakshmi
283110,2007187172,PHONE,NHS,NHS-Neighborhood Preservation-,Private Property,All,12/18/2007,01:15 PM,RESOL,N,12/21/2007,3,414 E 12TH ST,64106,NULL,NULL,NULL,0,35.797519,-103.890579,Property & Nuisance Violations,NULL,NULL,2007-12-21,2007-12-18,2024-01-30 20:56:05,DAMG7370_Lakshmi
1428626,2018149617,PHONE,Water Services,Water Services-Meter and Field Services-,No Water / Pressure,No Water,11/09/2018,09:48 AM,"CANC ",N,09/30/2019,NULL,8410 N Church Rd,64157,Shoal Creek,Clay,Shoal Creek,216173,39.246303,-94.462713,Water,NULL,NULL,2019-09-30,2018-11-09,2024-01-30 20:56:06,DAMG7370_Lakshmi
139695,2021004610,"WEB  ",NHS,NHS-Neighborhood Preservation-,Nuisance,Trash on Private Property,01/13/2021,12:18 PM,"OPEN ",N,NULL,NULL,8611 E 91st St,64138,Fairwood And Robandee,Jackson,South,68416,38.958203,-94.487119,Trash,Recycling,NULL,NULL,2021-01-13,2024-01-30 20:56:04,DAMG7370_Lakshmi
1355504,2018053909,PHONE,Water Services,Water Services-Meter and Field Services-,No Water / Pressure,No Water,05/02/2018,07:09 AM,RESOL,N,05/02/2018,0,1701 W 25th St,64108,NULL,Jackson,Central,124211,39.082655,-94.606077,Water,NULL,NULL,2018-05-02,2018-05-02,2024-01-30 20:56:06,DAMG7370_Lakshmi
188983,2019096153,PHONE,NHS,NHS-Neighborhood Preservation-,Nuisance,Trash on Private Property,05/17/2019,11:32 AM,"OPEN ",Y,NULL,NULL,1224 Ewing Ave,64126,East Blue Valley,Jackson,East,6973,39.096248,-94.503616,Trash,Recycling,NULL,NULL,2019-05-17,2024-01-30 20:56:04,DAMG7370_Lakshmi
335857,2008128411,INSPE,NHS,NHS-Neighborhood Preservation-,Private Property,All,05/28/2008,11:18 AM,RESOL,Y,07/08/2009,406,3810 Wayne Ave,64109,NULL,NULL,NULL,0,35.797519,-103.890579,Property & Nuisance Violations,NULL,NULL,2009-07-08,2008-05-28,2024-01-30 20:56:05,DAMG7370_Lakshmi
372990,2008207247,PHONE,Public Works,Public Works-Capital Projects-Traffic Control,Traffic Study,Traffic,08/18/2008,04:58 PM,RESOL,N,08/21/2008,3,9516 NW 86TH TER,64153,NULL,Platte,North,168016,39.251309,-94.691197,Traffic Study,NULL,NULL,2008-08-21,2008-08-18,2024-01-30 20:56:05,DAMG7370_Lakshmi
513350,2009276970,PHONE,NHS,NHS-Neighborhood Preservation-,Private Property,All,10/07/2009,12:31 PM,"CANC ",Y,09/30/2019,NULL,4729 E 44th Ter,64130,Vineyard,Jackson,East,32833,39.044322,-94.528596,Nuisance Violations,NULL,NULL,2019-09-30,2009-10-07,2024-01-30 20:56:05,DAMG7370_Lakshmi
486388,2009155110,PHONE,NHS,NHS-Neighborhood Preservation-,Private Property,All,06/11/2009,10:30 AM,"CANC ",Y,09/30/2019,NULL,10114 Belmont Ave,64134,NULL,NULL,NULL,0,35.797519,-103.890579,Nuisance Violations,NULL,NULL,2019-09-30,2009-06-11,2024-01-30 20:56:05,DAMG7370_Lakshmi
458737,2009086301,"FAX  ",KCPD,KCPD-Parking Control-,Abandoned,All,04/09/2009,11:38 AM,RESOL,N,04/09/2009,0,4400 ROANOKE PKWY,64111,NULL,Jackson,NULL,0,35.797519,-103.890579,Vehicle,NULL,NULL,2009-04-09,2009-04-09,2024-01-30 20:56:05,DAMG7370_Lakshmi
923946,2013169593,PHONE,Water Services,Water Services-Meter and Field Services-,Investigations,Meter Leak,12/26/2013,11:48 AM,"CANC ",N,09/30/2019,NULL,8217 WALNUT ST,64114,Waldo Homes,Jackson,Metro,119161,38.9781,-94.588766,Water Leak,NULL,NULL,2019-09-30,2013-12-26,2024-01-30 20:56:05,DAMG7370_Lakshmi
171087,2020157141,EMAIL,NHS,NHS-Neighborhood Preservation-,Property Maintenance,Fence Issue,12/21/2020,10:07 AM,"OPEN ",N,NULL,NULL,7805 Madison Ave,64114,Ward Parkway,Jackson,Metro,120037,38.986856,-94.5999,Property,Buildings,Construction,NULL,2020-12-21,2024-01-30 20:56:04,DAMG7370_Lakshmi
474,2021030691,PHONE,NHS,NHS-Dangerous Buildings-,Dangerous Building,Standard,08/24/2021,07:51 AM,"OPEN ",N,NULL,NULL,5703 Brooklyn Ave,64130,Blue Hills,Jackson,Metro,148362,39.022859,-94.55972,Property,Buildings,Construction,NULL,2021-08-24,2024-01-30 20:56:04,DAMG7370_Lakshmi
405544,2008286439,PHONE,NHS,NHS-Solid Waste-,18,December,11/19/2008,10:08 AM,RESOL,N,01/03/2009,45,10607 NW 86TH ST,64153,NULL,Platte,North,223703,39.24993,-94.704402,Bulky Appointment,NULL,NULL,2009-01-03,2008-11-19,2024-01-30 20:56:05,DAMG7370_Lakshmi
432330,2009019685,PHONE,NHS,NHS-Animal Health and Safety-,Emergency,*Select one,01/26/2009,10:51 AM,RESOL,N,01/26/2009,0,7607 E 51ST TER,64129,NULL,NULL,NULL,0,35.797519,-103.890579,Animal,NULL,NULL,2009-01-26,2009-01-26,2024-01-30 20:56:05,DAMG7370_Lakshmi
143548,2020142609,PHONE,Water Services,Water Services-Meter and Field Services-,MFS Referral (Meter Field Services),Investigation,11/04/2020,07:45 PM,"CANC ",N,11/10/2020,NULL,1650 Broadway Blvd,64108,Westside North,Jackson,Central,123444,39.093801,-94.589056,Water,NULL,NULL,2020-11-10,2020-11-04,2024-01-30 20:56:04,DAMG7370_Lakshmi
144223,2020127222,PHONE,NHS,NHS-Neighborhood Preservation-,Nuisance,Open Storage,09/23/2020,08:17 AM,"OPEN ",N,NULL,NULL,3801 N Briarcliff Rd,64116,Briarcliff And Claymont,Clay,North,84978,39.163451,-94.587611,Trash,Recycling,NULL,NULL,2020-09-23,2024-01-30 20:56:04,DAMG7370_Lakshmi
183567,2021020361,"WEB  ",NHS,NHS-Neighborhood Preservation-,Private Property,Dead,02/26/2021,08:19 AM,"OPEN ",Y,NULL,NULL,7321 Belleview Ave,64114,Ward Parkway,Jackson,Metro,110928,38.995427,-94.600646,Trees,NULL,NULL,NULL,2021-02-26,2024-01-30 20:56:04,DAMG7370_Lakshmi
300997,2008019411,PHONE,NHS,NHS-Animal Health and Safety-,Emergency,*Select one,01/25/2008,09:27 AM,RESOL,N,01/25/2008,0,4009 Holly ST,64111,NULL,NULL,NULL,0,35.797519,-103.890579,Animal,NULL,NULL,2008-01-25,2008-01-25,2024-01-30 20:56:05,DAMG7370_Lakshmi
759304,2012027669,PHONE,Public Works,Public Works-Solid Waste-,Right of Way,All,03/06/2012,03:38 PM,RESOL,Y,03/08/2012,2,6900 NE STILLWELL AVE,64120,NULL,Jackson,East,38346,39.144877,-94.501832,Trash,NULL,NULL,2012-03-08,2012-03-06,2024-01-30 20:56:05,DAMG7370_Lakshmi
367883,2008217560,PHONE,Public Works,Public Works-Solid Waste-,City,Missed,08/29/2008,11:02 AM,RESOL,N,09/02/2008,4,1112 E 56th St,64110,NULL,NULL,NULL,0,35.797519,-103.890579,Trash,NULL,NULL,2008-09-02,2008-08-29,2024-01-30 20:56:05,DAMG7370_Lakshmi
543551,2009372238,PHONE,Public Works,Public Works-Street and Traffic-Snow,Street,District One,12/28/2009,08:27 AM,RESOL,Y,02/23/2010,57,6301 NE 48TH CT,64119,NULL,Clay,NULL,0,35.797519,-103.890579,Snow & Ice,NULL,NULL,2010-02-23,2009-12-28,2024-01-30 20:56:05,DAMG7370_Lakshmi
290286,2008013924,INSPE,NHS,NHS-Neighborhood Preservation-,Private Property,All,01/17/2008,02:42 PM,RESOL,N,02/20/2008,34,9704 COLONY PL,64131,NULL,NULL,NULL,0,35.797519,-103.890579,Property & Nuisance Violations,NULL,NULL,2008-02-20,2008-01-17,2024-01-30 20:56:05,DAMG7370_Lakshmi
145932,2021005567,PHONE,Water Services,Water Services - Wastewater Investigations,Manhole,Missing / Broken,01/16/2021,07:57 AM,RESOL,N,01/20/2021,4,300 Broadway Blvd,64105,NULL,Jackson,Central,148462,39.109082,-94.588841,Storm Water,Sewer,NULL,2021-01-20,2021-01-16,2024-01-30 20:56:04,DAMG7370_Lakshmi
237613,2007049857,PHONE,Parks and Rec,Parks and Rec-Landscape Services-Forestry,Trimming,South Region,05/22/2007,09:31 AM,RESOL,N,06/04/2007,13,1843 E 76th Ter,64132,NULL,NULL,NULL,0,35.797519,-103.890579,Trees,NULL,NULL,2007-06-04,2007-05-22,2024-01-30 20:56:05,DAMG7370_Lakshmi
393319,2008261107,PHONE,NHS,NHS-Neighborhood Preservation-,Private Property,All,10/20/2008,03:08 PM,RESOL,Y,09/21/2009,336,6800 ST JOHN AVE,64120,NULL,Jackson,East,45463,39.115944,-94.503031,Nuisance Violations,NULL,NULL,2009-09-21,2008-10-20,2024-01-30 20:56:05,DAMG7370_Lakshmi
426077,2009024288,PHONE,NHS,NHS-Solid Waste-,23,February,01/30/2009,12:48 PM,RESOL,N,02/23/2009,24,2607 Jarboe St,64108,NULL,NULL,NULL,0,35.797519,-103.890579,Bulky Appointment,NULL,NULL,2009-02-23,2009-01-30,2024-01-30 20:56:05,DAMG7370_Lakshmi
20622,2020118310,PHONE,NHS,NHS-Neighborhood Preservation-,Property Maintenance,Other Property Issue,09/01/2020,11:53 AM,"OPEN ",Y,NULL,NULL,4010 South Benton Ave,64130,Oak Park Southwest,Jackson,East,29739,39.052921,-94.550594,Property,Buildings,Construction,NULL,2020-09-01,2024-01-30 20:56:04,DAMG7370_Lakshmi
557419,2010015628,PHONE,Public Works,Public Works-Street and Traffic-Snow,Street,District Two,01/12/2010,04:40 PM,RESOL,N,02/12/2010,31,3800 Montgall Ave,64128,NULL,NULL,NULL,0,35.797519,-103.890579,Snow & Ice,NULL,NULL,2010-02-12,2010-01-12,2024-01-30 20:56:05,DAMG7370_Lakshmi
460397,2009084330,PHONE,NHS,NHS-Neighborhood Preservation-,Private Property,All,04/07/2009,04:28 PM,"CANC ",Y,09/30/2019,NULL,4014 Genessee St,64111,Volker,NULL,Central,130715,39.054686,-94.60543,Nuisance Violations,NULL,NULL,2019-09-30,2009-04-07,2024-01-30 20:56:05,DAMG7370_Lakshmi
225863,2007046723,PHONE,NHS,NHS-Neighborhood Preservation-,Private Property,All,05/16/2007,11:33 AM,RESOL,Y,01/14/2008,243,7401 VIRGINIA AVE,64131,NULL,NULL,NULL,0,35.797519,-103.890579,Property & Nuisance Violations,NULL,NULL,2008-01-14,2007-05-16,2024-01-30 20:56:05,DAMG7370_Lakshmi
256238,2007136431,PHONE,NHS,NHS-Animal Health and Safety-,Bite,*Select one,10/09/2007,12:33 PM,RESOL,N,10/10/2007,1,1235 BELMONT AVE,64126,NULL,NULL,NULL,0,35.797519,-103.890579,Animal,NULL,NULL,2007-10-10,2007-10-09,2024-01-30 20:56:05,DAMG7370_Lakshmi
509574,2009196435,PHONE,NHS,NHS-Animal Health and Safety-,Emergency,*Select one,07/17/2009,05:22 PM,RESOL,N,07/20/2009,3,5128 Booth Ave,64129,NULL,NULL,NULL,0,35.797519,-103.890579,Animal,NULL,NULL,2009-07-20,2009-07-17,2024-01-30 20:56:05,DAMG7370_Lakshmi
500134,2009208750,PHONE,NHS,NHS-Neighborhood Preservation-,Private Property,All,07/29/2009,04:05 PM,"CANC ",Y,09/30/2019,NULL,4439 CLEVELAND AVE,64130,Vineyard Northwest,Jackson,East,33655,39.044447,-94.539941,Nuisance Violations,NULL,NULL,2019-09-30,2009-07-29,2024-01-30 20:56:05,DAMG7370_Lakshmi
186170,2021023662,PHONE,NHS,NHS-Neighborhood Preservation-,Nuisance,Trash on Private Property,03/16/2021,12:00 PM,"OPEN ",N,NULL,NULL,4020 St John Ave,64123,Scarritt Point,Jackson,East,40620,39.11325,-94.533205,Trash,Recycling,NULL,NULL,2021-03-16,2024-01-30 20:56:04,DAMG7370_Lakshmi
526578,2009331594,"SYS  ",NHS,NHS-Dangerous Buildings-Emergency,Private Property,All,11/18/2009,02:39 PM,"CANC ",N,09/30/2019,NULL,11827 E 50TH TER,64133,Sterling Gardens,Jackson,East,260520,39.030013,-94.440242,Property & Nuisance Violations,NULL,NULL,2019-09-30,2009-11-18,2024-01-30 20:56:05,DAMG7370_Lakshmi
448929,2009058606,PHONE,NHS,NHS-Solid Waste-,25,March,03/09/2009,04:35 PM,RESOL,N,03/26/2009,17,2854 Mersington Ave,64128,NULL,NULL,NULL,0,35.797519,-103.890579,Bulky Appointment,NULL,NULL,2009-03-26,2009-03-09,2024-01-30 20:56:05,DAMG7370_Lakshmi
486183,2009124115,PHONE,NCS,NCS-Animal Health and Safety-Jackson County,Jackson County,Unincorporated Areas of Jackson County,05/13/2009,03:35 PM,RESOL,N,05/14/2009,1,414 E 12TH ST,64106,NULL,NULL,NULL,0,35.797519,-103.890579,Animal,NULL,NULL,2009-05-14,2009-05-13,2024-01-30 20:56:05,DAMG7370_Lakshmi
536566,2009355967,PHONE,NHS,NHS-Neighborhood Preservation-,Private Property,All,12/10/2009,11:56 AM,"CANC ",N,09/30/2019,NULL,204 Wabash Ave,64124,Pendleton Heights,Jackson,Central,39848,39.111996,-94.552665,Nuisance Violations,NULL,NULL,2019-09-30,2009-12-10,2024-01-30 20:56:05,DAMG7370_Lakshmi
969965,2014071155,PHONE,NHS,NHS-Neighborhood Preservation-,Private Property,All,06/06/2014,10:03 AM,RESOL,N,06/11/2014,5,1255 WYOMING ST,64102,NULL,Jackson,Central,123254,39.098087,-94.603245,Property Violations,NULL,NULL,2014-06-11,2014-06-06,2024-01-30 20:56:05,DAMG7370_Lakshmi
272629,2007177648,PHONE,Public Works,Public Works-Solid Waste-,Leaf & Brush,Missed,12/06/2007,01:01 PM,RESOL,N,12/07/2007,1,10307 N SALINE AVE,64154,NULL,Platte,North,218660,39.281267,-94.651289,Trash,NULL,NULL,2007-12-07,2007-12-06,2024-01-30 20:56:05,DAMG7370_Lakshmi
148089,2020052772,PHONE,NHS,NHS-Solid Waste-,Trash Collection,Missed by City,04/14/2020,04:08 PM,"OPEN ",N,NULL,NULL,2512 West Paseo Blvd,64108,Beacon Hills,Jackson,Central,13867,39.080684,-94.567287,Trash,Recycling,NULL,NULL,2020-04-14,2024-01-30 20:56:04,DAMG7370_Lakshmi
81886,2020008831,"BOT  ",NHS,NHS-Solid Waste-,Recycling,Missed by Contractor South,01/21/2020,04:59 PM,"OPEN ",N,NULL,NULL,13012 Grand Ave,64145,Woodbridge,Jackson,South,158945,38.891434,-94.593075,Trash,Recycling,NULL,NULL,2020-01-21,2024-01-30 20:56:04,DAMG7370_Lakshmi
1230030,2017004293,PHONE,Public Works,Public Works-Capital Projects-Traffic Control,Traffic Sign,New Sign Request,01/11/2017,10:16 AM,RESOL,N,01/18/2017,7,1740 Paseo,64108,NULL,Jackson,Central,254050,39.091884,-94.56525,Signs,NULL,NULL,2017-01-18,2017-01-11,2024-01-30 20:56:05,DAMG7370_Lakshmi
455232,2009095186,PHONE,NHS,NHS-Solid Waste-,07,ALL,04/17/2009,04:48 PM,RESOL,N,05/08/2009,21,5306 NORLEDGE AVE,64123,NULL,Jackson,NULL,0,35.797519,-103.890579,Bulky Appointment,NULL,NULL,2009-05-08,2009-04-17,2024-01-30 20:56:05,DAMG7370_Lakshmi
328230,2008132074,PHONE,NHS,NHS-Solid Waste-,Contractor,All,05/31/2008,11:26 AM,RESOL,N,06/02/2008,2,8803 Glenwood Ave,64138,NULL,NULL,NULL,0,35.797519,-103.890579,Trash,NULL,NULL,2008-06-02,2008-05-31,2024-01-30 20:56:05,DAMG7370_Lakshmi
1549630,2019134045,PHONE,NHS,NHS-Neighborhood Preservation-,Property Maintenance,Other Property Issue,07/17/2019,10:54 AM,"OPEN ",Y,NULL,NULL,3415 Garfield Ave,64109,Key Coalition,Jackson,Central,126447,39.063858,-94.558593,Property,Buildings,Construction,NULL,2019-07-17,2024-01-30 20:56:06,DAMG7370_Lakshmi
883320,2013101006,"WEB  ",Health,Health-Food Protection-,All,All,07/19/2013,12:41 AM,RESOL,N,07/24/2013,5,1652 N CORRINGTON AVE,64120,NULL,Jackson,East,234446,39.134624,-94.496732,Food Protection,NULL,NULL,2013-07-24,2013-07-19,2024-01-30 20:56:05,DAMG7370_Lakshmi
15508,2016122910,PHONE,NHS,NHS-Neighborhood Preservation-,Property Maintenance,Main Structure,10/03/2016,12:56 PM,"OPEN ",Y,NULL,NULL,7146 Agnes Ave,64132,Noble And Gregory Ridge,Jackson,Metro,3621,38.996188,-94.552671,Property,Buildings,Construction,NULL,2016-10-03,2024-01-30 20:56:04,DAMG7370_Lakshmi
1295865,2017122189,PHONE,Water Services,Water Services-Line Maintenance-Stormwater,Storm Drain / Catch Basin,Clogged / Over-Flow,09/21/2017,02:03 PM,RESOL,N,09/29/2017,8,2944 Southwest Blvd,64108,NULL,Jackson,Central,128947,39.074504,-94.604977,Storm Water,Sewer,NULL,2017-09-29,2017-09-21,2024-01-30 20:56:06,DAMG7370_Lakshmi
418579,2009001828,PHONE,Water Services,Water Services-Line Maintenance-Wastewater,All,All,01/05/2009,08:38 AM,RESOL,N,01/07/2009,2,11019 OLIVE ST,64131,NULL,NULL,NULL,0,35.797519,-103.890579,Sewer,NULL,NULL,2009-01-07,2009-01-05,2024-01-30 20:56:05,DAMG7370_Lakshmi
321111,2008097747,PHONE,Public Works,Public Works-Street and Traffic-District 3,Street,All,04/25/2008,01:06 PM,RESOL,Y,06/19/2008,55,9812 E 50th St,64133,NULL,NULL,NULL,0,35.797519,-103.890579,Maintenance,NULL,NULL,2008-06-19,2008-04-25,2024-01-30 20:56:05,DAMG7370_Lakshmi
256231,2007131602,INSPE,NHS,NHS-Neighborhood Preservation-,Private Property,All,10/02/2007,04:55 PM,"CANC ",Y,09/30/2019,NULL,3808 E 61st St,64130,Swope Parkway-Elmwood,NULL,Metro,880,39.015139,-94.541199,Property & Nuisance Violations,NULL,NULL,2019-09-30,2007-10-02,2024-01-30 20:56:05,DAMG7370_Lakshmi
371882,2008209546,PHONE,NHS,NHS-Neighborhood Preservation-,Private Property,All,08/20/2008,02:07 PM,"CANC ",Y,09/30/2019,NULL,2100 Prospect Ave,64127,NULL,NULL,NULL,0,35.797519,-103.890579,Nuisance Violations,NULL,NULL,2019-09-30,2008-08-20,2024-01-30 20:56:05,DAMG7370_Lakshmi
477995,2009138435,PHONE,NHS,NHS-Neighborhood Preservation-,Private Property,All,05/27/2009,04:33 PM,"CANC ",Y,09/30/2019,NULL,2 E 99th St,64114,Willow Creek,NULL,South,152101,38.949355,-94.5913,Nuisance Violations,NULL,NULL,2019-09-30,2009-05-27,2024-01-30 20:56:05,DAMG7370_Lakshmi
1210995,2016150422,PHONE,NHS,NHS-Neighborhood Preservation-,Nuisance,Open Storage,12/12/2016,08:57 AM,"OPEN ",Y,NULL,NULL,6616 E 12th Ter,64126,East Blue Valley,Jackson,East,6965,39.096696,-94.504517,Trash,Recycling,NULL,NULL,2016-12-12,2024-01-30 20:56:05,DAMG7370_Lakshmi
284884,2008003198,PHONE,NHS,NHS-Animal Health and Safety-,Other,Non Emergency,01/05/2008,08:16 AM,RESOL,N,01/05/2008,0,2930 NE 39th St,64117,NULL,NULL,NULL,0,35.797519,-103.890579,Animal,NULL,NULL,2008-01-05,2008-01-05,2024-01-30 20:56:05,DAMG7370_Lakshmi
602956,2010210183,PHONE,NHS,NHS-Animal Health and Safety-,Other,Non Emergency,06/08/2010,12:05 PM,RESOL,N,06/09/2010,1,1300 N Corrington Ave,64120,NULL,Jackson,East,38408,39.130747,-94.497193,Animal,NULL,NULL,2010-06-09,2010-06-08,2024-01-30 20:56:05,DAMG7370_Lakshmi
486778,2009159688,PHONE,Water Services,Water Services-Meter and Field Services-,All,All,06/16/2009,08:44 AM,RESOL,Y,08/25/2009,70,7533 OLIVE ST,64132,NULL,NULL,NULL,0,35.797519,-103.890579,Water Leak,NULL,NULL,2009-08-25,2009-06-16,2024-01-30 20:56:05,DAMG7370_Lakshmi
349232,2008143702,PHONE,NHS,NHS-Animal Health and Safety-,Other,Non Emergency,06/12/2008,09:59 AM,RESOL,N,06/12/2008,0,4301 N Corrington Ave,64117,NULL,NULL,NULL,0,35.797519,-103.890579,Animal,NULL,NULL,2008-06-12,2008-06-12,2024-01-30 20:56:05,DAMG7370_Lakshmi
431567,2009022112,PHONE,NHS,NHS-Neighborhood Preservation-,Private Property,All,01/28/2009,12:27 PM,RESOL,Y,10/08/2009,253,3022 BALES AVE,64128,NULL,NULL,NULL,0,35.797519,-103.890579,Nuisance Violations,NULL,NULL,2009-10-08,2009-01-28,2024-01-30 20:56:05,DAMG7370_Lakshmi
265428,2007114094,PHONE,Public Works,Public Works-Street and Traffic-District 3,Street,All,09/07/2007,08:24 AM,RESOL,Y,01/07/2008,122,8305 Ward Pkwy,64114,NULL,NULL,NULL,0,35.797519,-103.890579,Maintenance,NULL,NULL,2008-01-07,2007-09-07,2024-01-30 20:56:05,DAMG7370_Lakshmi
439873,2009050547,PHONE,NHS,NHS-Neighborhood Preservation-,Private Property,All,02/27/2009,08:32 AM,"CANC ",Y,09/30/2019,NULL,27 W 77TH ST,64114,Tower Homes,NULL,Metro,118399,38.988297,-94.591223,Nuisance Violations,NULL,NULL,2019-09-30,2009-02-27,2024-01-30 20:56:05,DAMG7370_Lakshmi
31986,2020093097,PHONE,Public Works,Public Works-Capital Projects-Traffic Control,Traffic Sign,Remove Sign,07/08/2020,08:58 AM,"OPEN ",N,NULL,NULL,3648 Wyandotte St,64111,Hanover Place,Jackson,Central,132180,39.060452,-94.588546,Signs,NULL,NULL,NULL,2020-07-08,2024-01-30 20:56:04,DAMG7370_Lakshmi
323531,2008108044,PHONE,NHS,NHS-Animal Health and Safety-,Other,Non Emergency,05/06/2008,10:04 AM,RESOL,N,05/06/2008,0,3905 CYPRESS AVE,64130,NULL,Jackson,NULL,0,35.797519,-103.890579,Animal,NULL,NULL,2008-05-06,2008-05-06,2024-01-30 20:56:05,DAMG7370_Lakshmi
117597,2020031683,"WEB  ",NHS,NHS-Neighborhood Preservation-,Parked on Unapproved Surface,Car Private Property,03/02/2020,03:27 PM,"OPEN ",N,NULL,NULL,3319 Flora Ave,64109,Linwood Homeowners-Ivanhoe,Jackson,Central,125990,39.06589,-94.565395,Vehicles,Parking,NULL,NULL,2020-03-02,2024-01-30 20:56:04,DAMG7370_Lakshmi
149892,2020094838,"WEB  ",NHS,NHS-Neighborhood Preservation-,Property Maintenance,Main Structure,07/10/2020,03:29 PM,"OPEN ",Y,NULL,NULL,126 NW 112th Ter,64155,Meadowbrook Heights,Clay,North,100458,39.297681,-94.581638,Property,Buildings,Construction,NULL,2020-07-10,2024-01-30 20:56:04,DAMG7370_Lakshmi
196164,2018054976,PHONE,Water Services,Water Services-Meter and Field Services-,Leak,Meter,05/03/2018,01:19 PM,"OPEN ",N,NULL,NULL,409 NW 66TH TER CLUBHOUSE,64118,Tanglewood And Regency North,Clay,North,247914,39.214448,-94.588373,Water,NULL,NULL,NULL,2018-05-03,2024-01-30 20:56:04,DAMG7370_Lakshmi
379532,2008246278,PHONE,NHS,NHS-Animal Health and Safety-,Other,Non Emergency,10/02/2008,12:49 PM,RESOL,N,10/02/2008,0,8819 Arlington Ave,64138,NULL,NULL,NULL,0,35.797519,-103.890579,Animal,NULL,NULL,2008-10-02,2008-10-02,2024-01-30 20:56:05,DAMG7370_Lakshmi
422743,2008303128,PHONE,NHS,NHS-Neighborhood Preservation-,Private Property,All,12/11/2008,09:49 AM,"CANC ",Y,09/30/2019,NULL,5221 COLLEGE AVE,64130,North Town Fork Creek,Jackson,Metro,35929,39.030895,-94.546482,Property & Nuisance Violations,NULL,NULL,2019-09-30,2008-12-11,2024-01-30 20:56:05,DAMG7370_Lakshmi
121045,2009115217,PHONE,NHS,NHS-Solid Waste-,12,ALL,05/06/2009,01:03 PM,RESOL,N,06/15/2009,40,7104 E 108th st,64134,NULL,NULL,NULL,0,35.797519,-103.890579,Bulky Appointment,NULL,NULL,2009-06-15,2009-05-06,2024-01-30 20:56:04,DAMG7370_Lakshmi
378547,2008238214,PHONE,NHS,NHS-Neighborhood Preservation-,Private Property,All,09/23/2008,09:34 AM,"CANC ",Y,09/30/2019,NULL,1922 E 70th St,64132,Neighbors United For Action,NULL,Metro,114170,39.000422,-94.563898,Nuisance Violations,NULL,NULL,2019-09-30,2008-09-23,2024-01-30 20:56:05,DAMG7370_Lakshmi
358920,2008190929,PHONE,NHS,NHS-Dangerous Buildings-Emergency,Private Property,All,07/31/2008,12:21 PM,"CANC ",Y,09/30/2019,NULL,1464 E 67TH ST,64131,Neighbors United For Action,Jackson,Metro,105525,39.00601,-94.567516,Property & Nuisance Violations,NULL,NULL,2019-09-30,2008-07-31,2024-01-30 20:56:05,DAMG7370_Lakshmi
89739,2020029119,"WEB  ",City Managers Office,City Managers Office-311 Call Center-Support,Other-Maintenance,District 2,02/26/2020,03:56 PM,"OPEN ",N,NULL,NULL,3906 Baltimore Ave,64111,Old Westport,Jackson,Central,132680,39.056315,-94.587523,Streets,Roadways,Alleys,NULL,2020-02-26,2024-01-30 20:56:04,DAMG7370_Lakshmi
37767,2020119442,PHONE,NHS,NHS-Dangerous Buildings-,Dangerous Building,Standard,09/03/2020,09:15 AM,"OPEN ",Y,NULL,NULL,427 N Bellaire Ave,64123,North Indian Mound,Jackson,East,45566,39.11689,-94.512287,Property,Buildings,Construction,NULL,2020-09-03,2024-01-30 20:56:04,DAMG7370_Lakshmi
1414382,2018122327,PHONE,Health,Health-Food Protection-,Food Establishment,Restaurant,09/11/2018,04:17 PM,RESOL,N,09/18/2018,7,6887 E Front St,64120,NULL,Jackson,East,38418,39.129632,-94.502244,Public Health,NULL,NULL,2018-09-18,2018-09-11,2024-01-30 20:56:06,DAMG7370_Lakshmi
66632,2020045970,PHONE,Parks and Rec,Parks and Rec-Central Region-,Park Maintenance,Central,03/31/2020,04:07 PM,"OPEN ",N,NULL,NULL,5815 Gladstone Blvd,64123,North Indian Mound,Jackson,East,45523,39.118802,-94.512954,Parks & Recreation,NULL,NULL,NULL,2020-03-31,2024-01-30 20:56:04,DAMG7370_Lakshmi
521235,2009241511,EMAIL,NHS,NHS-Dangerous Buildings-,Board Up,All,09/01/2009,10:55 AM,RESOL,Y,10/12/2009,41,5031 Brooklyn Ave,64130,NULL,NULL,NULL,0,35.797519,-103.890579,Property Violations,NULL,NULL,2009-10-12,2009-09-01,2024-01-30 20:56:05,DAMG7370_Lakshmi
272359,2007173869,PHONE,NHS,NHS-Solid Waste-,Roll-out Cart,All,12/03/2007,08:38 AM,RESOL,N,12/03/2007,0,508 Askew Ave,64124,NULL,NULL,NULL,0,35.797519,-103.890579,Trash,NULL,NULL,2007-12-03,2007-12-03,2024-01-30 20:56:05,DAMG7370_Lakshmi
543653,2009362068,PHONE,NHS,NHS-Neighborhood Preservation-,Private Property,All,12/16/2009,09:31 AM,"CANC ",N,09/30/2019,NULL,2733 Garfield Ave,64109,Key Coalition,Jackson,Central,26681,39.076045,-94.558004,Nuisance Violations,NULL,NULL,2019-09-30,2009-12-16,2024-01-30 20:56:05,DAMG7370_Lakshmi
369619,2008202084,PHONE,NHS,NHS-Dangerous Buildings-Emergency,Private Property,All,08/13/2008,10:51 AM,"CANC ",Y,09/30/2019,NULL,5704 Swope Pkwy,64130,NULL,NULL,NULL,0,35.797519,-103.890579,Property & Nuisance Violations,NULL,NULL,2019-09-30,2008-08-13,2024-01-30 20:56:05,DAMG7370_Lakshmi
143474,2020127381,PHONE,NHS,NHS-Neighborhood Preservation-,Property Maintenance,Main Structure,09/23/2020,11:16 AM,"OPEN ",N,NULL,NULL,5216 Wabash Ave,64130,Blue Hills,Jackson,Metro,145288,39.031003,-94.556396,Property,Buildings,Construction,NULL,2020-09-23,2024-01-30 20:56:04,DAMG7370_Lakshmi
439603,2009057345,PHONE,NHS,NHS-Solid Waste-,20,March,03/08/2009,04:16 PM,RESOL,N,03/23/2009,15,5401 NE Russell RD,64117,NULL,NULL,NULL,0,35.797519,-103.890579,Bulky Appointment,NULL,NULL,2009-03-23,2009-03-08,2024-01-30 20:56:05,DAMG7370_Lakshmi
280775,2008011248,PHONE,NHS,NHS-Animal Health and Safety-,Other,Non Emergency,01/15/2008,10:56 AM,RESOL,N,01/15/2008,0,3126 Cleveland Ave,64128,NULL,NULL,NULL,0,35.797519,-103.890579,Animal,NULL,NULL,2008-01-15,2008-01-15,2024-01-30 20:56:05,DAMG7370_Lakshmi
305007,2008050986,PHONE,Public Works,Public Works-Capital Projects-Traffic Control,Encroachment,*Select one,03/05/2008,03:04 PM,RESOL,N,03/06/2008,1,5531 TRACY AVE,64110,NULL,NULL,NULL,0,35.797519,-103.890579,Right of Way,NULL,NULL,2008-03-06,2008-03-05,2024-01-30 20:56:05,DAMG7370_Lakshmi
186247,2020152854,PHONE,NHS,NHS-Neighborhood Preservation-Abatement,Dumping,Right of Way LB Central,12/07/2020,02:36 PM,"OPEN ",Y,NULL,NULL,4001 Olive St,64130,Ivanhoe Southeast,Jackson,Central,136506,39.053598,-94.555644,Trash,Recycling,NULL,NULL,2020-12-07,2024-01-30 20:56:04,DAMG7370_Lakshmi
245618,2007104506,PHONE,Public Works,Public Works-Solid Waste-,Right of Way,All,08/23/2007,08:24 AM,RESOL,N,08/24/2007,1,1400 E 76TH TER,64131,NULL,NULL,NULL,0,35.797519,-103.890579,Trash,NULL,NULL,2007-08-24,2007-08-23,2024-01-30 20:56:05,DAMG7370_Lakshmi
350244,2008151250,PHONE,NHS,NHS-Neighborhood Preservation-,Private Property,All,06/20/2008,09:42 AM,"CANC ",Y,09/30/2019,NULL,6336 INDIANA AVE,64132,Swope Park Campus,Jackson,Metro,1568,39.01069,-94.547287,Nuisance Violations,NULL,NULL,2019-09-30,2008-06-20,2024-01-30 20:56:05,DAMG7370_Lakshmi
382026,2008241678,PHONE,NHS,NHS-Neighborhood Preservation-,Private Property,All,09/26/2008,10:49 AM,RESOL,Y,03/04/2009,159,4421 Windsor Ave,64123,NULL,NULL,NULL,0,35.797519,-103.890579,Nuisance Violations,NULL,NULL,2009-03-04,2008-09-26,2024-01-30 20:56:05,DAMG7370_Lakshmi
420188,2008301905,PHONE,Public Works,Public Works-Street and Traffic-Snow,Street,District One,12/10/2008,09:20 AM,RESOL,N,12/23/2008,13,8418 N BEECH AVE,64153,NULL,Platte,North,168235,39.248318,-94.691566,Snow & Ice,NULL,NULL,2008-12-23,2008-12-10,2024-01-30 20:56:05,DAMG7370_Lakshmi
226336,2007034781,PHONE,NHS,NHS-Neighborhood Preservation-,Private Property,All,04/17/2007,12:23 PM,RESOL,N,05/31/2007,44,4208 E 58TH ST,64130,NULL,NULL,NULL,0,35.797519,-103.890579,Property Violations,NULL,NULL,2007-05-31,2007-04-17,2024-01-30 20:56:05,DAMG7370_Lakshmi
466292,2009105914,PHONE,Public Works,Public Works-Solid Waste-,City,Missed,04/28/2009,03:34 PM,RESOL,N,04/29/2009,1,7610 E 51st St,64129,NULL,NULL,NULL,0,35.797519,-103.890579,Trash,NULL,NULL,2009-04-29,2009-04-28,2024-01-30 20:56:05,DAMG7370_Lakshmi
2083,2020019600,"WEB  ",Health,Health-Noise Control-,Noise,Other,02/08/2020,11:22 PM,RESOL,N,02/11/2020,3,425 Washington St,64105,NULL,Jackson,Central,148459,39.108022,-94.589405,Public Health,NULL,NULL,2020-02-11,2020-02-08,2024-01-30 20:56:04,DAMG7370_Lakshmi
55099,2020006258,"WEB  ",Public Works,Public Works-Street and Traffic-Streetlights,Street Light,Pole Down or Leaning,01/15/2020,08:50 AM,RESOL,N,01/22/2020,7,400 W 5th St,64105,NULL,Jackson,Central,148454,39.107949,-94.588895,Lights,Signals,NULL,2020-01-22,2020-01-15,2024-01-30 20:56:04,DAMG7370_Lakshmi
293244,2008035281,PHONE,NHS,NHS-Neighborhood Preservation-,Private Property,All,02/14/2008,12:11 PM,RESOL,N,02/25/2008,11,3807 e 71st ter,64132,NULL,NULL,NULL,0,35.797519,-103.890579,Nuisance Violations,NULL,NULL,2008-02-25,2008-02-14,2024-01-30 20:56:05,DAMG7370_Lakshmi
522201,2009345900,PHONE,NHS,NHS-Neighborhood Preservation-,Private Property,All,12/02/2009,12:20 PM,"CANC ",N,09/30/2019,NULL,4812 E 8TH ST,64124,Lykins,Jackson,East,7945,39.102883,-94.525266,Nuisance Violations,NULL,NULL,2019-09-30,2009-12-02,2024-01-30 20:56:05,DAMG7370_Lakshmi
513133,2009246282,PHONE,Public Works,Public Works-Solid Waste-,City,Missed,09/06/2009,01:14 PM,RESOL,N,09/08/2009,2,6128 Paseo,64110,NULL,NULL,NULL,0,35.797519,-103.890579,Trash,NULL,NULL,2009-09-08,2009-09-06,2024-01-30 20:56:05,DAMG7370_Lakshmi
472931,2009107325,PHONE,NHS,NHS-Neighborhood Preservation-,Private Property,All,04/29/2009,02:51 PM,"CANC ",Y,09/30/2019,NULL,7100 E 107TH PL,64134,NULL,NULL,NULL,0,35.797519,-103.890579,Nuisance Violations,NULL,NULL,2019-09-30,2009-04-29,2024-01-30 20:56:05,DAMG7370_Lakshmi
412240,2008287340,PHONE,NHS,NHS-Solid Waste-,11,December,11/20/2008,10:09 AM,RESOL,N,12/15/2008,25,621 W 88th St,64114,NULL,NULL,NULL,0,35.797519,-103.890579,Bulky Appointment,NULL,NULL,2008-12-15,2008-11-20,2024-01-30 20:56:05,DAMG7370_Lakshmi
170304,2020143972,"WEB  ",Water Services,Water Services-Meter and Field Services-,Leak,At Curb / In Yard,11/09/2020,02:35 PM,"CANC ",Y,12/19/2020,NULL,9320 Cleveland Ave,64132,Hidden Valley,Jackson,Metro,55905,38.95476,-94.542724,Water,NULL,NULL,2020-12-19,2020-11-09,2024-01-30 20:56:04,DAMG7370_Lakshmi
802512,2012113050,PHONE,Water Services,Water Services-Line Maintenance-Pipeline,Curb Box,Central Region,08/16/2012,09:00 AM,RESOL,N,11/01/2012,77,6701 ST JOHN AVE,64120,NULL,Jackson,East,46351,39.110991,-94.503347,Water Leak,NULL,NULL,2012-11-01,2012-08-16,2024-01-30 20:56:05,DAMG7370_Lakshmi
1558731,2019169042,PHONE,NHS,NHS-Neighborhood Preservation-,Nuisance,Trash on Private Property,09/20/2019,10:10 AM,"OPEN ",N,NULL,NULL,2305 Brooklyn Ave,64127,Wendell Phillips,Jackson,Central,14096,39.084196,-94.556424,Trash,Recycling,NULL,NULL,2019-09-20,2024-01-30 20:56:06,DAMG7370_Lakshmi
398962,2008250008,PHONE,NHS,NHS-Neighborhood Preservation-,Private Property,All,10/07/2008,02:45 PM,"CANC ",Y,09/30/2019,NULL,6835 TRUMAN RD,64126,East Blue Valley,Jackson,East,7239,39.092667,-94.501708,Nuisance Violations,NULL,NULL,2019-09-30,2008-10-07,2024-01-30 20:56:05,DAMG7370_Lakshmi
499437,2009195190,PHONE,Public Works,Public Works-Administration-,Administration,All,07/17/2009,08:16 AM,RESOL,N,07/21/2009,4,414 E 12TH ST,64106,NULL,NULL,NULL,0,35.797519,-103.890579,Public Works,NULL,NULL,2009-07-21,2009-07-17,2024-01-30 20:56:05,DAMG7370_Lakshmi
527569,2009327416,PHONE,NHS,NHS-Neighborhood Preservation-,Private Property,All,11/16/2009,11:14 AM,"CANC ",Y,09/30/2019,NULL,2919 MONROE AVE,64128,Ingleside,Jackson,East,24063,39.072057,-94.539776,Property Violations,NULL,NULL,2019-09-30,2009-11-16,2024-01-30 20:56:05,DAMG7370_Lakshmi
531592,2009347915,PHONE,NHS,NHS-Animal Health and Safety-,Other,Non Emergency,12/03/2009,05:17 PM,RESOL,N,12/09/2009,6,5600 E Gregory Blvd,64132,NULL,Jackson,Metro,44,38.99584,-94.52301,Animal,NULL,NULL,2009-12-09,2009-12-03,2024-01-30 20:56:05,DAMG7370_Lakshmi
445840,2009045188,PHONE,NHS,NHS-Solid Waste-,11,March,02/21/2009,01:46 PM,RESOL,N,03/12/2009,19,809 COUNTRY LN,64114,NULL,Jackson,NULL,0,35.797519,-103.890579,Bulky Appointment,NULL,NULL,2009-03-12,2009-02-21,2024-01-30 20:56:05,DAMG7370_Lakshmi
114220,2020015631,INSPE,NHS,NHS-Neighborhood Preservation-,Property Maintenance,Graffiti,01/31/2020,08:51 AM,"OPEN ",N,NULL,NULL,1229 Union Ave,64101,NULL,Jackson,Central,123169,39.102206,-94.599622,Property,Buildings,Construction,NULL,2020-01-31,2024-01-30 20:56:04,DAMG7370_Lakshmi
520674,2009242996,PHONE,NHS,NHS-Neighborhood Preservation-,Private Property,All,09/02/2009,11:16 AM,RESOL,N,10/20/2009,48,9508 Wallace Ave,64134,NULL,NULL,NULL,0,35.797519,-103.890579,Nuisance Violations,NULL,NULL,2009-10-20,2009-09-02,2024-01-30 20:56:05,DAMG7370_Lakshmi
380776,2008227827,PHONE,NHS,NHS-Animal Health and Safety-,Emergency,*Select one,09/10/2008,12:39 PM,RESOL,N,09/10/2008,0,4005 VINEYARD RD,64130,NULL,NULL,NULL,0,35.797519,-103.890579,Animal,NULL,NULL,2008-09-10,2008-09-10,2024-01-30 20:56:05,DAMG7370_Lakshmi
195005,2008227388,PHONE,NHS,NHS-Solid Waste-,Bulky,Appointment,09/10/2008,09:00 AM,RESOL,N,09/30/2008,20,2924 Poplar Ave,64128,NULL,NULL,NULL,0,35.797519,-103.890579,Trash,NULL,NULL,2008-09-30,2008-09-10,2024-01-30 20:56:04,DAMG7370_Lakshmi
202185,2019148017,PHONE,NHS,NHS-Neighborhood Preservation-,Property Maintenance,Main Structure,08/12/2019,10:41 AM,"OPEN ",Y,NULL,NULL,7207 E 86th St,64138,Oldham Farms,Jackson,Metro,55232,38.968866,-94.504802,Property,Buildings,Construction,NULL,2019-08-12,2024-01-30 20:56:04,DAMG7370_Lakshmi
357032,2008175070,PHONE,Water Services,Water Services-Line Maintenance-Pipeline,All,All,07/14/2008,08:02 PM,RESOL,Y,09/29/2008,77,3833 CENTRAL ST,64111,NULL,Jackson,NULL,0,35.797519,-103.890579,Water Leak,NULL,NULL,2008-09-29,2008-07-14,2024-01-30 20:56:05,DAMG7370_Lakshmi
591285,2010176853,PHONE,NHS,NHS-Animal Health and Safety-,Other,Non Emergency,05/11/2010,03:02 PM,RESOL,N,05/12/2010,1,1410 Genessee St,64102,NULL,Jackson,Central,123260,39.097671,-94.60603,Animal,NULL,NULL,2010-05-12,2010-05-11,2024-01-30 20:56:05,DAMG7370_Lakshmi
261948,2007118177,PHONE,NHS,NHS-Neighborhood Preservation-,Private Property,All,09/12/2007,03:33 PM,RESOL,N,10/22/2007,40,4307 E 19TH ST,64127,NULL,Jackson,NULL,0,35.797519,-103.890579,Property & Nuisance Violations,NULL,NULL,2007-10-22,2007-09-12,2024-01-30 20:56:05,DAMG7370_Lakshmi
209702,2007025612,PHONE,NHS,NHS-Neighborhood Preservation-,Private Property,All,03/21/2007,11:44 AM,RESOL,N,03/30/2007,9,5107 Gladstone Blvd,64123,NULL,NULL,NULL,0,35.797519,-103.890579,Property & Nuisance Violations,NULL,NULL,2007-03-30,2007-03-21,2024-01-30 20:56:04,DAMG7370_Lakshmi
589447,2010152394,PHONE,Public Works,Public Works-Solid Waste-,Bulky,Missed,04/23/2010,08:52 AM,RESOL,N,04/26/2010,3,1218 NW 74th St,64118,NULL,NULL,NULL,0,35.797519,-103.890579,Trash,NULL,NULL,2010-04-26,2010-04-23,2024-01-30 20:56:05,DAMG7370_Lakshmi
12878,2021025566,PHONE,NHS,NHS-Neighborhood Preservation-,Property Maintenance,Other Property Issue,04/16/2021,08:53 AM,"OPEN ",N,NULL,NULL,1607 White Ave,64126,West Blue Valley,Jackson,East,6547,39.091699,-94.512281,Property,Buildings,Construction,NULL,2021-04-16,2024-01-30 20:56:04,DAMG7370_Lakshmi
541907,2009355412,PHONE,NHS,NHS-Neighborhood Preservation-,Private Property,All,12/10/2009,09:12 AM,"CANC ",N,09/30/2019,NULL,8301 PASEO,64132,Marlborough Heights/Marlborough Pride,Jackson,Metro,117330,38.976942,-94.566899,Nuisance Violations,NULL,NULL,2019-09-30,2009-12-10,2024-01-30 20:56:05,DAMG7370_Lakshmi
261637,2007124246,PHONE,Parks and Rec,Parks and Rec-Landscape Services-Weeds,Right of Way,All,09/21/2007,10:32 AM,RESOL,Y,04/01/2008,193,6820 N Summit St,64118,NULL,NULL,NULL,0,35.797519,-103.890579,Weeds,NULL,NULL,2008-04-01,2007-09-21,2024-01-30 20:56:05,DAMG7370_Lakshmi
1314280,2017142344,PHONE,Water Services,Water Services-Meter and Field Services-,No Water / Pressure,Low Pressure,11/08/2017,10:48 AM,RESOL,N,11/09/2017,1,1600 Genessee St,64102,NULL,Jackson,Central,262674,39.094687,-94.605617,Water,NULL,NULL,2017-11-09,2017-11-08,2024-01-30 20:56:06,DAMG7370_Lakshmi
258063,2007122313,PHONE,Water Services,Water Services-Line Maintenance-Stormwater,Catch Basin,All,09/18/2007,04:45 PM,RESOL,N,10/03/2007,15,401 WARD PKWY,64112,NULL,Jackson,NULL,0,35.797519,-103.890579,Storm Water,NULL,NULL,2007-10-03,2007-09-18,2024-01-30 20:56:05,DAMG7370_Lakshmi
407170,2008286288,PHONE,Public Works,Public Works-Solid Waste-,Animal,Dead,11/19/2008,08:19 AM,RESOL,Y,11/26/2008,7,7705 NW 74th Ter,64152,NULL,NULL,NULL,0,35.797519,-103.890579,Trash,NULL,NULL,2008-11-26,2008-11-19,2024-01-30 20:56:05,DAMG7370_Lakshmi
1151086,2016061920,"WEB  ",NHS,NHS-Neighborhood Preservation-,Private / Commercial,Lot - Structure,06/03/2016,02:31 PM,RESOL,N,06/28/2016,25,1319 Hickory St,64101,NULL,Jackson,Central,123237,39.099016,-94.601136,Mowing,Weeds,NULL,2016-06-28,2016-06-03,2024-01-30 20:56:05,DAMG7370_Lakshmi
1293221,2017120901,PHONE,NHS,NHS-Neighborhood Preservation-,Nuisance,Trash on Private Property,09/19/2017,01:06 PM,"OPEN ",Y,NULL,NULL,2808 HIGHLAND AVE,64109,Mount Hope,Jackson,Central,27069,39.075267,-94.56332,Trash,Recycling,NULL,NULL,2017-09-19,2024-01-30 20:56:05,DAMG7370_Lakshmi
79364,2020130961,EMAIL,NHS,NHS-Neighborhood Preservation-,Property Maintenance,Main Structure,10/02/2020,10:18 AM,"OPEN ",Y,NULL,NULL,100 NE 79th Ter,64118,Jefferson Highlands,Clay,North,95085,39.238496,-94.579263,Property,Buildings,Construction,NULL,2020-10-02,2024-01-30 20:56:04,DAMG7370_Lakshmi
319546,2008099064,PHONE,NHS,NHS-Neighborhood Preservation-,Private Property,All,04/28/2008,09:29 AM,RESOL,N,06/02/2008,35,5132 N Elmwood Ave,64119,NULL,NULL,NULL,0,35.797519,-103.890579,Nuisance Violations,NULL,NULL,2008-06-02,2008-04-28,2024-01-30 20:56:05,DAMG7370_Lakshmi
481301,2009138607,PHONE,NHS,NHS-Animal Health and Safety-,Other,Non Emergency,05/27/2009,06:44 PM,RESOL,N,05/28/2009,1,206 N WHEELING AVE,64123,NULL,NULL,NULL,0,35.797519,-103.890579,Animal,NULL,NULL,2009-05-28,2009-05-27,2024-01-30 20:56:05,DAMG7370_Lakshmi
535346,2009368481,PHONE,NHS,NHS-Neighborhood Preservation-,Private Property,All,12/22/2009,08:42 AM,"CANC ",N,09/30/2019,NULL,5035 BELLEFONTAINE AVE,64130,North Town Fork Creek,Jackson,Metro,35362,39.034066,-94.548593,Nuisance Violations,NULL,NULL,2019-09-30,2009-12-22,2024-01-30 20:56:05,DAMG7370_Lakshmi
1240846,2017025239,PHONE,Parks and Rec,Parks and Rec-Landscape Services-Forestry,Storm Damage,Tree Down,03/06/2017,10:57 PM,RESOL,N,03/07/2017,1,6200 Wilson Ave,64123,NULL,Jackson,East,45906,39.108306,-94.508524,Trees,NULL,NULL,2017-03-07,2017-03-06,2024-01-30 20:56:05,DAMG7370_Lakshmi
373153,2008213685,PHONE,Public Works,Public Works-Capital Projects-Traffic Control,Traffic Study,Traffic,08/25/2008,05:09 PM,RESOL,N,09/11/2008,17,1300 NW 68TH ST,64118,NULL,Clay,NULL,0,35.797519,-103.890579,Traffic Study,NULL,NULL,2008-09-11,2008-08-25,2024-01-30 20:56:05,DAMG7370_Lakshmi
452367,2009090101,PHONE,NHS,NHS-Animal Health and Safety-,Emergency,*Select one,04/13/2009,06:17 PM,RESOL,N,04/14/2009,1,3639 N MONROE AVE,64117,NULL,Clay,NULL,0,35.797519,-103.890579,Animal,NULL,NULL,2009-04-14,2009-04-13,2024-01-30 20:56:05,DAMG7370_Lakshmi
712699,2011158603,PHONE,Public Works,Public Works-Street and Traffic-Streetlights,Outage,Single,07/19/2011,11:13 AM,RESOL,Y,07/27/2011,8,400 W 5th St,64105,NULL,Jackson,Central,148454,39.107949,-94.588895,Street Light,NULL,NULL,2011-07-27,2011-07-19,2024-01-30 20:56:05,DAMG7370_Lakshmi
120475,2019197030,PHONE,Water Services,Water Services-Meter and Field Services-,MFS Referral (Meter Field Services),Investigation,11/25/2019,05:21 PM,"CANC ",N,11/27/2019,NULL,11711 Oakley Ave,64137,Hickman Mills,Jackson,South,74375,38.911392,-94.5266,Water,NULL,NULL,2019-11-27,2019-11-25,2024-01-30 20:56:04,DAMG7370_Lakshmi
301759,2008016352,PHONE,NHS,NHS-Neighborhood Preservation-,Private Property,All,01/22/2008,10:09 AM,RESOL,N,02/11/2008,20,7101 E 103RD TER,64134,NULL,NULL,NULL,0,35.797519,-103.890579,Property & Nuisance Violations,NULL,NULL,2008-02-11,2008-01-22,2024-01-30 20:56:05,DAMG7370_Lakshmi
1499171,2019075285,EMAIL,NHS,NHS-Neighborhood Preservation-,Nuisance,Trash on Private Property,04/17/2019,04:00 PM,"OPEN ",Y,NULL,NULL,1920 Topping Ave,64127,Central Blue Valley And Park Tower Gardens,Jackson,East,17751,39.087284,-94.515541,Trash,Recycling,NULL,NULL,2019-04-17,2024-01-30 20:56:06,DAMG7370_Lakshmi
268484,2007145125,PHONE,Public Works,Public Works-Solid Waste-,Animal,Dead,10/22/2007,09:55 AM,RESOL,N,10/23/2007,1,5700 OLIVE ST,64130,NULL,NULL,NULL,0,35.797519,-103.890579,Trash,NULL,NULL,2007-10-23,2007-10-22,2024-01-30 20:56:05,DAMG7370_Lakshmi
1501279,2019073442,PHONE,Water Services,Water Services-Line Maintenance-Leaf Brush,Leaf / Brush,Missed Pick Up,04/15/2019,04:27 PM,"CANC ",Y,09/30/2019,NULL,11036 Oak St,64114,Red Bridge North,Jackson,South,155236,38.926916,-94.588319,Trash,Recycling,NULL,2019-09-30,2019-04-15,2024-01-30 20:56:06,DAMG7370_Lakshmi
400155,2008254729,PHONE,NHS,NHS-Neighborhood Preservation-,Private Property,All,10/13/2008,12:16 PM,RESOL,N,11/14/2008,32,10308 N SHELBY AVE,64154,NULL,Platte,North,229634,39.281113,-94.656133,Nuisance Violations,NULL,NULL,2008-11-14,2008-10-13,2024-01-30 20:56:05,DAMG7370_Lakshmi
432126,2009007868,PHONE,NHS,NHS-Solid Waste-,21,January,01/10/2009,02:26 PM,RESOL,N,01/22/2009,12,5230 N Flora Ave,64118,NULL,NULL,NULL,0,35.797519,-103.890579,Bulky Appointment,NULL,NULL,2009-01-22,2009-01-10,2024-01-30 20:56:05,DAMG7370_Lakshmi
1332892,2018011603,PHONE,Water Services,Water Services-Line Maintenance-Pipeline,Pipeline Referral,Curb-box / Service Line,01/24/2018,06:09 PM,RESOL,N,02/02/2018,9,815 Woodswether Rd,64105,NULL,Jackson,Central,122922,39.107723,-94.594627,Water,NULL,NULL,2018-02-02,2018-01-24,2024-01-30 20:56:06,DAMG7370_Lakshmi
453244,2009089971,PHONE,NHS,NHS-Animal Health and Safety-Admin,Return Call to Citizen,All,04/13/2009,04:21 PM,RESOL,N,04/13/2009,0,9023 WALNUT ST,64114,NULL,Jackson,NULL,0,35.797519,-103.890579,Animal,NULL,NULL,2009-04-13,2009-04-13,2024-01-30 20:56:05,DAMG7370_Lakshmi
482840,2009138801,EMAIL,NHS,NHS-Dangerous Buildings-Emergency,Private Property,All,05/28/2009,08:35 AM,"CANC ",Y,09/30/2019,NULL,6908 E 114TH TER,64134,Ruskin Heights,NULL,South,60521,38.916294,-94.509664,Property & Nuisance Violations,NULL,NULL,2019-09-30,2009-05-28,2024-01-30 20:56:05,DAMG7370_Lakshmi
326676,2008090948,PHONE,NHS,NHS-Neighborhood Preservation-,Private Property,All,04/18/2008,03:52 PM,RESOL,N,05/01/2008,13,1109 E 42nd St,64110,NULL,NULL,NULL,0,35.797519,-103.890579,Nuisance Violations,NULL,NULL,2008-05-01,2008-04-18,2024-01-30 20:56:05,DAMG7370_Lakshmi
425614,2009005341,EMAIL,NHS,NHS-Dangerous Buildings-,Board Up,All,01/07/2009,03:09 PM,RESOL,N,01/09/2009,2,721 CAMBRIDGE AVE,64125,NULL,NULL,NULL,0,35.797519,-103.890579,Property Violations,NULL,NULL,2009-01-09,2009-01-07,2024-01-30 20:56:05,DAMG7370_Lakshmi
342841,2008147071,PHONE,NHS,NHS-Neighborhood Preservation-,Private Property,All,06/16/2008,03:19 PM,RESOL,Y,03/23/2009,280,4605 N Kenwood Ave,64116,NULL,NULL,NULL,0,35.797519,-103.890579,Nuisance Violations,NULL,NULL,2009-03-23,2008-06-16,2024-01-30 20:56:05,DAMG7370_Lakshmi
394778,2008271929,PHONE,NHS,NHS-Solid Waste-,Bulky,Appointment,11/03/2008,08:52 AM,RESOL,N,11/28/2008,25,1212 NE 81ST TER,64118,NULL,Clay,NULL,0,35.797519,-103.890579,Trash,NULL,NULL,2008-11-28,2008-11-03,2024-01-30 20:56:05,DAMG7370_Lakshmi
144188,2021019858,PHONE,NHS,NHS-Neighborhood Preservation-,Nuisance,Trash on Private Property,02/25/2021,11:18 AM,"OPEN ",N,NULL,NULL,10912 Ewing Ave,64134,Stratford Estates,Jackson,South,59507,38.925315,-94.511844,Trash,Recycling,NULL,NULL,2021-02-25,2024-01-30 20:56:04,DAMG7370_Lakshmi
288218,2008014054,PHONE,Water Services,Water Services-Line Maintenance-Pipeline,All,All,01/17/2008,03:44 PM,RESOL,N,01/21/2008,4,8700 E 107TH ST,64134,NULL,NULL,NULL,0,35.797519,-103.890579,Water Leak,NULL,NULL,2008-01-21,2008-01-17,2024-01-30 20:56:05,DAMG7370_Lakshmi
40599,2020007402,"WEB  ",NHS,NHS-Neighborhood Preservation-,Disabled/Unlicensed on Private Property,Car Private Property,01/17/2020,06:55 AM,"OPEN ",N,NULL,NULL,6016 Marion Ave,64133,Little Blue,Jackson,East,64404,39.011457,-94.434824,Vehicles,Parking,NULL,NULL,2020-01-17,2024-01-30 20:56:04,DAMG7370_Lakshmi
323119,2008112183,PHONE,NHS,NHS-Neighborhood Preservation-,Private Property,All,05/09/2008,11:56 AM,RESOL,N,05/12/2008,3,5218 N Wheeling Ave,64119,NULL,NULL,NULL,0,35.797519,-103.890579,Nuisance Violations,NULL,NULL,2008-05-12,2008-05-09,2024-01-30 20:56:05,DAMG7370_Lakshmi
524608,2009298478,PHONE,NHS,NHS-Neighborhood Preservation-,Private Property,All,10/23/2009,11:10 AM,"CANC ",N,09/30/2019,NULL,8420 E 79TH ST,64138,Park Farms,Jackson,Metro,53439,38.981031,-94.489497,Nuisance Violations,NULL,NULL,2019-09-30,2009-10-23,2024-01-30 20:56:05,DAMG7370_Lakshmi
1023891,2014156289,PHONE,NHS,NHS-Animal Health and Safety-,Wildlife,All,12/22/2014,11:33 AM,RESOL,N,12/23/2014,1,4201 E 63rd St,64132,NULL,Jackson,Metro,22,39.007821,-94.530853,Animal,NULL,NULL,2014-12-23,2014-12-22,2024-01-30 20:56:05,DAMG7370_Lakshmi
241896,2007079554,PHONE,NHS,NHS-Neighborhood Preservation-,Private Property,All,07/09/2007,08:45 AM,RESOL,Y,01/02/2008,177,8701 E 109TH TER,64134,NULL,NULL,NULL,0,35.797519,-103.890579,Nuisance Violations,NULL,NULL,2008-01-02,2007-07-09,2024-01-30 20:56:05,DAMG7370_Lakshmi
354520,2008173161,PHONE,NHS,NHS-Dangerous Buildings-Emergency,Private Property,All,07/12/2008,08:50 AM,"CANC ",Y,09/30/2019,NULL,3947 PASEO,64110,Ivanhoe Southwest,Jackson,Central,135533,39.054224,-94.567223,Property & Nuisance Violations,NULL,NULL,2019-09-30,2008-07-12,2024-01-30 20:56:05,DAMG7370_Lakshmi
230474,2007034882,PHONE,Public Works,Public Works-Street and Traffic-Streetlights,Malfunction,Street Light,04/17/2007,02:27 PM,RESOL,N,04/18/2007,1,7100 E 107TH PL,64134,NULL,NULL,NULL,0,35.797519,-103.890579,Street Light,NULL,NULL,2007-04-18,2007-04-17,2024-01-30 20:56:05,DAMG7370_Lakshmi
157326,2016097923,PHONE,NHS,NHS-Neighborhood Preservation-,Property Maintenance,Other Property Issue,08/17/2016,04:31 PM,"OPEN ",Y,NULL,NULL,5424 College Ave,64130,North Town Fork Creek,Jackson,Metro,36348,39.027551,-94.547112,Property,Buildings,Construction,NULL,2016-08-17,2024-01-30 20:56:04,DAMG7370_Lakshmi
193681,2018034399,PHONE,NHS,NHS-Neighborhood Preservation-Illegal Dumping,Dumping,Private Property,03/21/2018,12:22 PM,"OPEN ",N,NULL,NULL,4417 E 31ST ST,64128,Knoches Park,Jackson,East,22923,39.068906,-94.53166,Trash,Recycling,NULL,NULL,2018-03-21,2024-01-30 20:56:04,DAMG7370_Lakshmi
477823,2009136221,PHONE,NHS,NHS-Neighborhood Preservation-,Private Property,All,05/26/2009,12:11 PM,"CANC ",Y,09/30/2019,NULL,1532 E 51ST ST,64110,Blue Hills,Jackson,Metro,138461,39.034458,-94.565511,Nuisance Violations,NULL,NULL,2019-09-30,2009-05-26,2024-01-30 20:56:05,DAMG7370_Lakshmi
243419,2007060627,PHONE,Public Works,Public Works-Solid Waste-,Right of Way,All,06/07/2007,01:46 PM,RESOL,N,06/08/2007,1,7326 Tracy Ave,64131,NULL,NULL,NULL,0,35.797519,-103.890579,Trash,NULL,NULL,2007-06-08,2007-06-07,2024-01-30 20:56:05,DAMG7370_Lakshmi
417093,2008319910,PHONE,NHS,NHS-Neighborhood Preservation-,Private Property,All,12/31/2008,10:25 AM,RESOL,N,12/31/2008,0,8608 e 93rd ter,64138,NULL,NULL,NULL,0,35.797519,-103.890579,Property Violations,NULL,NULL,2008-12-31,2008-12-31,2024-01-30 20:56:05,DAMG7370_Lakshmi
333311,2008121062,PHONE,Parks and Rec,Parks and Rec-Landscape Services-Forestry,Trimming,Central Region,05/19/2008,07:09 PM,RESOL,N,07/09/2008,51,4343 CAMPBELL ST,64110,NULL,NULL,NULL,0,35.797519,-103.890579,Trees,NULL,NULL,2008-07-09,2008-05-19,2024-01-30 20:56:05,DAMG7370_Lakshmi
682097,2011117781,PHONE,Water Services,Water Services-Line Maintenance-Pipeline,Hydrant Repair,Central Region,05/10/2011,12:15 PM,RESOL,Y,03/14/2012,309,6800 Corporate Dr,64120,NULL,Jackson,East,38397,39.136003,-94.50239,Water Leak,NULL,NULL,2012-03-14,2011-05-10,2024-01-30 20:56:05,DAMG7370_Lakshmi
1108174,2015144018,PHONE,Water Services,Water Services-Meter and Field Services-,Leak,Hydrant,12/08/2015,05:27 PM,"CANC ",N,09/30/2019,NULL,7345 STATE LINE RD,64114,Ward Parkway,Jackson,Metro,110464,38.994995,-94.607582,Water,NULL,NULL,2019-09-30,2015-12-08,2024-01-30 20:56:05,DAMG7370_Lakshmi
187884,2018090188,"WEB  ",NHS,NHS-Neighborhood Preservation-,Disabled/Unlicensed on Private Property,Car Private Property,07/10/2018,07:50 AM,"OPEN ",Y,NULL,NULL,5600 E 98th Ter,64137,Fairlane,Jackson,South,57083,38.947077,-94.524034,Vehicles,Parking,NULL,NULL,2018-07-10,2024-01-30 20:56:04,DAMG7370_Lakshmi
202143,2007001371,PHONE,Public Works,Public Works-Street and Traffic-District 2,Street,District Two,01/17/2007,11:46 AM,RESOL,Y,02/01/2007,15,1540 GENESSEE ST,64102,NULL,Jackson,Central,214577,35.797519,-103.890579,Snow & Ice,NULL,NULL,2007-02-01,2007-01-17,2024-01-30 20:56:04,DAMG7370_Lakshmi
515058,2009275544,EMAIL,NHS,NHS-Neighborhood Preservation-,Private Property,All,10/06/2009,12:42 PM,"CANC ",Y,09/30/2019,NULL,908 W 89th St,64114,Western Hills,Jackson,Metro,149111,38.967403,-94.601672,Nuisance Violations,NULL,NULL,2019-09-30,2009-10-06,2024-01-30 20:56:05,DAMG7370_Lakshmi
479780,2009144582,PHONE,NHS,NHS-Neighborhood Preservation-,Private Property,All,06/02/2009,11:14 AM,"CANC ",Y,09/30/2019,NULL,6642 Indiana Ave,64132,Swope Park Campus,NULL,Metro,1870,39.005907,-94.547533,Property Violations,NULL,NULL,2019-09-30,2009-06-02,2024-01-30 20:56:05,DAMG7370_Lakshmi
24815,2021026171,INSPE,NHS,NHS-Neighborhood Preservation-,Nuisance,Trash on Private Property,04/27/2021,10:33 AM,"OPEN ",N,NULL,NULL,8116 E 81st St,64138,Park Farms,Jackson,Metro,53732,38.977627,-94.493973,Trash,Recycling,NULL,NULL,2021-04-27,2024-01-30 20:56:04,DAMG7370_Lakshmi
87489,2020029013,PHONE,NHS,NHS-Neighborhood Preservation-,Nuisance,Trash on Private Property,02/26/2020,01:43 PM,"OPEN ",N,NULL,NULL,1827 E 68th St,64132,Neighbors United For Action,Jackson,Metro,113934,39.003543,-94.564459,Trash,Recycling,NULL,NULL,2020-02-26,2024-01-30 20:56:04,DAMG7370_Lakshmi
222432,2007046000,PHONE,Water Services,Water Services-Line Maintenance-Stormwater,Catch Basin,All,05/15/2007,12:22 PM,RESOL,N,05/17/2007,2,8311 E 107th st,64134,NULL,NULL,NULL,0,35.797519,-103.890579,Storm Water,NULL,NULL,2007-05-17,2007-05-15,2024-01-30 20:56:04,DAMG7370_Lakshmi
204507,2007001286,PHONE,Public Works,Public Works-Street and Traffic-District 3,Street,District Three,01/17/2007,10:20 AM,RESOL,Y,02/01/2007,15,9209 Old Santa Fe Rd,64138,NULL,NULL,NULL,0,35.797519,-103.890579,Snow & Ice,NULL,NULL,2007-02-01,2007-01-17,2024-01-30 20:56:04,DAMG7370_Lakshmi
1373789,2018064192,PHONE,Public Works,Public Works-Street and Traffic-District 2,Street Clean Up,Bridge,05/21/2018,11:45 AM,RESOL,N,05/29/2018,8,2941 Woodland Ave,64109,Key Coalition,Jackson,Central,254798,39.07232,-94.561778,Streets,Roadways,Alleys,2018-05-29,2018-05-21,2024-01-30 20:56:06,DAMG7370_Lakshmi
1443324,2018170089,PHONE,NHS,NHS-Animal Health and Safety-,Stray,At Large - Owned,12/27/2018,09:27 AM,RESOL,Y,01/04/2019,8,2917 E 52nd St,64130,North Town Fork Creek,Jackson,Metro,36101,39.03156,-94.550565,Animals,Pets,NULL,2019-01-04,2018-12-27,2024-01-30 20:56:06,DAMG7370_Lakshmi
1417274,2018126655,PHONE,NHS,NHS-Solid Waste-,Dead Animal,Street,09/19/2018,02:41 PM,RESOL,N,09/20/2018,1,6634 Askew Ave,64132,Swope Park Campus,Jackson,Metro,1959,39.005895,-94.545203,Animals,Pets,NULL,2018-09-20,2018-09-19,2024-01-30 20:56:06,DAMG7370_Lakshmi
1412673,2018127282,"TWIR ",Public Works,Public Works-Capital Projects-Traffic Permits,Obstructed / Closure,Detour,09/20/2018,02:09 PM,RESOL,N,09/26/2018,6,2209 NW 56th St,64151,Line Creek And Northern Heights,Platte,North,167335,39.195531,-94.607076,Streets,Roadways,Alleys,2018-09-26,2018-09-20,2024-01-30 20:56:06,DAMG7370_Lakshmi
1406540,2018107930,PHONE,NHS,NHS-Animal Health and Safety-,Bite,Animal on Animal,08/13/2018,10:46 AM,RESOL,Y,08/15/2018,2,5311 Oakleaf Dr BLD 25,64129,Eastwood Hills West,Jackson,Metro,54385,39.028625,-94.50325,Animals,Pets,NULL,2018-08-15,2018-08-13,2024-01-30 20:56:06,DAMG7370_Lakshmi
1393674,2018094257,PHONE,NHS,NHS-Neighborhood Preservation-,Property Maintenance,Other Property Issue,07/13/2018,03:27 PM,RESOL,Y,09/19/2018,68,3814 Monroe Ave,64128,Palestine West And Oak Park Northeast,Jackson,East,28169,39.056324,-94.541173,Property,Buildings,Construction,2018-09-19,2018-07-13,2024-01-30 20:56:06,DAMG7370_Lakshmi
1398733,2018096061,"WEB  ",NHS,NHS-Neighborhood Preservation-,Nuisance,Trash on Private Property,07/17/2018,08:25 PM,RESOL,N,07/19/2018,2,5635 Forest Ave,64110,Eastern 49-63,Jackson,Metro,147094,39.024216,-94.572461,Trash,Recycling,NULL,2018-07-19,2018-07-17,2024-01-30 20:56:06,DAMG7370_Lakshmi
1389474,2018099555,PHONE,City Managers Office,City Managers Office-KCPD-,Police,Other,07/25/2018,11:38 AM,RESOL,N,08/08/2018,14,101 E 13th St,64106,CBD Downtown,Jackson,Central,229101,39.097872,-94.581636,Public Safety,NULL,NULL,2018-08-08,2018-07-25,2024-01-30 20:56:06,DAMG7370_Lakshmi
1370922,2018062870,"WEB  ",NHS,NHS-Solid Waste-,Dumping,Right-Of-Way,05/17/2018,03:44 PM,RESOL,Y,05/29/2018,12,728 W 131st Ter,64145,Martin City,Jackson,South,208066,38.890238,-94.603246,Trash,Recycling,NULL,2018-05-29,2018-05-17,2024-01-30 20:56:06,DAMG7370_Lakshmi
1413206,2018136323,PHONE,Parks and Rec,Parks and Rec-Landscape Services-Forestry,Removal,Tree Limbs,10/09/2018,03:43 PM,RESOL,Y,10/24/2018,15,3503 Smart Ave,64124,Scarritt Point,Jackson,East,41986,39.109364,-94.540144,Trees,NULL,NULL,2018-10-24,2018-10-09,2024-01-30 20:56:06,DAMG7370_Lakshmi
1408600,2018120276,"WEB  ",Water Services,Water Services-Line Maintenance-Stormwater,Storm Water Referral,Repair,09/07/2018,08:55 AM,RESOL,Y,12/10/2018,94,7845 Summit St,64114,Ward Parkway,Jackson,Metro,120204,38.985431,-94.598603,Storm Water,Sewer,NULL,2018-12-10,2018-09-07,2024-01-30 20:56:06,DAMG7370_Lakshmi
1369317,2018066129,"WEB  ",NHS,NHS-Solid Waste-,Trash Collection,Missed by Contractor North,05/23/2018,10:41 PM,RESOL,N,05/24/2018,1,3902 NE 91st Ter,64156,Shoal Creek,Clay,Shoal Creek,237083,39.259739,-94.532135,Trash,Recycling,NULL,2018-05-24,2018-05-23,2024-01-30 20:56:06,DAMG7370_Lakshmi
1427486,2018140098,PHONE,KCPD,KCPD-Parking Control-,Abandoned On Street,Car,10/17/2018,03:37 PM,RESOL,N,10/22/2018,5,3801 NE 52nd Ter,64119,Country Club Estates And Big Shoal,Clay,Shoal Creek,79653,39.188767,-94.53436,Vehicles,Parking,NULL,2018-10-22,2018-10-17,2024-01-30 20:56:06,DAMG7370_Lakshmi
1381846,2018083425,PHONE,NHS,NHS-Neighborhood Preservation-,Private / Commercial,Lot - Vacant,06/26/2018,09:58 AM,RESOL,N,07/09/2018,13,12250 Wornall Rd,64145,Blue Hills Estates,Jackson,South,220969,38.905821,-94.595171,Mowing,Weeds,NULL,2018-07-09,2018-06-26,2024-01-30 20:56:06,DAMG7370_Lakshmi
1407518,2018117825,PHONE,Public Works,Public Works-Street and Traffic-District 2,Pothole,District 2,08/31/2018,02:32 PM,RESOL,Y,09/07/2018,7,4822 Eastern Ave,64129,Eastwood Hills East,Jackson,Metro,54371,39.035189,-94.499398,Streets,Roadways,Alleys,2018-09-07,2018-08-31,2024-01-30 20:56:06,DAMG7370_Lakshmi
1321991,2018004557,PHONE,NHS,NHS-Solid Waste-,Dead Animal,Street,01/09/2018,08:45 AM,RESOL,N,01/10/2018,1,2601 Chelsea Ave,64127,East Community Team South,Jackson,East,19992,39.077172,-94.526309,Animals,Pets,NULL,2018-01-10,2018-01-09,2024-01-30 20:56:06,DAMG7370_Lakshmi
1411871,2018133854,PHONE,Parks and Rec,Parks and Rec-Landscape Services-Forestry,Trimming,Tree Limbs,10/04/2018,10:45 AM,RESOL,N,10/16/2018,12,4114 Harrison St,64110,South Hyde Park,Jackson,Central,133472,39.052,-94.573859,Trees,NULL,NULL,2018-10-16,2018-10-04,2024-01-30 20:56:06,DAMG7370_Lakshmi
1362256,2018047587,PHONE,NHS,NHS-Neighborhood Preservation-,Nuisance,Trash on Private Property,04/19/2018,07:54 AM,RESOL,N,04/24/2018,5,1317 Indiana Ave,64127,Lykins,Jackson,East,11463,39.096553,-94.541967,Trash,Recycling,NULL,2018-04-24,2018-04-19,2024-01-30 20:56:06,DAMG7370_Lakshmi
1332580,2018017339,PHONE,NHS,NHS-Animal Health and Safety-,Stray,At Large - Owned,02/08/2018,05:54 PM,RESOL,N,02/12/2018,4,6621 N Park Plaza Dr,64151,Park Plaza,Platte,North,163726,39.216124,-94.641807,Animals,Pets,NULL,2018-02-12,2018-02-08,2024-01-30 20:56:06,DAMG7370_Lakshmi
1390247,2018101405,"WEB  ",KCPD,KCPD-Parking Control-,Abandoned On Street,Car,07/30/2018,08:47 AM,RESOL,N,08/02/2018,3,501 Drury Ave,64123,South Indian Mound,Jackson,East,45343,39.106852,-94.517538,Vehicles,Parking,NULL,2018-08-02,2018-07-30,2024-01-30 20:56:06,DAMG7370_Lakshmi
1367083,2018066174,PHONE,NHS,NHS-Neighborhood Preservation-Open Entry,Dangerous Building,Open To Entry,05/24/2018,07:43 AM,RESOL,Y,06/08/2018,15,1004 NE 85TH TER,64155,Gashland,Clay,Shoal Creek,92803,39.248826,-94.567045,Property,Buildings,Construction,2018-06-08,2018-05-24,2024-01-30 20:56:06,DAMG7370_Lakshmi
1387918,2018091696,PHONE,Public Works,Public Works-Capital Projects-Traffic Signals,Traffic Signal,Signal Timing,07/11/2018,10:22 AM,RESOL,N,07/19/2018,8,13025 Wornall Rd,64145,Woodbridge,Jackson,South,158980,38.890659,-94.594038,Lights,Signals,NULL,2018-07-19,2018-07-11,2024-01-30 20:56:06,DAMG7370_Lakshmi
1442542,2018165167,PHONE,NHS,NHS-Solid Waste-,Dead Animal,Curb,12/12/2018,09:50 AM,RESOL,N,12/13/2018,1,3306 E 27th St,64127,Washington Wheatley,Jackson,East,16886,39.077043,-94.544141,Animals,Pets,NULL,2018-12-13,2018-12-12,2024-01-30 20:56:06,DAMG7370_Lakshmi
1423302,2018149889,"WEB  ",NHS,NHS-Neighborhood Preservation-,Property Maintenance,Main Structure,11/09/2018,04:27 PM,RESOL,Y,12/10/2018,31,4010 Troost Ave,64110,South Hyde Park,Jackson,Central,133112,39.053928,-94.57263,Property,Buildings,Construction,2018-12-10,2018-11-09,2024-01-30 20:56:06,DAMG7370_Lakshmi
1403454,2018107833,PHONE,NHS,NHS-Animal Health and Safety-,Wildlife,Inside,08/13/2018,09:26 AM,RESOL,N,08/16/2018,3,4012 TROOST AVE,64110,South Hyde Park,Jackson,Central,133111,39.053791,-94.572636,Animals,Pets,NULL,2018-08-16,2018-08-13,2024-01-30 20:56:06,DAMG7370_Lakshmi
1439015,2018168248,PHONE,Water Services,Water Services-Line Maintenance-Leaf Brush,Leaf / Brush,Missed Pick Up,12/19/2018,03:12 PM,RESOL,Y,01/07/2019,19,7815 Washington St,64114,Ward Parkway,Jackson,Metro,120359,38.9863,-94.595293,Trash,Recycling,NULL,2019-01-07,2018-12-19,2024-01-30 20:56:06,DAMG7370_Lakshmi
1392299,2018090603,PHONE,NHS,NHS-Animal Health and Safety-,Stray,At Large - Aggressive,07/10/2018,12:39 PM,RESOL,N,07/12/2018,2,5822 WOODLAND AVE,64110,Blue Hills,Jackson,Metro,147408,39.0206,-94.565193,Animals,Pets,NULL,2018-07-12,2018-07-10,2024-01-30 20:56:06,DAMG7370_Lakshmi
1360826,2018049535,PHONE,Parks and Rec,Parks and Rec-Landscape Services-Forestry Tech,Services,Review,04/23/2018,03:59 PM,RESOL,N,04/25/2018,2,6025 BROOKSIDE BLVD,64113,Morningside,Jackson,Metro,106679,39.018142,-94.589179,Trees,NULL,NULL,2018-04-25,2018-04-23,2024-01-30 20:56:06,DAMG7370_Lakshmi
1358666,2018058221,PHONE,NHS,NHS-Solid Waste-Administration,Services,Service Issue / Problem,05/09/2018,01:44 PM,RESOL,Y,05/25/2018,16,9611 NE 100th St,64157,Shoal Creek,Clay,Shoal Creek,224939,39.27304,-94.458037,Trash,Recycling,NULL,2018-05-25,2018-05-09,2024-01-30 20:56:06,DAMG7370_Lakshmi
1326418,2018007259,PHONE,NHS,NHS-Solid Waste-Administration,Services,Call Back Request,01/12/2018,05:43 PM,RESOL,Y,01/23/2018,11,7645 Wabash Ave,64132,East Meyer 7,Jackson,Metro,115576,38.987213,-94.558978,Trash,Recycling,NULL,2018-01-23,2018-01-12,2024-01-30 20:56:06,DAMG7370_Lakshmi
1391992,2018091756,PHONE,NHS,NHS-Neighborhood Preservation-,Property Maintenance,Fence Issue,07/11/2018,10:45 AM,RESOL,Y,07/30/2019,384,8101 WARD PARKWAY PLZ,64114,West Waldo,Jackson,Metro,121092,38.981586,-94.603718,Property,Buildings,Construction,2019-07-30,2018-07-11,2024-01-30 20:56:06,DAMG7370_Lakshmi
1321395,2018000971,PHONE,NHS,NHS-Animal Health and Safety-,Cruelty or Neglect,Inclement Weather,01/02/2018,04:42 PM,RESOL,Y,01/08/2018,6,5428 Euclid Ave,64130,Blue Hills,Jackson,Metro,145845,39.027506,-94.562456,Animals,Pets,NULL,2018-01-08,2018-01-02,2024-01-30 20:56:06,DAMG7370_Lakshmi
1323936,2018000056,"WEB  ",NHS,NHS-Solid Waste-,Trash Collection,Missed by Contractor South,01/01/2018,10:36 PM,RESOL,N,01/02/2018,1,31 E 70th Ter,64113,Armour Hills,Jackson,Metro,112247,38.999895,-94.587797,Trash,Recycling,NULL,2018-01-02,2018-01-01,2024-01-30 20:56:06,DAMG7370_Lakshmi
1339167,2018012857,PHONE,Water Services,Water Services-Meter and Field Services-,Leak,Emergency Off / Flooding,01/29/2018,09:26 AM,RESOL,N,01/29/2018,0,2011 Poplar Ave,64127,East Community Team North,Jackson,East,18769,39.086661,-94.525108,Water,NULL,NULL,2018-01-29,2018-01-29,2024-01-30 20:56:06,DAMG7370_Lakshmi
1326482,2018007065,PHONE,Water Services,Water Services-Line Maintenance-Stormwater,Street Clean Up,Sweeping Schedule,01/12/2018,01:00 PM,RESOL,N,01/25/2018,13,1230 NE 81ST TER,64118,Ridgefield,Clay,Shoal Creek,94077,39.241648,-94.564973,Streets,Roadways,Alleys,2018-01-25,2018-01-12,2024-01-30 20:56:06,DAMG7370_Lakshmi
1397287,2018101578,PHONE,Public Works,Public Works-Street and Traffic-District 3,Street Clean Up,District 3,07/30/2018,10:59 AM,RESOL,N,08/02/2018,3,9320 Cable Rd,64132,Hidden Valley,Jackson,Metro,55908,38.955374,-94.541829,Streets,Roadways,Alleys,2018-08-02,2018-07-30,2024-01-30 20:56:06,DAMG7370_Lakshmi
1442687,2018159345,PHONE,NHS,NHS-Neighborhood Preservation-,Property Maintenance,Other Property Issue,11/29/2018,02:19 PM,RESOL,Y,02/06/2019,69,4343 Holly St,64111,West Plaza,Jackson,Central,140609,39.04825,-94.60023,Property,Buildings,Construction,2019-02-06,2018-11-29,2024-01-30 20:56:06,DAMG7370_Lakshmi
1425257,2018143675,PHONE,Water Services,Water Services-Meter and Field Services-,No Water / Pressure,No Water,10/25/2018,01:24 PM,RESOL,N,10/26/2018,1,5 E 127th Ter,64145,Woodbridge,Jackson,South,158664,38.895871,-94.593999,Water,NULL,NULL,2018-10-26,2018-10-25,2024-01-30 20:56:06,DAMG7370_Lakshmi
1348701,2018029696,PHONE,Public Works,Public Works-Street and Traffic-District 1,Ditch,North,03/12/2018,08:51 AM,RESOL,Y,05/03/2018,52,5301 NW 72ND ST,64151,Park Plaza,Platte,North,162895,39.224609,-94.641753,Sidewalks,Curbs,Ditch,2018-05-03,2018-03-12,2024-01-30 20:56:06,DAMG7370_Lakshmi
1415972,2018130388,PHONE,NHS,NHS-Animal Health and Safety-,Stray,At Large - Aggressive,09/27/2018,08:44 AM,RESOL,N,10/02/2018,5,4017 Gladstone Blvd,64123,Scarritt Point,Jackson,East,40309,39.117925,-94.532888,Animals,Pets,NULL,2018-10-02,2018-09-27,2024-01-30 20:56:06,DAMG7370_Lakshmi
1381592,2018076998,PHONE,NHS,NHS-Solid Waste-,Dead Animal,Street,06/13/2018,11:58 AM,RESOL,N,06/14/2018,1,11000 NE Reinking Rd,64156,Shoal Creek,Clay,Shoal Creek,99484,39.292378,-94.505575,Animals,Pets,NULL,2018-06-14,2018-06-13,2024-01-30 20:56:06,DAMG7370_Lakshmi
1365708,2018062593,PHONE,Water Services,Water Services-Laboratory Services-,Quality,Taste,05/17/2018,11:16 AM,RESOL,Y,06/04/2018,18,6602 NW 103rd St,64154,KCI & 2nd Creek,Platte,North,211543,39.280087,-94.65487,Water,NULL,NULL,2018-06-04,2018-05-17,2024-01-30 20:56:06,DAMG7370_Lakshmi
1402596,2018112993,PHONE,NHS,NHS-Animal Health and Safety-,Stray,At Large - Non-Aggressive,08/22/2018,03:53 PM,RESOL,Y,09/04/2018,13,2508 Mersington Ave,64127,East Community Team South,Jackson,East,17606,39.079795,-94.537574,Animals,Pets,NULL,2018-09-04,2018-08-22,2024-01-30 20:56:06,DAMG7370_Lakshmi
1381549,2018078294,EMAIL,NHS,NHS-Solid Waste-Administration,Services,Question,06/15/2018,11:14 AM,RESOL,N,06/22/2018,7,10920 N Wallace Ave,64157,Shoal Creek,Clay,Shoal Creek,99352,39.290823,-94.479713,Trash,Recycling,NULL,2018-06-22,2018-06-15,2024-01-30 20:56:06,DAMG7370_Lakshmi
1389769,2018103231,PHONE,NHS,NHS-Neighborhood Preservation-,Private Property,Dead,08/01/2018,04:46 PM,RESOL,Y,10/08/2018,68,11318 Hickman Mills Dr,64137,Hickman Mills,Jackson,South,61556,38.919397,-94.524094,Trees,NULL,NULL,2018-10-08,2018-08-01,2024-01-30 20:56:06,DAMG7370_Lakshmi
1408101,2018117856,EMAIL,NHS,NHS-Solid Waste-,Trash Collection,Missed by Contractor North,08/31/2018,03:03 PM,RESOL,N,09/01/2018,1,8921 N Essex Dr,64156,Shoal Creek,Clay,Shoal Creek,246487,39.255257,-94.533491,Trash,Recycling,NULL,2018-09-01,2018-08-31,2024-01-30 20:56:06,DAMG7370_Lakshmi
1373902,2018069330,PHONE,Parks and Rec,Parks and Rec-Landscape Services-Forestry,Storm Damage,Tree Limb / Brush,05/31/2018,08:00 AM,RESOL,N,06/04/2018,4,3521 Montgall Ave,64128,Oak Park Northwest,Jackson,East,28616,39.061745,-94.551756,Trees,NULL,NULL,2018-06-04,2018-05-31,2024-01-30 20:56:06,DAMG7370_Lakshmi
1410805,2018130157,"WEB  ",NHS,NHS-Neighborhood Preservation-,Disabled/Unlicensed on Private Property,Car Private Property,09/26/2018,03:21 PM,RESOL,Y,11/29/2018,64,7700 E 67th St,64133,East Swope Highlands,Jackson,Metro,52769,39.001492,-94.497112,Vehicles,Parking,NULL,2018-11-29,2018-09-26,2024-01-30 20:56:06,DAMG7370_Lakshmi
1328670,2018000906,"WEB  ",Public Works,Public Works-Street and Traffic-District 2,Pothole,District 2,01/02/2018,03:56 PM,RESOL,Y,01/05/2018,3,4601 Rockhill Rd,64110,Rockhill,Jackson,Central,139270,39.043468,-94.578898,Streets,Roadways,Alleys,2018-01-05,2018-01-02,2024-01-30 20:56:06,DAMG7370_Lakshmi
1334526,2018010082,PHONE,Water Services,Water Services-Line Maintenance-Restoration,Pipeline Referral,Restoration,01/22/2018,10:09 AM,RESOL,N,01/30/2018,8,4631 Wyandotte St,64112,Country Club Plaza,Jackson,Central,139454,39.042986,-94.589168,Water,NULL,NULL,2018-01-30,2018-01-22,2024-01-30 20:56:06,DAMG7370_Lakshmi
1377981,2018086597,PHONE,NHS,NHS-Neighborhood Preservation-,Disabled/Unlicensed on Private Property,Car Private Property,07/02/2018,02:11 PM,RESOL,N,07/19/2018,17,1051 N Cambridge Ave,64120,NULL,Jackson,East,12278,39.126329,-94.498847,Vehicles,Parking,NULL,2018-07-19,2018-07-02,2024-01-30 20:56:06,DAMG7370_Lakshmi
1420011,2018124257,"WEB  ",Public Works,Public Works-Capital Projects-Sidewalks,Damage / Dis-Repair,Private Property (ROW),09/14/2018,01:17 PM,RESOL,N,09/17/2018,3,1621 NE 83rd Ter,64118,Ridgefield,Clay,Shoal Creek,93915,39.246143,-94.558344,Sidewalks,Curbs,Ditch,2018-09-17,2018-09-14,2024-01-30 20:56:06,DAMG7370_Lakshmi
1388110,2018097313,PHONE,Public Works,Public Works-Capital Projects-Signs,Markings / Paint,Crosswalk,07/20/2018,08:11 AM,RESOL,N,07/23/2018,3,16 E 3rd St,64106,River Market,Jackson,Central,247697,39.110336,-94.583157,Streets,Roadways,Alleys,2018-07-23,2018-07-20,2024-01-30 20:56:06,DAMG7370_Lakshmi
1383939,2018086352,"WEB  ",NHS,NHS-Neighborhood Preservation-,Disabled/Unlicensed on Private Property,Car Private Property,07/02/2018,11:09 AM,RESOL,Y,01/25/2019,207,12605 N Virginia Ave,64165,Shoal Creek,Clay,Shoal Creek,100184,39.322084,-94.5602,Vehicles,Parking,NULL,2019-01-25,2018-07-02,2024-01-30 20:56:06,DAMG7370_Lakshmi
1442510,2018165082,PHONE,Water Services,Water Services-Line Maintenance-Restoration,Pipeline Referral,Restoration,12/12/2018,08:14 AM,RESOL,Y,01/29/2019,48,1500 Locust St,64108,Hospital Hill,Jackson,Central,122807,39.095402,-94.577933,Water,NULL,NULL,2019-01-29,2018-12-12,2024-01-30 20:56:06,DAMG7370_Lakshmi
1337273,2018024122,PHONE,Water Services,Water Services-Line Maintenance-Wastewater,Sewer Backup / Leak,In A House,02/27/2018,12:59 PM,RESOL,Y,04/10/2018,42,2108 Monroe Ave,64127,East Community Team North,Jackson,East,15063,39.085826,-94.539725,Storm Water,Sewer,NULL,2018-04-10,2018-02-27,2024-01-30 20:56:06,DAMG7370_Lakshmi
1334884,2018012287,PHONE,Water Services,Water Services-Meter and Field Services-,Leak,Meter,01/26/2018,09:18 AM,RESOL,N,02/08/2018,13,3339 COLORADO AVE,64128,Dunbar,Jackson,East,23362,39.063584,-94.521562,Water,NULL,NULL,2018-02-08,2018-01-26,2024-01-30 20:56:06,DAMG7370_Lakshmi
1433663,2018168264,PHONE,Water Services,Water Services-Line Maintenance-Restoration,Sewer Referral,Restoration,12/19/2018,03:26 PM,RESOL,Y,02/27/2019,70,6706 E 100th St,64134,Fairlane,Jackson,South,58294,38.94385,-94.510871,Storm Water,Sewer,NULL,2019-02-27,2018-12-19,2024-01-30 20:56:06,DAMG7370_Lakshmi
1430743,2018148863,PHONE,NHS,NHS-Animal Health and Safety-,Stray,At Large - Aggressive,11/07/2018,02:21 PM,RESOL,N,11/08/2018,1,824 Fuller Ave,64125,Sheffield,Jackson,East,5354,39.101306,-94.506771,Animals,Pets,NULL,2018-11-08,2018-11-07,2024-01-30 20:56:06,DAMG7370_Lakshmi
1420002,2018129744,PHONE,NHS,NHS-Animal Health and Safety-,Stray,At Large - Aggressive,09/26/2018,08:46 AM,RESOL,N,10/01/2018,5,8230 Euclid Ave,64132,Marlborough Heights/Marlborough Pride,Jackson,Metro,117282,38.977501,-94.5651,Animals,Pets,NULL,2018-10-01,2018-09-26,2024-01-30 20:56:06,DAMG7370_Lakshmi
1377743,2018078641,PHONE,NHS,NHS-Solid Waste-,Trash Collection,Missed by Contractor South,06/15/2018,04:55 PM,RESOL,Y,06/21/2018,6,1000 W 66TH ST,64113,Armour Fields,Jackson,Metro,109247,39.009802,-94.599542,Trash,Recycling,NULL,2018-06-21,2018-06-15,2024-01-30 20:56:06,DAMG7370_Lakshmi
1388632,2018091760,EMAIL,NHS,NHS-Solid Waste-,Trash Collection,Missed by Contractor North,07/11/2018,10:47 AM,RESOL,N,07/12/2018,1,4519 NE 47TH ST,64117,Winnwood,Clay,Shoal Creek,75849,39.178811,-94.5273,Trash,Recycling,NULL,2018-07-12,2018-07-11,2024-01-30 20:56:06,DAMG7370_Lakshmi
1453299,2018170599,"WEB  ",NHS,NHS-Solid Waste-,Trash Collection,Missed by Contractor North,12/28/2018,09:11 AM,RESOL,N,12/28/2018,0,3726 NE 92nd St,64156,Shoal Creek,Clay,Shoal Creek,97466,39.260417,-94.534867,Trash,Recycling,NULL,2018-12-28,2018-12-28,2024-01-30 20:56:06,DAMG7370_Lakshmi
1437005,2018167497,PHONE,Public Works,Public Works-Street and Traffic-District 3,Pothole,District 3,12/18/2018,09:50 AM,RESOL,Y,12/20/2018,2,7558 Prospect Ave,64132,East Meyer 7,Jackson,Metro,115583,38.988596,-94.558009,Streets,Roadways,Alleys,2018-12-20,2018-12-18,2024-01-30 20:56:06,DAMG7370_Lakshmi
1356991,2018054428,PHONE,Health,Health-Rat-,Rat Treatment,Inside Home,05/02/2018,03:58 PM,RESOL,Y,05/30/2018,28,3619 Olive St,64109,Ivanhoe Northeast,Jackson,Central,133843,39.060303,-94.555292,Animals,Pets,NULL,2018-05-30,2018-05-02,2024-01-30 20:56:06,DAMG7370_Lakshmi
1343692,2018037708,PHONE,NHS,NHS-Solid Waste-,Trash Collection,Missed by Contractor North,03/28/2018,10:18 AM,RESOL,N,03/28/2018,0,2706 NW 64th St,64151,Line Creek And Northern Heights,Platte,North,164757,39.210508,-94.61292,Trash,Recycling,NULL,2018-03-28,2018-03-28,2024-01-30 20:56:06,DAMG7370_Lakshmi
1339729,2018010964,PHONE,NHS,NHS-Solid Waste-,Dumping,Right-Of-Way,01/23/2018,04:46 PM,RESOL,N,01/25/2018,2,3501 E 69TH ST,64132,Self Help Neighborhood Council,Jackson,Metro,2485,39.000932,-94.546115,Trash,Recycling,NULL,2018-01-25,2018-01-23,2024-01-30 20:56:06,DAMG7370_Lakshmi
1370725,2018073362,"WEB  ",Parks and Rec,Parks and Rec-Landscape Services-Forestry,Trimming,Visibility,06/07/2018,06:55 AM,RESOL,Y,06/15/2018,8,314 W 9th St,64105,CBD Downtown,Jackson,Central,122441,39.103967,-94.586593,Trees,NULL,NULL,2018-06-15,2018-06-07,2024-01-30 20:56:06,DAMG7370_Lakshmi
206897,2018101674,EMAIL,NHS,NHS-Neighborhood Preservation-,Private / Commercial,Lot - Structure,07/30/2018,12:11 PM,RESOL,Y,09/24/2019,421,3509 E 78TH ST,64132,Marlborough East,Jackson,Metro,55436,38.983906,-94.546206,Mowing,Weeds,NULL,2019-09-24,2018-07-30,2024-01-30 20:56:04,DAMG7370_Lakshmi
1414702,2018125520,EMAIL,Water Services,Water Services-Engineering-Water and Sewer,Sewer,Engineering,09/18/2018,08:37 AM,RESOL,N,09/19/2018,1,701 E 36th St,64109,Central Hyde Park,Jackson,Central,131694,39.061405,-94.576129,Capital Projects,NULL,NULL,2018-09-19,2018-09-18,2024-01-30 20:56:06,DAMG7370_Lakshmi
1426457,2018153617,PHONE,Public Works,Public Works-Street and Traffic-Streetlights,Street Light,Blinking,11/21/2018,08:20 AM,RESOL,N,11/26/2018,5,219 NE 101st St,64155,Meadowbrook Heights,Clay,North,103281,39.274983,-94.577582,Lights,Signals,NULL,2018-11-26,2018-11-21,2024-01-30 20:56:06,DAMG7370_Lakshmi
1400579,2018108754,PHONE,Parks and Rec,Parks and Rec-Landscape Services-Forestry,Removal,Tree Limbs,08/14/2018,01:59 PM,RESOL,Y,09/11/2018,28,5451 N Sycamore Dr,64119,Gracemor-Randolph Corners,Clay,Shoal Creek,253062,39.190977,-94.482229,Trees,NULL,NULL,2018-09-11,2018-08-14,2024-01-30 20:56:06,DAMG7370_Lakshmi
1346291,2018027586,PHONE,Public Works,Public Works-Capital Projects-Signs,Street Name Signs,Down / Damaged,03/06/2018,01:15 PM,RESOL,Y,03/23/2018,17,9561 N McGee St,64155,Meadowbrook Heights,Clay,North,246059,39.265837,-94.576318,Signs,NULL,NULL,2018-03-23,2018-03-06,2024-01-30 20:56:06,DAMG7370_Lakshmi
1437979,2018166206,PHONE,Water Services,Water Services-Line Maintenance-Leaf Brush,Leaf / Brush,Missed Pick Up,12/14/2018,09:53 AM,RESOL,Y,01/03/2019,20,7237 Belleview Ave,64114,Ward Parkway,Jackson,Metro,110815,38.996708,-94.600564,Trash,Recycling,NULL,2019-01-03,2018-12-14,2024-01-30 20:56:06,DAMG7370_Lakshmi
1414090,2018130788,PHONE,Health,Health-Healthy Homes-,Services,Healthy Homes Information,09/27/2018,04:11 PM,RESOL,Y,12/10/2018,74,3619 Roberts St,64124,Scarritt Point,Jackson,East,42127,39.106523,-94.538109,Public Health,NULL,NULL,2018-12-10,2018-09-27,2024-01-30 20:56:06,DAMG7370_Lakshmi
1441729,2018163760,"WEB  ",Northland,Northland-Neighborhood-Inc,Property Maintenance,Northland Neighborhoods INC,12/08/2018,03:34 PM,"DUP  ",N,12/10/2018,2,2701 NW Barry Rd,64151,Barry Harbour,Platte,North,161988,39.245514,-94.612349,Property,Buildings,Construction,2018-12-10,2018-12-08,2024-01-30 20:56:06,DAMG7370_Lakshmi
1440081,2018155093,PHONE,Public Works,Public Works-Street and Traffic-Snow,Snow / Ice,District 1,11/27/2018,09:35 AM,RESOL,N,12/03/2018,6,9135 N Flora Ave,64155,Gashland,Clay,Shoal Creek,213751,39.260712,-94.559633,Streets,Roadways,Alleys,2018-12-03,2018-11-27,2024-01-30 20:56:06,DAMG7370_Lakshmi
1367982,2018069102,EMAIL,KCPD,KCPD-Parking Control-,Abandoned On Street,Car,05/30/2018,03:49 PM,RESOL,N,06/01/2018,2,5307 N Virginia Ave,64118,Davidson,Clay,Shoal Creek,87044,39.190954,-94.563578,Vehicles,Parking,NULL,2018-06-01,2018-05-30,2024-01-30 20:56:06,DAMG7370_Lakshmi
1410171,2018137100,PHONE,NHS,NHS-Solid Waste-,Trash Collection,Missed by City,10/10/2018,06:16 PM,RESOL,N,10/11/2018,1,1023 Monroe Ave,64127,Lykins,Jackson,East,9894,39.10014,-94.538324,Trash,Recycling,NULL,2018-10-11,2018-10-10,2024-01-30 20:56:06,DAMG7370_Lakshmi
1353437,2018035824,PHONE,NHS,NHS-Neighborhood Preservation-Abatement,Nuisance,Land Bank,03/23/2018,02:13 PM,RESOL,N,03/29/2018,6,3431 E 6th St,64124,Lykins,Jackson,East,9845,39.104749,-94.540291,Trash,Recycling,NULL,2018-03-29,2018-03-23,2024-01-30 20:56:06,DAMG7370_Lakshmi
1335724,2018012853,PHONE,NHS,NHS-Neighborhood Preservation-,Property Maintenance,Main Structure,01/29/2018,09:25 AM,RESOL,Y,08/09/2018,192,920 Main St,64105,CBD Downtown,Jackson,Central,122486,39.103001,-94.583543,Property,Buildings,Construction,2018-08-09,2018-01-29,2024-01-30 20:56:06,DAMG7370_Lakshmi
1336665,2018017718,PHONE,Water Services,Water Services-Meter and Field Services-,Leak,Meter,02/09/2018,03:27 PM,RESOL,N,02/10/2018,1,10016 Flora Ave,64131,Linden Hills And Indian Heights,Jackson,South,154100,38.944747,-94.572431,Water,NULL,NULL,2018-02-10,2018-02-09,2024-01-30 20:56:06,DAMG7370_Lakshmi
1435150,2018163791,"WEB  ",Parks and Rec,Parks and Rec-Landscape Services-Forestry,Trimming,Tree Limbs,12/09/2018,02:50 PM,RESOL,N,12/11/2018,2,3601 NE 41st St,64117,Chaumiere,Clay,Shoal Creek,77762,39.168608,-94.538284,Trees,NULL,NULL,2018-12-11,2018-12-09,2024-01-30 20:56:06,DAMG7370_Lakshmi
1391588,2018095237,"WEB  ",Parks and Rec,Parks and Rec-Central Region-,Services,Feedback,07/16/2018,03:46 PM,RESOL,Y,07/31/2018,15,3900 Cliff Dr,64120,Scarritt Point,Jackson,East,40354,39.118968,-94.537151,Parks & Recreation,NULL,NULL,2018-07-31,2018-07-16,2024-01-30 20:56:06,DAMG7370_Lakshmi
1432706,2018164212,"TWIR ",Public Works,Public Works-Street and Traffic-District 3,Pothole,District 3,12/10/2018,02:20 PM,RESOL,Y,12/18/2018,8,106 W 50th St,64112,South Plaza,Jackson,Metro,249979,39.037172,-94.58865,Streets,Roadways,Alleys,2018-12-18,2018-12-10,2024-01-30 20:56:06,DAMG7370_Lakshmi
1357909,2018044043,PHONE,Public Works,Public Works-Capital Projects-Signs,Street Name Signs,Down / Damaged,04/11/2018,01:46 PM,RESOL,N,04/13/2018,2,10700 Fremont Ave,64134,Stratford Estates,Jackson,South,59647,38.930699,-94.516485,Signs,NULL,NULL,2018-04-13,2018-04-11,2024-01-30 20:56:06,DAMG7370_Lakshmi
1398606,2018105218,PHONE,Water Services,Water Services-Laboratory Services-,Quality,Color / Cloudy,08/06/2018,06:26 PM,RESOL,Y,08/17/2018,11,5846 Lawn Ave,64130,Swope Parkway-Elmwood,Jackson,Metro,38074,39.018624,-94.531793,Water,NULL,NULL,2018-08-17,2018-08-06,2024-01-30 20:56:06,DAMG7370_Lakshmi
1351964,2018027957,PHONE,Water Services,Water Services-Meter and Field Services-,Leak,In Street,03/07/2018,09:33 AM,RESOL,N,03/10/2018,3,11233 Corrington Ave,64134,Ruskin Heights,Jackson,South,60610,38.917944,-94.50623,Water,NULL,NULL,2018-03-10,2018-03-07,2024-01-30 20:56:06,DAMG7370_Lakshmi
1405139,2018108258,PHONE,Public Works,Public Works-Capital Projects-Sidewalks,Damage / Dis-Repair,Private Property (ROW),08/13/2018,03:57 PM,RESOL,N,08/14/2018,1,3030 Walrond Ave,64128,Santa Fe,Jackson,East,24834,39.070299,-94.546302,Sidewalks,Curbs,Ditch,2018-08-14,2018-08-13,2024-01-30 20:56:06,DAMG7370_Lakshmi
1386722,2018084431,KCEPD,NHS,NHS-Neighborhood Preservation-Open Entry,Dangerous Building,Open To Entry,06/27/2018,03:21 PM,RESOL,Y,07/02/2018,5,3516 Anderson Ave,64123,Scarritt Point,Jackson,East,41655,39.111605,-94.539341,Property,Buildings,Construction,2018-07-02,2018-06-27,2024-01-30 20:56:06,DAMG7370_Lakshmi
1328149,2018006380,"TWIR ",Water Services,Water Services-Line Maintenance-Restoration,Pipeline Referral,Restoration,01/11/2018,10:22 AM,RESOL,N,01/22/2018,11,75 W 135TH ST,64145,Martin City,Jackson,South,159761,38.882651,-94.597117,Water,NULL,NULL,2018-01-22,2018-01-11,2024-01-30 20:56:06,DAMG7370_Lakshmi
1368647,2018062588,PHONE,Public Works,Public Works-Capital Projects-Traffic Signals,Traffic Signal,Signal Malfunction,05/17/2018,11:12 AM,RESOL,N,05/18/2018,1,11102 Raytown Rd,64134,Ruskin Hills,Jackson,South,71171,38.922152,-94.477073,Lights,Signals,NULL,2018-05-18,2018-05-17,2024-01-30 20:56:06,DAMG7370_Lakshmi
1332854,2018018736,PHONE,Public Works,Public Works-Street and Traffic-District 1,Street Clean Up,District 1,02/13/2018,01:52 PM,RESOL,N,02/14/2018,1,3811 NW Barry Rd,64151,Platte Brook North,Platte,North,161536,39.240554,-94.62421,Streets,Roadways,Alleys,2018-02-14,2018-02-13,2024-01-30 20:56:06,DAMG7370_Lakshmi
1320732,2018003455,PHONE,Water Services,Water Services-Line Maintenance-Pipeline,Pipeline Referral,Hydrant,01/08/2018,07:38 AM,RESOL,Y,03/09/2018,60,7201 Troost Ave,64131,East Meyer 6,Jackson,Metro,114622,38.996847,-94.575041,Water,NULL,NULL,2018-03-09,2018-01-08,2024-01-30 20:56:06,DAMG7370_Lakshmi
1447206,2018171128,PHONE,Water Services,Water Services-Line Maintenance-Wastewater,Sewer Backup / Leak,In A House,12/29/2018,01:44 PM,RESOL,Y,01/03/2019,5,7245 Ward Pkwy,64114,Ward Parkway,Jackson,Metro,110859,38.996539,-94.602896,Storm Water,Sewer,NULL,2019-01-03,2018-12-29,2024-01-30 20:56:06,DAMG7370_Lakshmi
1434314,2018157939,PHONE,NHS,NHS-Solid Waste-,Trash Collection,Missed by Contractor North,11/28/2018,04:38 PM,RESOL,N,11/29/2018,1,1015 NW 63rd St,64118,Clayton,Clay,North,96692,39.209079,-94.592425,Trash,Recycling,NULL,2018-11-29,2018-11-28,2024-01-30 20:56:06,DAMG7370_Lakshmi
1397838,2018100957,PHONE,NHS,NHS-Animal Health and Safety-,Stray,Confined,07/27/2018,12:59 PM,RESOL,N,07/27/2018,0,410 N LAWN AVE,64123,North Indian Mound,Jackson,East,43280,39.117546,-94.526922,Animals,Pets,NULL,2018-07-27,2018-07-27,2024-01-30 20:56:06,DAMG7370_Lakshmi
1389782,2018095296,PHONE,NHS,NHS-Solid Waste-,Trash Collection,Missed by Contractor South,07/16/2018,04:24 PM,RESOL,N,07/20/2018,4,1818 E 83rd St,64132,Marlborough Heights/Marlborough Pride,Jackson,Metro,117298,38.977237,-94.565953,Trash,Recycling,NULL,2018-07-20,2018-07-16,2024-01-30 20:56:06,DAMG7370_Lakshmi
1380447,2018083307,PHONE,NHS,NHS-Solid Waste-,Bulky Pick Up,Missed Pick Up,06/26/2018,07:02 AM,RESOL,Y,06/28/2018,2,720 W 37th St,64111,Valentine,Jackson,Central,130008,39.059737,-94.594948,Trash,Recycling,NULL,2018-06-28,2018-06-26,2024-01-30 20:56:06,DAMG7370_Lakshmi
1353296,2018042785,EMAIL,NHS,NHS-Neighborhood Preservation-,Property Maintenance,Main Structure,04/09/2018,01:53 PM,RESOL,Y,07/31/2019,478,404 W 86TH TER,64114,Western Hills,Jackson,Metro,148731,38.972015,-94.595917,Property,Buildings,Construction,2019-07-31,2018-04-09,2024-01-30 20:56:06,DAMG7370_Lakshmi
1409466,2018114963,PHONE,NHS,NHS-Solid Waste-,Trash Collection,Missed by Contractor South,08/27/2018,12:02 PM,RESOL,N,08/28/2018,1,7600 Longview Rd,64134,Ruskin Heights,Jackson,South,72512,38.915179,-94.503244,Trash,Recycling,NULL,2018-08-28,2018-08-27,2024-01-30 20:56:06,DAMG7370_Lakshmi
1389925,2018095308,PHONE,NHS,NHS-Solid Waste-Abatement Referral,Dumping,Solid Waste Referral,07/16/2018,04:34 PM,RESOL,Y,07/23/2018,7,3950 Prospect Ave,64130,Ivanhoe Southeast,Jackson,East,136357,39.053777,-94.554042,Trash,Recycling,NULL,2018-07-23,2018-07-16,2024-01-30 20:56:06,DAMG7370_Lakshmi
1372578,2018062049,EMAIL,NHS,NHS-Solid Waste-,Recycling,Missed by City,05/16/2018,01:52 PM,RESOL,N,05/17/2018,1,3336 Wyoming St,64111,Volker,Jackson,Central,129141,39.066153,-94.604415,Trash,Recycling,NULL,2018-05-17,2018-05-16,2024-01-30 20:56:06,DAMG7370_Lakshmi
1352829,2018029601,"WEB  ",NHS,NHS-Neighborhood Preservation-,Nuisance,Trash on Private Property,03/11/2018,09:57 AM,RESOL,N,03/16/2018,5,2928 Brooklyn Ave,64109,Key Coalition,Jackson,Central,26817,39.072548,-94.557684,Trash,Recycling,NULL,2018-03-16,2018-03-11,2024-01-30 20:56:06,DAMG7370_Lakshmi
1370517,2018072685,"WEB  ",NHS,NHS-Neighborhood Preservation-,Private / Commercial,Lot - Structure,06/05/2018,11:47 PM,RESOL,Y,02/19/2019,259,7604 E 112TH ST,64134,Ruskin Heights,Jackson,South,71951,38.923836,-94.501704,Mowing,Weeds,NULL,2019-02-19,2018-06-05,2024-01-30 20:56:06,DAMG7370_Lakshmi
1376604,2018082271,PHONE,NHS,NHS-Solid Waste-Illegal Dumping,Dumping,Right of Way Central,06/22/2018,04:22 PM,RESOL,Y,07/20/2018,28,5810 GARFIELD AVE,64130,Blue Hills,Jackson,Metro,148102,39.020697,-94.561692,Trash,Recycling,NULL,2018-07-20,2018-06-22,2024-01-30 20:56:06,DAMG7370_Lakshmi
1366977,2018074542,PHONE,NHS,NHS-Neighborhood Preservation-,Private / Commercial,Lot - Structure,06/08/2018,12:42 PM,RESOL,N,06/21/2018,13,4325 HOLLY ST,64111,West Plaza,Jackson,Central,140603,39.048883,-94.600195,Mowing,Weeds,NULL,2018-06-21,2018-06-08,2024-01-30 20:56:06,DAMG7370_Lakshmi
1390628,2018093870,EMAIL,NHS,NHS-Solid Waste-,Recycling,Missed by Contractor North,07/13/2018,10:38 AM,RESOL,N,07/16/2018,3,10005 N Euclid Ave,64155,Shoal Creek,Clay,Shoal Creek,218140,39.275203,-94.554558,Trash,Recycling,NULL,2018-07-16,2018-07-13,2024-01-30 20:56:06,DAMG7370_Lakshmi
1439300,2018161906,PHONE,Water Services,Water Services-Meter and Field Services-,No Water / Pressure,No Water,12/04/2018,09:13 AM,RESOL,N,12/06/2018,2,431 W 88th St,64114,Western Hills,Jackson,Metro,148957,38.968609,-94.596886,Water,NULL,NULL,2018-12-06,2018-12-04,2024-01-30 20:56:06,DAMG7370_Lakshmi
1371783,2018071748,"WEB  ",NHS,NHS-Neighborhood Preservation-,Property Maintenance,Other Property Issue,06/04/2018,10:29 PM,RESOL,N,08/10/2018,67,2929 NE 43rd St,64117,Chaumiere,CLAY,Shoal Creek,77416,39.171321,-94.544816,Property,Buildings,Construction,2018-08-10,2018-06-04,2024-01-30 20:56:06,DAMG7370_Lakshmi
1419771,2018128901,PHONE,NHS,NHS-Neighborhood Preservation-Open Entry,Dangerous Building,Open To Entry,09/24/2018,04:48 PM,RESOL,Y,10/17/2018,23,8003 College Ave,64132,Marlborough East,Jackson,Metro,4781,38.981025,-94.549265,Property,Buildings,Construction,2018-10-17,2018-09-24,2024-01-30 20:56:06,DAMG7370_Lakshmi
1415279,2018127164,PHONE,NHS,NHS-Neighborhood Preservation-,Parked on Unapproved Surface,Car Private Property,09/20/2018,11:58 AM,RESOL,Y,07/12/2019,295,1908 Lister Ave,64127,East Community Team North,Jackson,East,18173,39.088137,-94.527322,Vehicles,Parking,NULL,2019-07-12,2018-09-20,2024-01-30 20:56:06,DAMG7370_Lakshmi
1437540,2018166060,PHONE,NHS,NHS-Animal Health and Safety-,Cruelty or Neglect,Shelter / Food / Water,12/13/2018,06:27 PM,RESOL,N,12/18/2018,5,2401 Hardesty Ave,64127,South Blue Valley,Jackson,East,20027,39.081053,-94.519687,Animals,Pets,NULL,2018-12-18,2018-12-13,2024-01-30 20:56:06,DAMG7370_Lakshmi
1323362,2018005953,PHONE,NHS,NHS-Solid Waste-,Recycling,Missed by Contractor North,01/10/2018,02:15 PM,RESOL,N,01/11/2018,1,2600 NW 69TH PL,64151,Barry Harbour,Platte,North,224458,39.220903,-94.610937,Trash,Recycling,NULL,2018-01-11,2018-01-10,2024-01-30 20:56:06,DAMG7370_Lakshmi
195841,2018096584,PHONE,NHS,NHS-Neighborhood Preservation-,Property Maintenance,Other Property Issue,07/18/2018,04:17 PM,RESOL,Y,09/05/2019,414,4511 E 23rd St,64127,East Community Team South,Jackson,East,19227,39.083458,-94.530048,Property,Buildings,Construction,2019-09-05,2018-07-18,2024-01-30 20:56:04,DAMG7370_Lakshmi
1364944,2018057039,PHONE,NHS,NHS-Neighborhood Preservation-,Private / Commercial,Lot - Structure,05/08/2018,08:55 AM,RESOL,Y,11/14/2018,190,9310 Palmer Ave,64138,Fairwood And Robandee,Jackson,South,69210,38.954617,-94.499405,Mowing,Weeds,NULL,2018-11-14,2018-05-08,2024-01-30 20:56:06,DAMG7370_Lakshmi
1333980,2018015871,PHONE,NHS,NHS-Neighborhood Preservation-,Nuisance,Open Storage,02/05/2018,04:22 PM,RESOL,Y,09/11/2018,218,8406 E 105th St,64134,Hickman Mills South,Jackson,South,70724,38.934191,-94.491566,Trash,Recycling,NULL,2018-09-11,2018-02-05,2024-01-30 20:56:06,DAMG7370_Lakshmi
1417523,2018131223,PHONE,NHS,NHS-Solid Waste-Abatement Referral,Dumping,Solid Waste Referral,09/28/2018,01:14 PM,RESOL,N,10/03/2018,5,4116 Wayne Ave,64110,Ivanhoe Southwest,Jackson,Central,136121,39.051433,-94.565738,Trash,Recycling,NULL,2018-10-03,2018-09-28,2024-01-30 20:56:06,DAMG7370_Lakshmi
1332714,2018015717,PHONE,Water Services,Water Services-Line Maintenance-Wastewater,Sewer Backup / Leak,In A House,02/05/2018,01:02 PM,RESOL,Y,04/09/2018,63,5904 E 102nd St,64134,Fairlane,Jackson,South,58705,38.940273,-94.52046,Storm Water,Sewer,NULL,2018-04-09,2018-02-05,2024-01-30 20:56:06,DAMG7370_Lakshmi
1345724,2018040543,PHONE,NHS,NHS-Neighborhood Preservation-,Nuisance,Trash on Private Property,04/03/2018,04:27 PM,RESOL,N,04/09/2018,6,3925 FLORA AVE,64110,Ivanhoe Southwest,Jackson,Central,135351,39.054936,-94.56607,Trash,Recycling,NULL,2018-04-09,2018-04-03,2024-01-30 20:56:06,DAMG7370_Lakshmi
1377735,2018076944,PHONE,NHS,NHS-Neighborhood Preservation-Abatement,Nuisance,Land Bank,06/13/2018,11:11 AM,RESOL,Y,11/21/2018,161,4036 Wabash Ave,64130,Ivanhoe Southeast,Jackson,Central,136486,39.052469,-94.555198,Trash,Recycling,NULL,2018-11-21,2018-06-13,2024-01-30 20:56:06,DAMG7370_Lakshmi
1341160,2018009898,"WEB  ",Public Works,Public Works-Street and Traffic-District 3,Pothole,District 3,01/21/2018,07:29 PM,RESOL,Y,01/25/2018,4,8520 Ward Pkwy,64114,Western Hills,Jackson,Metro,148865,38.9735,-94.606851,Streets,Roadways,Alleys,2018-01-25,2018-01-21,2024-01-30 20:56:06,DAMG7370_Lakshmi
1384827,2018085947,"WEB  ",NHS,NHS-Neighborhood Preservation-,Private Property,Tree Debris,06/30/2018,01:26 PM,RESOL,Y,07/05/2018,5,4509 E 112th Ter,64137,Terrace Lake Gardens,Jackson,South,61234,38.921456,-94.537496,Trees,NULL,NULL,2018-07-05,2018-06-30,2024-01-30 20:56:06,DAMG7370_Lakshmi
1366414,2018068878,PHONE,Parks and Rec,Parks and Rec-Administration-,Facilities / Attractions,Other,05/30/2018,12:40 PM,RESOL,N,06/08/2018,9,2601 Woodland Ave,64127,Wendell Phillips,Jackson,Central,14564,39.078303,-94.560785,Parks & Recreation,NULL,NULL,2018-06-08,2018-05-30,2024-01-30 20:56:06,DAMG7370_Lakshmi
1325784,2018009032,PHONE,Public Works,Public Works-Parking Division-,Meter,Repair,01/18/2018,12:16 PM,RESOL,N,01/19/2018,1,301 W 11th St,64105,CBD Downtown,Jackson,Central,122551,39.100743,-94.587374,Vehicles,Parking,NULL,2018-01-19,2018-01-18,2024-01-30 20:56:06,DAMG7370_Lakshmi
1365701,2018067436,"WEB  ",Public Works,Public Works-Street and Traffic-Streetlights,Street Light,5+ Lights Out,05/26/2018,08:47 AM,RESOL,N,05/31/2018,5,4917 N Beacon Ave,64119,Maple Park West,Clay,Shoal Creek,222077,39.183165,-94.505792,Lights,Signals,NULL,2018-05-31,2018-05-26,2024-01-30 20:56:06,DAMG7370_Lakshmi
1324756,2018002701,PHONE,Public Works,Public Works-Capital Projects-Traffic Permits,Plate,Missing / Displaced,01/05/2018,09:38 AM,RESOL,N,01/05/2018,0,1207 Grand Blvd,64106,CBD Downtown,Jackson,Central,12809,39.099665,-94.580547,Streets,Roadways,Alleys,2018-01-05,2018-01-05,2024-01-30 20:56:06,DAMG7370_Lakshmi
1427477,2018153466,PHONE,NHS,NHS-Neighborhood Preservation-,Nuisance,Open Storage,11/20/2018,03:42 PM,RESOL,Y,02/05/2019,77,3920 Vineyard Rd,64130,Vineyard,Jackson,East,31418,39.054061,-94.525902,Trash,Recycling,NULL,2019-02-05,2018-11-20,2024-01-30 20:56:06,DAMG7370_Lakshmi
1332409,2018012777,"WEB  ",NHS,NHS-Neighborhood Preservation-,Nuisance,Trash on Private Property,01/29/2018,01:05 AM,RESOL,Y,02/28/2018,30,5301 N Wayne Ave,64118,Davidson,Clay,Shoal Creek,87149,39.19115,-94.559639,Trash,Recycling,NULL,2018-02-28,2018-01-29,2024-01-30 20:56:06,DAMG7370_Lakshmi
1398454,2018090410,"WEB  ",Parks and Rec,Parks and Rec-Landscape Services-Forestry,Trimming,Tree Limbs,07/10/2018,10:37 AM,RESOL,N,07/13/2018,3,7408 Jarboe St,64114,Ward Parkway,Jackson,Metro,110881,38.994143,-94.602564,Trees,NULL,NULL,2018-07-13,2018-07-10,2024-01-30 20:56:06,DAMG7370_Lakshmi
1428722,2018150001,PHONE,Public Works,Public Works-Street and Traffic-Snow,Snow / Ice,District 2,11/12/2018,11:14 AM,RESOL,N,11/16/2018,4,3205 Brighton Ave,64128,Boulevard Village,Jackson,East,22842,39.066947,-94.525531,Streets,Roadways,Alleys,2018-11-16,2018-11-12,2024-01-30 20:56:06,DAMG7370_Lakshmi
1428244,2018152885,PHONE,NHS,NHS-Solid Waste-,Recycling,Missed by Contractor South,11/19/2018,02:00 PM,RESOL,N,11/20/2018,1,620 W 84th Ter,64114,West Waldo,Jackson,Metro,121194,38.975502,-94.598021,Trash,Recycling,NULL,2018-11-20,2018-11-19,2024-01-30 20:56:06,DAMG7370_Lakshmi
1414827,2018127785,PHONE,Public Works,Public Works-Street and Traffic-District 2,Pothole,District 2,09/21/2018,12:43 PM,RESOL,Y,09/26/2018,5,1903 Nicholson Ave,64120,Northeast Industrial District,Jackson,Central,39555,39.118532,-94.559043,Streets,Roadways,Alleys,2018-09-26,2018-09-21,2024-01-30 20:56:06,DAMG7370_Lakshmi
1431819,2018140554,PHONE,Water Services,Water Services-Meter and Field Services-,MFS Referral (Meter Field Services),Investigation,10/18/2018,01:48 PM,RESOL,N,10/23/2018,5,7128 E 106th Ter,64134,Hickman Mills South,Jackson,South,59054,38.931717,-94.50646,Water,NULL,NULL,2018-10-23,2018-10-18,2024-01-30 20:56:06,DAMG7370_Lakshmi
1332381,2018015944,PHONE,KCPD,KCPD-Parking Control-,Abandoned On Street,Car,02/05/2018,05:53 PM,RESOL,N,02/07/2018,2,1840 E 68TH TER,64132,Neighbors United For Action,Jackson,Metro,113941,39.00314,-94.564001,Vehicles,Parking,NULL,2018-02-07,2018-02-05,2024-01-30 20:56:06,DAMG7370_Lakshmi
1421685,2018152315,PHONE,NHS,NHS-Solid Waste-,Trash Collection,Missed by Contractor North,11/16/2018,06:18 PM,RESOL,N,11/19/2018,3,3503 NW 52nd Ter,64151,Parkdale And Walden,Platte,North,218280,39.188918,-94.622164,Trash,Recycling,NULL,2018-11-19,2018-11-16,2024-01-30 20:56:06,DAMG7370_Lakshmi
1361997,2018052210,"WEB  ",NHS,NHS-Neighborhood Preservation-,Nuisance,Open Storage,04/28/2018,08:19 PM,RESOL,Y,10/15/2018,170,619 VALENTINE RD,64111,Valentine,Jackson,Central,129680,39.061412,-94.593655,Trash,Recycling,NULL,2018-10-15,2018-04-28,2024-01-30 20:56:06,DAMG7370_Lakshmi
1351722,2018041957,PHONE,Public Works,Public Works-Street and Traffic-District 3,Crack,District 3,04/06/2018,11:28 AM,RESOL,Y,05/01/2018,25,3735 Blue Pkwy,64130,North Town Fork Creek,Jackson,Metro,35463,39.035881,-94.541976,Streets,Roadways,Alleys,2018-05-01,2018-04-06,2024-01-30 20:56:06,DAMG7370_Lakshmi
1386604,2018090226,PHONE,NHS,NHS-Neighborhood Preservation-,Property Maintenance,Main Structure,07/10/2018,08:19 AM,RESOL,N,07/16/2018,6,7310 NW TIFFANY SPRINGS PKWY,64153,KCI & 2nd Creek,Platte,North,210760,39.273928,-94.66456,Property,Buildings,Construction,2018-07-16,2018-07-10,2024-01-30 20:56:06,DAMG7370_Lakshmi
1356773,2018046303,PHONE,Water Services,Water Services-Line Maintenance-Wastewater,Sewer Referral,Repair,04/16/2018,06:24 PM,RESOL,N,04/18/2018,2,5732 ROCKHILL RD,64110,Western 49-63,Jackson,Metro,145158,39.022417,-94.576765,Storm Water,Sewer,NULL,2018-04-18,2018-04-16,2024-01-30 20:56:06,DAMG7370_Lakshmi
1340401,2018019347,PHONE,Health,Health-Rat-,Rat Treatment,Inside Home,02/15/2018,07:35 AM,RESOL,N,02/20/2018,5,5518 HIGHLAND AVE,64110,Blue Hills,Jackson,Metro,146833,39.026186,-94.566028,Animals,Pets,NULL,2018-02-20,2018-02-15,2024-01-30 20:56:06,DAMG7370_Lakshmi
1361793,2018058198,PHONE,NHS,NHS-Neighborhood Preservation-,Property Maintenance,Other Property Issue,05/09/2018,01:32 PM,RESOL,Y,07/13/2018,65,6808 NW 77th Ter,64152,Platte Ridge,Platte,North,169692,39.235586,-94.659829,Property,Buildings,Construction,2018-07-13,2018-05-09,2024-01-30 20:56:06,DAMG7370_Lakshmi
1342043,2018009793,PHONE,NHS,NHS-Solid Waste-,Trash Collection,Missed by Contractor South,01/19/2018,06:05 PM,RESOL,N,01/20/2018,1,507 W 77TH ST,64114,Ward Parkway,Jackson,Metro,120318,38.988601,-94.595871,Trash,Recycling,NULL,2018-01-20,2018-01-19,2024-01-30 20:56:06,DAMG7370_Lakshmi
26759,2018042422,PHONE,NHS,NHS-Neighborhood Preservation-,Nuisance,Trash on Private Property,04/09/2018,07:48 AM,RESOL,Y,04/27/2021,1114,5700 E Truman Rd,64127,West Blue Valley,Jackson,East,8910,39.094486,-94.515567,Trash,Recycling,NULL,2021-04-27,2018-04-09,2024-01-30 20:56:04,DAMG7370_Lakshmi
1430200,2018148243,PHONE,NHS,NHS-Solid Waste-,Recycling,Missed by City,11/06/2018,11:23 AM,RESOL,N,11/07/2018,1,1805 W 41st St,64111,Volker,Jackson,Central,130741,39.054128,-94.606639,Trash,Recycling,NULL,2018-11-07,2018-11-06,2024-01-30 20:56:06,DAMG7370_Lakshmi
1418699,2018134199,"WEB  ",Public Works,Public Works-Capital Projects-Traffic Control,Traffic Signal,New Signal Request,10/04/2018,06:09 PM,RESOL,N,10/05/2018,1,3142 Broadway Blvd,64111,Valentine,Jackson,Central,129248,39.069592,-94.590445,Lights,Signals,NULL,2018-10-05,2018-10-04,2024-01-30 20:56:06,DAMG7370_Lakshmi
1332709,2018019810,"WEB  ",NHS,NHS-Neighborhood Preservation-,Disabled/Unlicensed on Private Property,Car Private Property,02/15/2018,06:10 PM,RESOL,Y,12/21/2018,309,719 EWING AVE,64125,Sheffield,Jackson,East,5114,39.102713,-94.502535,Vehicles,Parking,NULL,2018-12-21,2018-02-15,2024-01-30 20:56:06,DAMG7370_Lakshmi
1339595,2018010878,PHONE,Water Services,Water Services-Meter and Field Services-,Leak,Meter,01/23/2018,03:09 PM,RESOL,N,01/26/2018,3,1223 Fremont Ave,64126,East Blue Valley,Jackson,East,6144,39.096404,-94.507479,Water,NULL,NULL,2018-01-26,2018-01-23,2024-01-30 20:56:06,DAMG7370_Lakshmi
1407556,2018111476,PHONE,NHS,NHS-Animal Health and Safety-,Cruelty or Neglect,Shelter / Food / Water,08/20/2018,01:38 PM,RESOL,N,08/21/2018,1,3721 Mersington Ave,64128,Palestine East,Jackson,East,28270,39.057707,-94.538256,Animals,Pets,NULL,2018-08-21,2018-08-20,2024-01-30 20:56:06,DAMG7370_Lakshmi
1379012,2018089043,PHONE,NHS,NHS-Solid Waste-,Trash Collection,Missed by Contractor North,07/06/2018,06:24 PM,RESOL,Y,07/12/2018,6,6301 NW 82ND CT,64151,The Coves,Platte,North,160606,39.242674,-94.652224,Trash,Recycling,NULL,2018-07-12,2018-07-06,2024-01-30 20:56:06,DAMG7370_Lakshmi
1345608,2018039183,EMAIL,City Planning and Development,City Planning and Development-Dev Comp-Zoning,Commercial Signs / Ads,Billboard,03/30/2018,02:05 PM,RESOL,Y,07/25/2018,117,4231 Main St,64111,Southmoreland,Jackson,Central,132858,39.049767,-94.586134,Signs,NULL,NULL,2018-07-25,2018-03-30,2024-01-30 20:56:06,DAMG7370_Lakshmi
1364467,2018051033,PHONE,NHS,NHS-Solid Waste-,Recycling,Missed by Contractor North,04/26/2018,08:37 AM,RESOL,N,04/26/2018,0,8901 N NORTON AVE,64156,Shoal Creek,Clay,Shoal Creek,257731,39.254902,-94.52996,Trash,Recycling,NULL,2018-04-26,2018-04-26,2024-01-30 20:56:06,DAMG7370_Lakshmi
1323169,2018001720,PHONE,NHS,NHS-Solid Waste-,Recycling,Missed by Contractor North,01/03/2018,06:21 PM,RESOL,N,01/04/2018,1,2409 NE 53RD ST,64118,Davidson,Clay,Shoal Creek,86785,39.189992,-94.55086,Trash,Recycling,NULL,2018-01-04,2018-01-03,2024-01-30 20:56:06,DAMG7370_Lakshmi
1432936,2018165485,PHONE,Water Services,Water Services-Meter and Field Services-,Leak,Meter,12/12/2018,03:30 PM,RESOL,N,12/13/2018,1,8551 N Boardwalk Ave,64154,Coves North,Platte,North,207778,39.250907,-94.654742,Water,NULL,NULL,2018-12-13,2018-12-12,2024-01-30 20:56:06,DAMG7370_Lakshmi
1418224,2018132774,EMAIL,Public Works,Public Works-Capital Projects-Traffic Control,Traffic Sign,New Sign Request,10/02/2018,03:30 PM,RESOL,N,10/03/2018,1,11512 N CHERRY DR,64155,Nashua,Clay,Shoal Creek,100708,39.302765,-94.573468,Signs,NULL,NULL,2018-10-03,2018-10-02,2024-01-30 20:56:06,DAMG7370_Lakshmi
1398709,2018103647,EMAIL,Parks and Rec,Parks and Rec-Landscape Services-Forestry,Trimming,Tree Limbs,08/02/2018,01:22 PM,RESOL,N,08/03/2018,1,3524 Garner Ave,64124,Scarritt Point,Jackson,East,42000,39.108884,-94.539109,Trees,NULL,NULL,2018-08-03,2018-08-02,2024-01-30 20:56:06,DAMG7370_Lakshmi
1420249,2018128476,PHONE,Parks and Rec,Parks and Rec-Landscape Services-Forestry,Removal,Tree Down,09/24/2018,11:15 AM,RESOL,Y,10/02/2018,8,4539 Lister Ave,64130,Vineyard,Jackson,East,33319,39.042518,-94.528488,Trees,NULL,NULL,2018-10-02,2018-09-24,2024-01-30 20:56:06,DAMG7370_Lakshmi
1336410,2018016387,PHONE,Public Works,Public Works-Street and Traffic-Snow,Snow / Ice,District 1,02/06/2018,03:59 PM,RESOL,N,02/07/2018,1,5500 N WOODLAND AVE,64118,Davidson,Clay,Shoal Creek,86612,39.192876,-94.557774,Streets,Roadways,Alleys,2018-02-07,2018-02-06,2024-01-30 20:56:06,DAMG7370_Lakshmi
139816,2018102581,PHONE,NHS,NHS-Neighborhood Preservation-,Disabled/Unlicensed on Private Property,Car Private Property,07/31/2018,04:11 PM,RESOL,Y,01/07/2020,525,3520 NE 54TH ST,64119,Country Club Estates And Big Shoal,Clay,Shoal Creek,79450,39.191801,-94.537833,Vehicles,Parking,NULL,2020-01-07,2018-07-31,2024-01-30 20:56:04,DAMG7370_Lakshmi
1342197,2018022799,PHONE,Water Services,Water Services-Line Maintenance-Wastewater,Sewer Odor,Outdoor,02/23/2018,03:37 PM,RESOL,Y,04/26/2018,62,5106 N Antioch Rd,64118,Davidson,Clay,Shoal Creek,87640,39.186871,-94.549285,Storm Water,Sewer,NULL,2018-04-26,2018-02-23,2024-01-30 20:56:06,DAMG7370_Lakshmi
1425180,2018151818,PHONE,NHS,NHS-Solid Waste-,Trash Collection,Missed by Contractor North,11/16/2018,07:36 AM,RESOL,Y,12/28/2018,42,10221 N Lawn Ave,64156,Shoal Creek,Clay,Shoal Creek,222958,39.27927,-94.52411,Trash,Recycling,NULL,2018-12-28,2018-11-16,2024-01-30 20:56:06,DAMG7370_Lakshmi
1447995,2018169514,EMAIL,NHS,NHS-Solid Waste-,Recycling,Missed by City,12/24/2018,03:15 PM,RESOL,N,12/27/2018,3,4215 Bell St,64111,Volker,Jackson,Central,130783,39.051707,-94.606034,Trash,Recycling,NULL,2018-12-27,2018-12-24,2024-01-30 20:56:06,DAMG7370_Lakshmi
1322662,2018002498,PHONE,NHS,NHS-Solid Waste-,Trash Collection,Missed by Contractor North,01/04/2018,06:32 PM,RESOL,Y,01/06/2018,2,4514 NE 91st St,64156,Shoal Creek,Clay,Shoal Creek,248441,39.25882,-94.525406,Trash,Recycling,NULL,2018-01-06,2018-01-04,2024-01-30 20:56:06,DAMG7370_Lakshmi
1413227,2018125676,PHONE,Water Services,Water Services-Line Maintenance-Wastewater,Sewer Backup / Leak,In A House,09/18/2018,10:41 AM,RESOL,N,09/20/2018,2,9105 McGee St,64114,Boone Hills,Jackson,Metro,151404,38.96275,-94.587137,Storm Water,Sewer,NULL,2018-09-20,2018-09-18,2024-01-30 20:56:06,DAMG7370_Lakshmi
3077,2018142172,PHONE,Public Works,Public Works-Street and Traffic-District 3,Other-Maintenance,District 3,10/23/2018,09:28 AM,RESOL,Y,03/06/2020,500,9542 N Myrtle Ct,64156,Shoal Creek,Clay,Shoal Creek,231312,39.266744,-94.529359,Streets,Roadways,Alleys,2020-03-06,2018-10-23,2024-01-30 20:56:04,DAMG7370_Lakshmi
1360813,2018058972,PHONE,Parks and Rec,Parks and Rec-Administration-,Services,Service Issue / Problem,05/10/2018,02:15 PM,RESOL,Y,06/08/2018,29,4425 GLADSTONE BLVD,64123,Scarritt Point,Jackson,East,43373,39.117666,-94.52914,Parks & Recreation,NULL,NULL,2018-06-08,2018-05-10,2024-01-30 20:56:06,DAMG7370_Lakshmi
1383825,2018082843,PHONE,Water Services,Water Services-Meter and Field Services-,No Water / Pressure,No Water,06/25/2018,12:17 PM,RESOL,N,06/26/2018,1,2319 Askew Ave,64127,East Community Team South,Jackson,East,17191,39.083144,-94.540246,Water,NULL,NULL,2018-06-26,2018-06-25,2024-01-30 20:56:06,DAMG7370_Lakshmi
1426959,2018151163,PHONE,NHS,NHS-Solid Waste-,Trash Collection,Missed South Trash - Recycling,11/14/2018,06:16 PM,RESOL,N,12/03/2018,19,2912 E 77th Ter,64132,Marlborough East,Jackson,Metro,4648,38.986333,-94.553583,Trash,Recycling,NULL,2018-12-03,2018-11-14,2024-01-30 20:56:06,DAMG7370_Lakshmi
1352720,2018039826,PHONE,NHS,NHS-Neighborhood Preservation-,Property Maintenance,Other Property Issue,04/02/2018,01:56 PM,RESOL,Y,04/18/2018,16,230 NE 82nd St,64118,Jefferson Highlands,Clay,North,93038,39.243048,-94.577788,Property,Buildings,Construction,2018-04-18,2018-04-02,2024-01-30 20:56:06,DAMG7370_Lakshmi
1332706,2018020820,PHONE,NHS,NHS-Solid Waste-,Recycling,Missed by Contractor South,02/20/2018,06:10 PM,RESOL,N,02/21/2018,1,10230 E 43RD ST,64133,Riss Lake,Jackson,East,48618,39.044998,-94.458636,Trash,Recycling,NULL,2018-02-21,2018-02-20,2024-01-30 20:56:06,DAMG7370_Lakshmi
1389094,2018091843,"WEB  ",NHS,NHS-Solid Waste-,Trash Collection,Missed by Contractor North,07/11/2018,11:24 AM,RESOL,Y,07/16/2018,5,3930 N Main St,64116,Briarcliff And Claymont,Clay,North,85274,39.166125,-94.581646,Trash,Recycling,NULL,2018-07-16,2018-07-11,2024-01-30 20:56:06,DAMG7370_Lakshmi
1440892,2018158001,"WEB  ",NHS,NHS-Solid Waste-,Trash Collection,Missed by Contractor North,11/28/2018,05:16 PM,RESOL,Y,12/03/2018,5,3726 NE 92nd St,64156,Shoal Creek,Clay,Shoal Creek,97466,39.260417,-94.534867,Trash,Recycling,NULL,2018-12-03,2018-11-28,2024-01-30 20:56:06,DAMG7370_Lakshmi
1376525,2018069228,PHONE,NHS,NHS-Solid Waste-,Trash Collection,Missed by Contractor North,05/30/2018,06:12 PM,RESOL,N,05/31/2018,1,5705 N Wyoming Ave,64118,Lakeview Terrace,Clay,North,220267,39.197118,-94.599857,Trash,Recycling,NULL,2018-05-31,2018-05-30,2024-01-30 20:56:06,DAMG7370_Lakshmi
1409202,2018109317,EMAIL,City Managers Office,City Managers Office-311 Call Center-Administratio,311 Administration,Appearance / Speaker,08/15/2018,12:08 PM,RESOL,N,08/17/2018,2,2008 E 12th St,64127,Forgotten Homes,Jackson,Central,223225,39.099713,-94.557725,Government,NULL,NULL,2018-08-17,2018-08-15,2024-01-30 20:56:06,DAMG7370_Lakshmi
1341869,2018015301,PHONE,NHS,NHS-Solid Waste-,Trash Collection,Missed by Contractor North,02/02/2018,06:04 PM,RESOL,N,02/05/2018,3,5436 N Hardesty Ave,64119,Ravenwood-Somerset,Clay,Shoal Creek,80504,39.192574,-94.517152,Trash,Recycling,NULL,2018-02-05,2018-02-02,2024-01-30 20:56:06,DAMG7370_Lakshmi
1383425,2018085477,PHONE,Water Services,Water Services-Engineering-Water and Sewer,Sewer,Engineering,06/29/2018,11:07 AM,RESOL,Y,08/24/2018,56,8110 NW 79TH PL,64152,Park Forest,Platte,North,169973,39.238707,-94.674661,Capital Projects,NULL,NULL,2018-08-24,2018-06-29,2024-01-30 20:56:06,DAMG7370_Lakshmi
1354973,2018050558,PHONE,NHS,NHS-Solid Waste-,Trash Collection,Missed by City,04/25/2018,10:26 AM,RESOL,N,04/26/2018,1,5094 Glenside Dr,64129,Eastwood Hills West,Jackson,Metro,54457,39.032044,-94.510799,Trash,Recycling,NULL,2018-04-26,2018-04-25,2024-01-30 20:56:06,DAMG7370_Lakshmi
1371570,2018059261,PHONE,NHS,NHS-Solid Waste-,Recycling,Missed by Contractor South,05/11/2018,08:55 AM,RESOL,N,05/17/2018,6,6840 ROCKHILL RD,64113,Armour Hills,Jackson,Metro,111706,39.003718,-94.586001,Trash,Recycling,NULL,2018-05-17,2018-05-11,2024-01-30 20:56:06,DAMG7370_Lakshmi
1413857,2018123523,PHONE,Health,Health-Rat-,Rat Treatment,Outside,09/13/2018,01:35 PM,RESOL,N,09/24/2018,11,4225 E 62nd St,64130,Swope Parkway-Elmwood,Jackson,Metro,461,39.013048,-94.536403,Animals,Pets,NULL,2018-09-24,2018-09-13,2024-01-30 20:56:06,DAMG7370_Lakshmi
1378298,2018086809,"WEB  ",NHS,NHS-Neighborhood Preservation-,Nuisance,Trash on Private Property,07/02/2018,05:41 PM,RESOL,N,07/03/2018,1,13025 Wornall Rd,64145,Woodbridge,Jackson,South,158980,38.890659,-94.594038,Trash,Recycling,NULL,2018-07-03,2018-07-02,2024-01-30 20:56:06,DAMG7370_Lakshmi
1334968,2018016913,"WEB  ",Public Works,Public Works-Capital Projects-Traffic Permits,Cut / Permit,District 2,02/07/2018,04:59 PM,RESOL,Y,02/12/2018,5,919 W 44TH ST,64111,West Plaza,Jackson,Central,140676,39.047778,-94.597927,Streets,Roadways,Alleys,2018-02-12,2018-02-07,2024-01-30 20:56:06,DAMG7370_Lakshmi
1350141,2018041179,"WEB  ",NHS,NHS-Solid Waste-,Trash Collection,Missed by Contractor North,04/04/2018,08:11 PM,RESOL,N,04/05/2018,1,9436 N Spruce Ct,64156,Shoal Creek,Clay,Shoal Creek,246336,39.264936,-94.529377,Trash,Recycling,NULL,2018-04-05,2018-04-04,2024-01-30 20:56:06,DAMG7370_Lakshmi
1433439,2018155566,PHONE,Public Works,Public Works-Street and Traffic-Snow,Snow / Ice,District 1,11/27/2018,12:44 PM,RESOL,N,12/03/2018,6,9708 N Harrison St,64155,New Mark,Clay,Shoal Creek,103631,39.271178,-94.568484,Streets,Roadways,Alleys,2018-12-03,2018-11-27,2024-01-30 20:56:06,DAMG7370_Lakshmi
1433408,2018158504,PHONE,NHS,NHS-Solid Waste-,Recycling,Missed by City,11/29/2018,08:35 AM,RESOL,N,12/03/2018,4,8600 E 50th Ter,64129,Eastwood Hills East,Jackson,East,51010,39.032541,-94.482725,Trash,Recycling,NULL,2018-12-03,2018-11-29,2024-01-30 20:56:06,DAMG7370_Lakshmi
1339996,2018016150,PHONE,NHS,NHS-Solid Waste-Administration,Services,Service Issue / Problem,02/06/2018,10:46 AM,RESOL,N,02/07/2018,1,523 DENVER AVE,64124,South Indian Mound,Jackson,East,45166,39.106269,-94.521057,Trash,Recycling,NULL,2018-02-07,2018-02-06,2024-01-30 20:56:06,DAMG7370_Lakshmi
1419571,2018122600,PHONE,Water Services,Water Services-Meter and Field Services-,No Water / Pressure,Low Pressure,09/12/2018,09:53 AM,RESOL,N,09/12/2018,0,15615 Kensington Ave,64147,Richards Gebaur,Cass,South,75011,38.842442,-94.544306,Water,NULL,NULL,2018-09-12,2018-09-12,2024-01-30 20:56:06,DAMG7370_Lakshmi
1443379,2018170733,PHONE,Water Services,Water Services-Meter and Field Services-,No Water / Pressure,Low Pressure,12/28/2018,11:34 AM,RESOL,N,12/31/2018,3,7303 E 107th St,64134,Ruskin Heights,Jackson,South,71891,38.930218,-94.504744,Water,NULL,NULL,2018-12-31,2018-12-28,2024-01-30 20:56:06,DAMG7370_Lakshmi
1376432,2018068337,EMAIL,Public Works,Public Works-Capital Projects-Traffic Control,Traffic Sign,New Sign Request,05/29/2018,04:42 PM,RESOL,N,05/30/2018,1,2211 Charlotte St,64108,Hospital Hill,Jackson,Central,124735,39.085905,-94.574151,Signs,NULL,NULL,2018-05-30,2018-05-29,2024-01-30 20:56:06,DAMG7370_Lakshmi
18011,2018126333,PHONE,NHS,NHS-Neighborhood Preservation-,Property Maintenance,Main Structure,09/19/2018,09:35 AM,RESOL,Y,06/03/2020,623,5516 Olive St,64130,Blue Hills,Jackson,Metro,147682,39.025967,-94.55787,Property,Buildings,Construction,2020-06-03,2018-09-19,2024-01-30 20:56:04,DAMG7370_Lakshmi
1368100,2018071108,PHONE,NHS,NHS-Solid Waste-,Trash Collection,Missed by Contractor North,06/04/2018,09:56 AM,RESOL,N,06/05/2018,1,6509 NE 45TH ST,64117,Winnetonka,Clay,Shoal Creek,216498,39.175345,-94.503768,Trash,Recycling,NULL,2018-06-05,2018-06-04,2024-01-30 20:56:06,DAMG7370_Lakshmi
1368545,2018072436,EMAIL,Parks and Rec,Parks and Rec-Landscape Services-Forestry,Storm Damage,Tree Down,06/05/2018,03:34 PM,RESOL,N,06/07/2018,2,9027 Grandview Rd,64132,Hidden Valley,Jackson,Metro,55536,38.962108,-94.555463,Trees,NULL,NULL,2018-06-07,2018-06-05,2024-01-30 20:56:06,DAMG7370_Lakshmi
1381148,2018085130,EMAIL,NHS,NHS-Solid Waste-,Trash Collection,Missed by Contractor North,06/28/2018,03:48 PM,RESOL,N,06/29/2018,1,8719 NE 98th Ter,64157,Shoal Creek,Clay,Shoal Creek,245110,39.271141,-94.47316,Trash,Recycling,NULL,2018-06-29,2018-06-28,2024-01-30 20:56:06,DAMG7370_Lakshmi
1438065,2018166668,"WEB  ",NHS,NHS-Neighborhood Preservation-,Nuisance,Trash on Private Property,12/15/2018,04:54 PM,RESOL,Y,03/28/2019,103,484 Tullis Ave,64125,North Blue Ridge,Jackson,East,46691,39.10691,-94.488174,Trash,Recycling,NULL,2019-03-28,2018-12-15,2024-01-30 20:56:06,DAMG7370_Lakshmi
1387627,2018086570,"WEB  ",Public Works,Public Works-Street and Traffic-Rural Mowing,Right of Way (ROW),On Demand (PW),07/02/2018,01:47 PM,RESOL,N,07/03/2018,1,16001 Ess Rd,64136,Little Blue,Jackson,East,257645,38.993125,-94.39666,Mowing,Weeds,NULL,2018-07-03,2018-07-02,2024-01-30 20:56:06,DAMG7370_Lakshmi
1341589,2018012573,PHONE,NHS,NHS-Solid Waste-,Dumping,Right-Of-Way,01/26/2018,02:38 PM,RESOL,Y,03/30/2018,63,8900 Sni-A-Bar Rd,64133,Stayton Meadows,Jackson,East,52249,39.030771,-94.479361,Trash,Recycling,NULL,2018-03-30,2018-01-26,2024-01-30 20:56:06,DAMG7370_Lakshmi
1353335,2018032537,PHONE,NHS,NHS-Solid Waste-,Bulky Pick Up,Missed Pick Up,03/16/2018,03:32 PM,RESOL,N,03/19/2018,3,4641 N Brighton Ave,64117,Winnwood Gardens,Clay,Shoal Creek,75460,39.17864,-94.521008,Trash,Recycling,NULL,2018-03-19,2018-03-16,2024-01-30 20:56:06,DAMG7370_Lakshmi
1418404,2018137397,PHONE,NHS,NHS-Solid Waste-,Recycling,Missed by City,10/11/2018,12:04 PM,RESOL,N,10/11/2018,0,3319 MOULTON AVE,64127,Washington Wheatley,Jackson,East,16099,39.080901,-94.54361,Trash,Recycling,NULL,2018-10-11,2018-10-11,2024-01-30 20:56:06,DAMG7370_Lakshmi
1327872,2018008692,PHONE,NHS,NHS-Animal Health and Safety-,Services,Off Leash - Investigation,01/17/2018,04:43 PM,RESOL,Y,02/07/2018,21,4010 CHESTNUT AVE,64130,Oak Park Southwest,Jackson,East,29772,39.052905,-94.55175,Animals,Pets,NULL,2018-02-07,2018-01-17,2024-01-30 20:56:06,DAMG7370_Lakshmi
1405747,2018106230,PHONE,Water Services,Water Services-Line Maintenance-Wastewater,Sewer Odor,Indoor,08/08/2018,12:53 PM,RESOL,N,08/10/2018,2,4600 E 40th St,64130,Vineyard,Jackson,East,31493,39.053141,-94.530374,Storm Water,Sewer,NULL,2018-08-10,2018-08-08,2024-01-30 20:56:06,DAMG7370_Lakshmi
1352545,2018041519,PHONE,City Managers Office,City Managers Office-311-Field Staff,Commercial Signs / Ads,In Right-Of-Way,04/05/2018,02:22 PM,RESOL,N,04/13/2018,8,8400 N Ambassador Dr,64154,Coves North,Platte,North,160434,39.247517,-94.650608,Signs,NULL,NULL,2018-04-13,2018-04-05,2024-01-30 20:56:06,DAMG7370_Lakshmi
652774,2010398841,PHONE,NHS,NHS-Solid Waste-Illegal Dumping,Illegal Dumping,All,12/30/2010,04:59 PM,RESOL,N,01/14/2011,15,618 Van Brunt Blvd,64124,Lykins,Jackson,East,7840,39.10491,-94.52631,Trash,NULL,NULL,2011-01-14,2010-12-30,2024-01-30 20:56:05,DAMG7370_Lakshmi
10311,2020160352,"WEB  ",NHS,NHS-Solid Waste-,Trash Collection,Missed by Contractor North,12/31/2020,01:46 PM,RESOL,Y,01/05/2021,5,9800 NW Barry Rd,64153,KCI & 2nd Creek,Platte,North,168190,39.247455,-94.694322,Trash,Recycling,NULL,2021-01-05,2020-12-31,2024-01-30 20:56:04,DAMG7370_Lakshmi
859593,2013046400,PHONE,Public Works,Public Works-Capital Projects-Signs,Missing,Sign,04/09/2013,11:06 AM,RESOL,N,04/18/2013,9,7231 N HICKORY ST,64118,Clayton,Clay,North,95522,39.226533,-94.595203,Street Sign,NULL,NULL,2013-04-18,2013-04-09,2024-01-30 20:56:05,DAMG7370_Lakshmi
456447,2009068518,PHONE,Public Works,Public Works-Street and Traffic-District 3,Cleaning,District Three,03/19/2009,02:22 PM,RESOL,N,04/06/2009,18,3022 Wallace Ave,64129,NULL,NULL,NULL,0,35.797519,-103.890579,Ditch,NULL,NULL,2009-04-06,2009-03-19,2024-01-30 20:56:05,DAMG7370_Lakshmi
771211,2012049926,PHONE,Water Services,Water Services-Meter and Field Services-,Investigations,Street Leak,04/19/2012,07:49 AM,RESOL,N,04/20/2012,1,12801 RICKEY RD,64133,Little Blue,Jackson,East,65293,38.99568,-94.435763,Water Leak,NULL,NULL,2012-04-20,2012-04-19,2024-01-30 20:56:05,DAMG7370_Lakshmi
662131,2011038332,PHONE,Water Services,Water Services-Line Maintenance-Pipeline,Restoration,Turf,02/14/2011,10:55 AM,RESOL,N,04/27/2011,72,6404 Richmond Ave,64133,East Swope Highlands,Jackson,Metro,52541,39.00797,-94.498961,Water Services,NULL,NULL,2011-04-27,2011-02-14,2024-01-30 20:56:05,DAMG7370_Lakshmi
1186474,2016119832,"WEB  ",Public Works,Public Works-Capital Projects-Traffic Control,Traffic Sign,New Sign Request,09/26/2016,01:28 PM,RESOL,N,09/28/2016,2,5235 N Bellefontaine Ave,64119,Country Club Estates And Big Shoal,Clay,Shoal Creek,79899,39.189336,-94.542767,Signs,NULL,NULL,2016-09-28,2016-09-26,2024-01-30 20:56:05,DAMG7370_Lakshmi
1310719,2017142364,PHONE,Water Services,Water Services-Meter and Field Services-,No Water / Pressure,Low Pressure,11/08/2017,10:58 AM,RESOL,N,11/09/2017,1,1405 St Louis Ave,64101,NULL,Jackson,Central,123156,39.103157,-94.601846,Water,NULL,NULL,2017-11-09,2017-11-08,2024-01-30 20:56:06,DAMG7370_Lakshmi
1093838,2015125074,PHONE,NHS,NHS-Solid Waste-,Dead Animal,Street,10/16/2015,05:19 PM,RESOL,N,10/19/2015,3,14300 Holmes Rd,64145,Richards Gebaur,Jackson,South,240328,38.867524,-94.590632,Animals,Pets,NULL,2015-10-19,2015-10-16,2024-01-30 20:56:05,DAMG7370_Lakshmi
284228,2007185879,PHONE,NHS,NHS-Animal Health and Safety-,Other,Non Emergency,12/17/2007,11:16 AM,RESOL,N,12/18/2007,1,407 Monroe Ave,64124,NULL,NULL,NULL,0,35.797519,-103.890579,Animal,NULL,NULL,2007-12-18,2007-12-17,2024-01-30 20:56:05,DAMG7370_Lakshmi
794908,2012090957,PHONE,NHS,NHS-Animal Health and Safety-,Investigation,All,07/07/2012,03:14 PM,RESOL,N,07/08/2012,1,2636 Euclid Ave,64127,Wendell Phillips,Jackson,Central,14560,39.077798,-94.559731,Animal,NULL,NULL,2012-07-08,2012-07-07,2024-01-30 20:56:05,DAMG7370_Lakshmi
1255920,2017073326,PHONE,Public Works,Public Works-Capital Projects-Traffic Control,Traffic Sign,New Sign Request,06/20/2017,09:03 AM,RESOL,N,06/21/2017,1,4200 E 68th Ter,64132,Foxtown East,Jackson,Metro,4458,39.001986,-94.537897,Signs,NULL,NULL,2017-06-21,2017-06-20,2024-01-30 20:56:05,DAMG7370_Lakshmi
378070,2008232793,PHONE,NHS,NHS-Solid Waste-,Bulky,Appointment,09/16/2008,02:27 PM,RESOL,N,10/13/2008,27,7909 E 104TH TER,64134,Hickman Mills South,Jackson,South,70441,38.934753,-94.496955,Trash,NULL,NULL,2008-10-13,2008-09-16,2024-01-30 20:56:05,DAMG7370_Lakshmi
823570,2012150467,PHONE,Public Works,Public Works-Solid Waste-,Animal,Dead,10/26/2012,09:28 AM,RESOL,N,10/29/2012,3,408 E 101st St,64131,Willow Creek,Jackson,South,153658,38.944403,-94.584979,Trash,NULL,NULL,2012-10-29,2012-10-26,2024-01-30 20:56:05,DAMG7370_Lakshmi
1346275,2018042440,PHONE,NHS,NHS-Solid Waste-Administration,Services,Blue Bag Program,04/09/2018,08:10 AM,RESOL,N,04/10/2018,1,2200 Cliff Dr,64120,Pendleton Heights,Jackson,Central,39605,39.115174,-94.554564,Trash,Recycling,NULL,2018-04-10,2018-04-09,2024-01-30 20:56:06,DAMG7370_Lakshmi
301320,2008022734,PHONE,Public Works,Public Works-Street and Traffic-Snow,Street,District One,01/30/2008,08:48 AM,RESOL,N,01/31/2008,1,710 MAIN ST,64105,CBD Downtown,Jackson,Central,122453,39.105232,-94.583685,Snow & Ice,NULL,NULL,2008-01-31,2008-01-30,2024-01-30 20:56:05,DAMG7370_Lakshmi
894931,2013110795,PHONE,NHS,NHS-Neighborhood Preservation-,Private Property,No Known Property Owner,08/07/2013,03:35 PM,RESOL,Y,03/04/2015,574,8036 MONTGALL AVE,64132,Marlborough East,Jackson,Metro,4838,38.98032,-94.556961,Property Violations,NULL,NULL,2015-03-04,2013-08-07,2024-01-30 20:56:05,DAMG7370_Lakshmi
1143400,2016057255,PHONE,NHS,NHS-Solid Waste-,Bulky Pick Up,Missed Pick Up,05/25/2016,03:46 PM,RESOL,N,05/26/2016,1,4011 E 11TH ST,64127,Lykins,Jackson,East,10126,39.099149,-94.535337,Trash,Recycling,NULL,2016-05-26,2016-05-25,2024-01-30 20:56:05,DAMG7370_Lakshmi
460775,2009079183,PHONE,NHS,NHS-Neighborhood Preservation-,Private Property,All,04/01/2009,06:31 PM,RESOL,N,04/02/2009,1,7130 CLEVELAND AVE,64132,Noble And Gregory Ridge,Jackson,Metro,4183,38.996526,-94.543345,Nuisance Violations,NULL,NULL,2009-04-02,2009-04-01,2024-01-30 20:56:05,DAMG7370_Lakshmi
102068,2019195046,PHONE,NHS,NHS-Animal Health and Safety-,Cruelty or Neglect,Abandonment,11/20/2019,06:21 PM,RESOL,N,11/21/2019,1,4006 Bellefontaine Ave,64130,Oak Park Southwest,Jackson,East,29528,39.053135,-94.54832,Animals,Pets,NULL,2019-11-21,2019-11-20,2024-01-30 20:56:04,DAMG7370_Lakshmi
714443,2011178354,PHONE,NHS,NHS-Animal Health and Safety-,Emergency,*Select one,08/22/2011,01:52 PM,RESOL,Y,08/30/2011,8,4250 Van Brunt Blvd,64130,Vineyard,Jackson,East,31895,39.048784,-94.528413,Animal,NULL,NULL,2011-08-30,2011-08-22,2024-01-30 20:56:05,DAMG7370_Lakshmi
632265,2010333786,PHONE,Water Services,Water Services-Meter and Field Services-,All,All,09/29/2010,03:58 PM,RESOL,N,10/08/2010,9,6809 N PARK PLAZA DR,64151,Park Plaza,Platte,North,162970,39.218,-94.643569,Water Leak,NULL,NULL,2010-10-08,2010-09-29,2024-01-30 20:56:05,DAMG7370_Lakshmi
1135924,2016035125,PHONE,NHS,NHS-Animal Health and Safety-,Cruelty or Neglect,Inclement Weather,04/06/2016,10:42 AM,RESOL,N,04/06/2016,0,600 N Chouteau Trfy,64120,Northeast Industrial District,Jackson,East,38478,39.12018,-94.512514,Animals,Pets,NULL,2016-04-06,2016-04-06,2024-01-30 20:56:05,DAMG7370_Lakshmi
1056571,2015069640,PHONE,Public Works,Public Works-Street and Traffic-Rural Mowing,Right of Way (ROW),Region - North,06/18/2015,08:52 AM,RESOL,N,06/19/2015,1,3570 N Antioch Rd,64117,River Forest,Clay,Shoal Creek,78257,39.159407,-94.547253,Mowing,Weeds,NULL,2015-06-19,2015-06-18,2024-01-30 20:56:05,DAMG7370_Lakshmi
1334211,2018014374,PHONE,NHS,NHS-Solid Waste-,Trash Collection,Missed by Contractor South,01/31/2018,06:03 PM,RESOL,N,02/01/2018,1,9918 Campbell St,64131,Linden Hills And Indian Heights,Jackson,South,153466,38.946802,-94.577785,Trash,Recycling,NULL,2018-02-01,2018-01-31,2024-01-30 20:56:06,DAMG7370_Lakshmi
658066,2011032367,PHONE,NHS,NHS-Solid Waste-,Contractor,South,02/07/2011,03:03 PM,RESOL,N,02/08/2011,1,11729 E 72nd St,64133,Little Blue,Jackson,East,65355,38.991344,-94.443583,Trash,NULL,NULL,2011-02-08,2011-02-07,2024-01-30 20:56:05,DAMG7370_Lakshmi
1508247,2019071329,PHONE,Public Works,Public Works-Street and Traffic-Streetlights,Street Light,Blinking,04/11/2019,11:31 AM,RESOL,N,04/12/2019,1,100 NE 111th St,64155,Meadowbrook Heights,Clay,North,101787,39.295361,-94.577995,Lights,Signals,NULL,2019-04-12,2019-04-11,2024-01-30 20:56:06,DAMG7370_Lakshmi
611472,2010240532,PHONE,Water Services,Water Services-Meter and Field Services-,All,All,06/30/2010,05:53 PM,RESOL,N,07/01/2010,1,3837 N MICHIGAN AVE,64116,River Forest,Clay,Shoal Creek,85548,39.164277,-94.557124,Water Leak,NULL,NULL,2010-07-01,2010-06-30,2024-01-30 20:56:05,DAMG7370_Lakshmi
1268495,2017074395,PHONE,Public Works,Public Works-Street and Traffic-Streetlights,Street Light,Pole Down or Leaning,06/21/2017,10:51 AM,RESOL,N,06/22/2017,1,3620 NE 53rd St,64119,Country Club Estates And Big Shoal,Clay,Shoal Creek,79531,39.19008,-94.535669,Lights,Signals,NULL,2017-06-22,2017-06-21,2024-01-30 20:56:05,DAMG7370_Lakshmi
652416,2010390235,"WEB  ",NHS,NHS-Neighborhood Preservation-,Private Property,All,12/20/2010,12:02 PM,RESOL,N,01/12/2011,23,10717 NEWTON AVE,64134,Stratford Estates,Jackson,South,59325,38.928644,-94.511988,Property Violations,NULL,NULL,2011-01-12,2010-12-20,2024-01-30 20:56:05,DAMG7370_Lakshmi
127454,2017088291,"WEB  ",NHS,NHS-Neighborhood Preservation-,Property Maintenance,Other Property Issue,07/18/2017,11:37 AM,RESOL,Y,11/27/2019,862,1826 E 69TH ST,64132,Neighbors United For Action,Jackson,Metro,113956,39.002269,-94.564416,Property,Buildings,Construction,2019-11-27,2017-07-18,2024-01-30 20:56:04,DAMG7370_Lakshmi
30788,2019177557,PHONE,Public Works,Public Works-Street and Traffic-District 2,Other-Maintenance,District 2,10/09/2019,10:13 AM,RESOL,Y,12/16/2019,68,301 Gladstone Blvd,64124,Scarritt Point,Jackson,East,40823,39.111304,-94.545337,Streets,Roadways,Alleys,2019-12-16,2019-10-09,2024-01-30 20:56:04,DAMG7370_Lakshmi
1298665,2017125590,EMAIL,NHS,NHS-Solid Waste-,Trash Collection,Missed by City,09/28/2017,03:29 PM,RESOL,N,09/29/2017,1,6003 Norledge Ave,64123,North Indian Mound,Jackson,East,45665,39.115711,-94.511213,Trash,Recycling,NULL,2017-09-29,2017-09-28,2024-01-30 20:56:06,DAMG7370_Lakshmi
818485,2012125935,"WEB  ",NHS,NHS-Neighborhood Preservation-Open Entry,Board Up,All,09/08/2012,06:39 PM,RESOL,N,09/11/2012,3,4224 Hawthorne Ave,64133,Riss Lake,Jackson,East,48404,39.045731,-94.46438,Property Violations,NULL,NULL,2012-09-11,2012-09-08,2024-01-30 20:56:05,DAMG7370_Lakshmi
223750,2007043947,PHONE,Public Works,Public Works-Solid Waste-,City,Missed,05/10/2007,10:20 AM,RESOL,N,05/11/2007,1,3946 BELLEFONTAINE AVE,64130,Oak Park Southwest,Jackson,East,29531,39.053577,-94.548296,Trash,NULL,NULL,2007-05-11,2007-05-10,2024-01-30 20:56:05,DAMG7370_Lakshmi
797216,2012097319,PHONE,Water Services,Water Services-Meter and Field Services-,Investigations,Meter Leak,07/19/2012,02:03 PM,RESOL,N,07/19/2012,0,4019 Morrell Ave,64123,Scarritt Point,Jackson,East,41400,39.111796,-94.534086,Water Leak,NULL,NULL,2012-07-19,2012-07-19,2024-01-30 20:56:05,DAMG7370_Lakshmi
1202545,2016136609,PHONE,NHS,NHS-Neighborhood Preservation-,Private Property,Dead,11/02/2016,10:10 AM,RESOL,Y,11/08/2016,6,3535 Monroe Ave,64128,Palestine West And Oak Park Northeast,Jackson,East,27752,39.060967,-94.540256,Trees,NULL,NULL,2016-11-08,2016-11-02,2024-01-30 20:56:05,DAMG7370_Lakshmi
247851,2007100200,PHONE,NHS,NHS-Neighborhood Preservation-,Private Property,All,08/15/2007,04:21 PM,RESOL,N,09/13/2007,29,2809 BROOKLYN AVE,64109,Key Coalition,Jackson,Central,26520,39.07516,-94.556871,Nuisance Violations,NULL,NULL,2007-09-13,2007-08-15,2024-01-30 20:56:05,DAMG7370_Lakshmi
731779,2011214258,PHONE,Public Works,Public Works-Street and Traffic-Streetlights,Outage,Single,11/01/2011,09:58 AM,RESOL,N,11/02/2011,1,7406 TRACY AVE,64131,East Meyer 6,Jackson,Metro,114759,38.992739,-94.573649,Street Light,NULL,NULL,2011-11-02,2011-11-01,2024-01-30 20:56:05,DAMG7370_Lakshmi
351032,2008170690,PHONE,Public Works,Public Works-Solid Waste-,Bulky,Missed,07/10/2008,08:56 AM,RESOL,Y,07/15/2008,5,4316 N Colorado Ave,64117,Holiday Hills,Clay,Shoal Creek,76576,39.171851,-94.518626,Trash,NULL,NULL,2008-07-15,2008-07-10,2024-01-30 20:56:05,DAMG7370_Lakshmi
218770,2007022687,PHONE,NHS,NHS-Neighborhood Preservation-,Private Property,All,03/14/2007,12:01 PM,RESOL,N,03/26/2007,12,2820 CYPRESS AVE,64128,East Community Team South,Jackson,East,22292,39.0739,-94.530911,Property & Nuisance Violations,NULL,NULL,2007-03-26,2007-03-14,2024-01-30 20:56:04,DAMG7370_Lakshmi
723132,2011189580,PHONE,Public Works,Public Works-Street and Traffic-District 2,Street,All,09/10/2011,09:34 AM,RESOL,Y,10/24/2011,44,4121 HIGHLAND AVE,64110,Ivanhoe Southwest,Jackson,Central,136210,39.05141,-94.56393,Maintenance,NULL,NULL,2011-10-24,2011-09-10,2024-01-30 20:56:05,DAMG7370_Lakshmi
1404572,2018110870,"WEB  ",NHS,NHS-Solid Waste-,Trash Collection,Missed by City,08/17/2018,07:15 PM,RESOL,Y,08/21/2018,4,16 E Concord Ave,64112,Countryside,Jackson,Metro,143655,39.032023,-94.586575,Trash,Recycling,NULL,2018-08-21,2018-08-17,2024-01-30 20:56:06,DAMG7370_Lakshmi
1208062,2016146558,PHONE,NHS,NHS-Neighborhood Preservation-,Parked on Unapproved Surface,Car Private Property,11/30/2016,12:53 PM,RESOL,Y,03/29/2017,119,804 E 75th Ter,64131,Tower Homes,Jackson,Metro,117581,38.991043,-94.578873,Vehicles,Parking,NULL,2017-03-29,2016-11-30,2024-01-30 20:56:05,DAMG7370_Lakshmi
109322,2019106509,PHONE,NHS,NHS-Neighborhood Preservation-Abatement,Property Maintenance,Land Bank,06/03/2019,03:52 PM,RESOL,Y,01/30/2020,241,5602 Virginia Ave,64110,Eastern 49-63,Jackson,Metro,146925,39.025071,-94.570759,Property,Buildings,Construction,2020-01-30,2019-06-03,2024-01-30 20:56:04,DAMG7370_Lakshmi
1258455,2017061067,PHONE,NHS,NHS-Animal Health and Safety-,Cruelty or Neglect,Abuse / Injury / Death,05/24/2017,02:22 PM,RESOL,N,05/25/2017,1,1828 Spruce Ave,64127,East Community Team North,Jackson,East,18333,39.089065,-94.532704,Animals,Pets,NULL,2017-05-25,2017-05-24,2024-01-30 20:56:05,DAMG7370_Lakshmi
1058617,2015071335,INSPE,NHS,NHS-Neighborhood Preservation-,Private / Commercial,Lot - Structure,06/22/2015,03:27 PM,RESOL,Y,01/25/2017,583,7613 E 109th Ter,64134,Ruskin Heights,Jackson,South,71737,38.927141,-94.5007,Mowing,Weeds,NULL,2017-01-25,2015-06-22,2024-01-30 20:56:05,DAMG7370_Lakshmi
1312365,2017155572,PHONE,NHS,NHS-Dangerous Buildings-,Dangerous Building,Standard,12/14/2017,08:44 AM,RESOL,N,12/14/2017,0,2110 TRACY AVE,64108,Beacon Hills,Jackson,Central,13418,39.086922,-94.568217,Property,Buildings,Construction,2017-12-14,2017-12-14,2024-01-30 20:56:06,DAMG7370_Lakshmi
178995,2021007562,"WEB  ",NHS,NHS-Neighborhood Preservation-,Property Maintenance,Other Property Issue,01/24/2021,07:51 PM,RESOL,Y,06/29/2021,156,4815 NE 44th Ter,64117,Winnwood,Clay,Shoal Creek,76059,39.174543,-94.522628,Property,Buildings,Construction,2021-06-29,2021-01-24,2024-01-30 20:56:04,DAMG7370_Lakshmi
1543281,2019133293,PHONE,NHS,NHS-Animal Health and Safety-,Cruelty or Neglect,Shelter / Food / Water,07/16/2019,02:11 PM,RESOL,N,07/18/2019,2,2936 Lister Ave,64128,Knoches Park,Jackson,East,22800,39.071614,-94.528883,Animals,Pets,NULL,2019-07-18,2019-07-16,2024-01-30 20:56:06,DAMG7370_Lakshmi
425401,2009010562,PHONE,NHS,NHS-Solid Waste-,11,FEB,01/14/2009,12:24 PM,RESOL,N,02/11/2009,28,11209 Norby Rd,64137,Terrace Lake Gardens,NULL,South,61111,38.921074,-94.534803,Bulky Appointment,NULL,NULL,2009-02-11,2009-01-14,2024-01-30 20:56:05,DAMG7370_Lakshmi
314745,2008056826,PHONE,NHS,NHS-Neighborhood Preservation-,Private Property,All,03/12/2008,01:47 PM,RESOL,N,03/20/2008,8,4814 MONTGALL AVE,64130,North Town Fork Creek,Jackson,Metro,35017,39.037895,-94.553684,Nuisance Violations,NULL,NULL,2008-03-20,2008-03-12,2024-01-30 20:56:05,DAMG7370_Lakshmi
1482735,2019051640,PHONE,Public Works,Public Works-Street and Traffic-District 3,Pothole,District 3,03/13/2019,10:43 AM,RESOL,Y,06/03/2019,82,11701 Hickman Mills Dr,64134,Hickman Mills,Jackson,South,74752,38.911305,-94.522756,Streets,Roadways,Alleys,2019-06-03,2019-03-13,2024-01-30 20:56:06,DAMG7370_Lakshmi
244104,2007092098,EMAIL,Public Works,Public Works-Street and Traffic-District 3,Street,District Three,07/31/2007,02:58 PM,RESOL,N,08/03/2007,3,6900 Paseo,64132,Neighbors United For Action,Jackson,Metro,114183,39.001802,-94.56304,Pothole,NULL,NULL,2007-08-03,2007-07-31,2024-01-30 20:56:05,DAMG7370_Lakshmi
1386772,2018081189,"WEB  ",Water Services,Water Services-Line Maintenance-Stormwater,Storm Drain / Catch Basin,Clogged / Over-Flow,06/21/2018,10:20 AM,RESOL,Y,08/09/2018,49,8711 E 114th St,64134,Ruskin Hills,Jackson,South,73107,38.916343,-94.488868,Storm Water,Sewer,NULL,2018-08-09,2018-06-21,2024-01-30 20:56:06,DAMG7370_Lakshmi
1299059,2017133524,"WEB  ",NHS,NHS-Neighborhood Preservation-,Private / Commercial,Lot - Structure,10/17/2017,09:29 PM,RESOL,N,10/31/2017,14,4414 Jarboe St,64111,West Plaza,Jackson,Central,140641,39.047435,-94.599763,Mowing,Weeds,NULL,2017-10-31,2017-10-17,2024-01-30 20:56:06,DAMG7370_Lakshmi
30471,2020090747,"BOT  ",NHS,NHS-Solid Waste-,Trash Collection,Missed by City,07/01/2020,04:16 PM,RESOL,N,07/02/2020,1,3716 Bales Ave,64128,Palestine West And Oak Park Northeast,Jackson,East,27979,39.057906,-94.543402,Trash,Recycling,NULL,2020-07-02,2020-07-01,2024-01-30 20:56:04,DAMG7370_Lakshmi
743369,2011237426,PHONE,Water Services,Water Services-Line Maintenance-Pipeline,Icing,*SELECT ONE,12/28/2011,12:42 PM,RESOL,Y,01/17/2012,20,4221 Vineyard Rd,64130,Vineyard,Jackson,East,32250,39.047907,-94.525202,Water Leak,NULL,NULL,2012-01-17,2011-12-28,2024-01-30 20:56:05,DAMG7370_Lakshmi
1136908,2016026274,PHONE,Water Services,Water Services-Line Maintenance-Wastewater,Sewer Referral,Repair,03/14/2016,11:08 AM,RESOL,Y,03/30/2016,16,5921 HARRISON ST,64110,Western 49-63,Jackson,Metro,105732,39.019223,-94.575102,Storm Water,Sewer,NULL,2016-03-30,2016-03-14,2024-01-30 20:56:05,DAMG7370_Lakshmi
448361,2009038272,PHONE,NHS,NHS-Solid Waste-,11,March,02/16/2009,09:01 AM,RESOL,N,03/12/2009,24,11900 AVILA DR,64114,Verona Hills,Jackson,South,157310,38.912586,-94.598039,Bulky Appointment,NULL,NULL,2009-03-12,2009-02-16,2024-01-30 20:56:05,DAMG7370_Lakshmi
1203452,2016128332,"WEB  ",NHS,NHS-Neighborhood Preservation-,Private / Commercial,Lot - Structure,10/15/2016,10:54 PM,RESOL,N,10/28/2016,13,3615 NE 42nd Ter,64117,Chaumiere,Clay,Shoal Creek,77700,39.170449,-94.537279,Mowing,Weeds,NULL,2016-10-28,2016-10-15,2024-01-30 20:56:05,DAMG7370_Lakshmi
1057039,2015070103,PHONE,NHS,NHS-Animal Health and Safety-Admin,Services,Off Leash - Investigation,06/18/2015,06:40 PM,RESOL,N,06/20/2015,2,6616 LYDIA AVE,64131,Neighbors United For Action,Jackson,Metro,105313,39.007618,-94.570629,Animals,Pets,NULL,2015-06-20,2015-06-18,2024-01-30 20:56:05,DAMG7370_Lakshmi
1538055,2019118794,"WEB  ",NHS,NHS-Solid Waste-,Trash Collection,Missed by Contractor South,06/20/2019,09:25 PM,RESOL,Y,06/25/2019,5,6717 Brookside Rd,64113,Armour Hills,Jackson,Metro,111771,39.006425,-94.592618,Trash,Recycling,NULL,2019-06-25,2019-06-20,2024-01-30 20:56:06,DAMG7370_Lakshmi
741139,2011220238,PHONE,NHS,NHS-Animal Health and Safety-,Owned or Stray at Large,All,11/14/2011,01:17 PM,RESOL,Y,11/18/2011,4,5206 EUCLID AVE,64130,Blue Hills,Jackson,Metro,145455,39.031905,-94.562168,Animal,NULL,NULL,2011-11-18,2011-11-14,2024-01-30 20:56:05,DAMG7370_Lakshmi
1013051,2014155361,PHONE,NHS,NHS-Animal Health and Safety-,Owned or Stray at Large,All,12/17/2014,04:24 PM,RESOL,N,12/18/2014,1,3412 NORTON AVE,64128,Palestine East,Jackson,East,26263,39.06314,-94.53623,Animal,NULL,NULL,2014-12-18,2014-12-17,2024-01-30 20:56:05,DAMG7370_Lakshmi
900085,2013114429,PHONE,NHS,NHS-Animal Health and Safety-,Owned or Stray at Large,All,08/14/2013,05:29 PM,RESOL,Y,08/19/2013,5,31 NW 95th Pl,64155,Meadowbrook Heights,Clay,North,242479,39.267598,-94.579529,Animal,NULL,NULL,2013-08-19,2013-08-14,2024-01-30 20:56:05,DAMG7370_Lakshmi
1549335,2019133071,PHONE,Public Works,Public Works-Street and Traffic-District 1,Culvert,North,07/16/2019,11:02 AM,RESOL,Y,08/13/2019,28,2700 NW 81st Ter,64151,Barry Harbour,Platte,North,162028,39.241376,-94.611962,Storm Water,Sewer,NULL,2019-08-13,2019-07-16,2024-01-30 20:56:06,DAMG7370_Lakshmi
727832,2011201454,PHONE,NHS,NHS-Neighborhood Preservation-Open Entry,Board Up,All,10/04/2011,10:53 AM,RESOL,Y,10/13/2011,9,4400 Cloon Ave,64127,Lykins,Jackson,East,8346,39.100295,-94.530207,Property Violations,NULL,NULL,2011-10-13,2011-10-04,2024-01-30 20:56:05,DAMG7370_Lakshmi
1380229,2018077005,PHONE,NHS,NHS-Neighborhood Preservation-Abatement,Land Bank,Hazardous,06/13/2018,12:03 PM,RESOL,Y,06/18/2018,5,3012 Cleveland Ave,64128,Ingleside,Jackson,East,24099,39.070769,-94.539359,Trees,NULL,NULL,2018-06-18,2018-06-13,2024-01-30 20:56:06,DAMG7370_Lakshmi
1359063,2018055712,PHONE,NHS,NHS-Animal Health and Safety-,Cruelty or Neglect,Abuse / Injury / Death,05/04/2018,03:06 PM,RESOL,N,05/04/2018,0,8301 N Church Rd,64158,Shoal Creek,Clay,Shoal Creek,259936,39.243108,-94.459634,Animals,Pets,NULL,2018-05-04,2018-05-04,2024-01-30 20:56:06,DAMG7370_Lakshmi
900221,2013108260,PHONE,NHS,NHS-Solid Waste-Administration,Administration,All,08/02/2013,10:50 AM,RESOL,N,08/02/2013,0,3922 PASEO,64110,Manheim Park,Jackson,Central,135580,39.054946,-94.567936,Public Works,NULL,NULL,2013-08-02,2013-08-02,2024-01-30 20:56:05,DAMG7370_Lakshmi
712584,2011157096,PHONE,NHS,NHS-Animal Health and Safety-,Barking Dog,All,07/15/2011,02:52 PM,RESOL,N,07/15/2011,0,9947 N Harrison Dr,64155,New Mark,Clay,Shoal Creek,102826,39.275553,-94.568165,Animal,NULL,NULL,2011-07-15,2011-07-15,2024-01-30 20:56:05,DAMG7370_Lakshmi
1216326,2016156521,"WEB  ",NHS,NHS-Neighborhood Preservation-,Disabled/Unlicensed on Private Property,Car Private Property,12/28/2016,04:57 PM,RESOL,N,12/28/2016,0,5718 N LENOX AVE,64151,Breen Hills,Platte,North,166696,39.199092,-94.623446,Vehicles,Parking,NULL,2016-12-28,2016-12-28,2024-01-30 20:56:05,DAMG7370_Lakshmi
569279,2010065156,PHONE,Water Services,Water Services-Meter and Field Services-,Investigations,All,02/17/2010,01:14 PM,RESOL,N,02/18/2010,1,721 NE 46th St,64116,Crestview,Clay,Shoal Creek,83672,39.176821,-94.570952,Water Leak,NULL,NULL,2010-02-18,2010-02-17,2024-01-30 20:56:05,DAMG7370_Lakshmi
529545,2009326272,EMAIL,Water Services,Water Services-Meter and Field Services-,All,All,11/13/2009,04:22 PM,RESOL,N,11/16/2009,3,3129 MCGEE ST,64111,Broadway Gillham,Jackson,Central,127564,39.069701,-94.580962,Water Leak,NULL,NULL,2009-11-16,2009-11-13,2024-01-30 20:56:05,DAMG7370_Lakshmi
73235,2020080025,EMAIL,NHS,NHS-Solid Waste-,Trash Collection,Missed by City,06/10/2020,08:16 AM,RESOL,N,06/11/2020,1,4309 Paseo,64110,Ivanhoe Southwest,Jackson,Central,137469,39.04831,-94.567523,Trash,Recycling,NULL,2020-06-11,2020-06-10,2024-01-30 20:56:04,DAMG7370_Lakshmi
859450,2013058182,PHONE,Public Works,Public Works- Sidewalks- GO Bonds,Disrepair,Curb or Sidewalk,05/03/2013,11:23 AM,RESOL,N,05/30/2013,27,1203 MANHEIM RD,64109,Squier Park,Jackson,Central,134907,39.057062,-94.570431,Sidewalk,NULL,NULL,2013-05-30,2013-05-03,2024-01-30 20:56:05,DAMG7370_Lakshmi
626744,2010307578,PHONE,Public Works,Public Works-Solid Waste-,City,Missed,08/31/2010,11:09 AM,RESOL,N,08/31/2010,0,4312 E 53rd St,64130,Sheraton Estates,Jackson,Metro,37670,39.029695,-94.534723,Trash,NULL,NULL,2010-08-31,2010-08-31,2024-01-30 20:56:05,DAMG7370_Lakshmi
1549198,2019141795,PHONE,NHS,NHS-Solid Waste-,Recycling,Missed by Contractor North,07/31/2019,08:37 AM,RESOL,N,08/01/2019,1,11715 N Harrison St,64155,Nashua,Clay,Shoal Creek,213967,39.306554,-94.566257,Trash,Recycling,NULL,2019-08-01,2019-07-31,2024-01-30 20:56:06,DAMG7370_Lakshmi
268342,2007151688,PHONE,NHS,NHS-Animal Health and Safety-,Other,Non Emergency,10/31/2007,10:31 AM,RESOL,N,10/31/2007,0,827 E 115TH ST,64131,Mission Lake,Jackson,South,156780,38.918167,-94.581248,Animal,NULL,NULL,2007-10-31,2007-10-31,2024-01-30 20:56:05,DAMG7370_Lakshmi
914870,2013128066,PHONE,NHS,NHS-Neighborhood Preservation-,Private Property,All,09/13/2013,10:50 AM,RESOL,Y,12/12/2014,455,2202 E 20th St,64127,Wendell Phillips,Jackson,Central,12946,39.088347,-94.55634,Property Violations,NULL,NULL,2014-12-12,2013-09-13,2024-01-30 20:56:05,DAMG7370_Lakshmi
575432,2010136484,"WEB  ",Public Works,Public Works-Solid Waste-,Right of Way,All,04/12/2010,03:38 PM,RESOL,N,04/13/2010,1,809 NE 117TH ST,64155,Nashua,Clay,Shoal Creek,207306,39.305475,-94.567611,Trash,NULL,NULL,2010-04-13,2010-04-12,2024-01-30 20:56:05,DAMG7370_Lakshmi
1126055,2016016494,PHONE,NHS,NHS-Animal Health and Safety-,Stray,At Large - Non-Aggressive,02/18/2016,08:49 AM,RESOL,N,02/18/2016,0,5273 FRANKLIN AVE,64130,Sheraton Estates,Jackson,Metro,37698,39.029648,-94.533934,Animals,Pets,NULL,2016-02-18,2016-02-18,2024-01-30 20:56:05,DAMG7370_Lakshmi
936423,2014015843,PHONE,Public Works,Public Works-Street and Traffic-Snow,Street,District Three,02/06/2014,02:09 PM,RESOL,N,02/13/2014,7,501 E 91ST ST,64131,Boone Hills,Jackson,Metro,151289,38.962711,-94.585175,Snow & Ice,NULL,NULL,2014-02-13,2014-02-06,2024-01-30 20:56:05,DAMG7370_Lakshmi
1232842,2017025790,PHONE,NHS,NHS-Neighborhood Preservation-,Property Maintenance,Main Structure,03/07/2017,04:33 PM,RESOL,Y,06/16/2017,101,207 W 78TH ST,64114,Tower Homes,Jackson,Metro,118312,38.986557,-94.592443,Property,Buildings,Construction,2017-06-16,2017-03-07,2024-01-30 20:56:05,DAMG7370_Lakshmi
1400746,2018109821,"WEB  ",NHS,NHS-Neighborhood Preservation-,Private / Commercial,Lot - Vacant,08/16/2018,10:17 AM,RESOL,N,08/16/2018,0,5300 E 155th St,64147,Richards Gebaur,Jackson,South,255898,38.848312,-94.538887,Mowing,Weeds,NULL,2018-08-16,2018-08-16,2024-01-30 20:56:06,DAMG7370_Lakshmi
1206653,2016141770,PHONE,Water Services,Water Services-Meter and Field Services-,Leak,At Curb / In Yard,11/15/2016,05:51 PM,RESOL,Y,11/18/2016,3,14121 E US 40 HWY,64136,Little Blue,Jackson,East,62934,39.034053,-94.414295,Water,NULL,NULL,2016-11-18,2016-11-15,2024-01-30 20:56:05,DAMG7370_Lakshmi
525109,2009341565,PHONE,NHS,NHS-Solid Waste-,Contractor,All,11/28/2009,03:33 PM,RESOL,N,11/30/2009,2,4812 NE BIRMINGHAM RD,64117,Chouteau Estates,Clay,Shoal Creek,79200,39.151942,-94.522941,Trash,NULL,NULL,2009-11-30,2009-11-28,2024-01-30 20:56:05,DAMG7370_Lakshmi
862658,2013045205,PHONE,Water Services,Water Services-Line Maintenance-Wastewater,Investigation,Initial,04/08/2013,07:58 AM,RESOL,N,04/10/2013,2,5207 Lister Ave,64130,Swope Parkway-Elmwood,Jackson,Metro,37627,39.030506,-94.528537,Sewer,NULL,NULL,2013-04-10,2013-04-08,2024-01-30 20:56:05,DAMG7370_Lakshmi
847398,2013036038,PHONE,Public Works,Public Works-Street and Traffic-District 3,Street,All,03/19/2013,10:04 AM,RESOL,N,03/25/2013,6,5447 Swope Pkwy,64130,North Town Fork Creek,Jackson,Metro,35706,39.026313,-94.541668,Maintenance,NULL,NULL,2013-03-25,2013-03-19,2024-01-30 20:56:05,DAMG7370_Lakshmi
1158541,2016069278,PHONE,Public Works,Public Works-Capital Projects-Traffic Signals,Traffic Signal,Signal Pole Damage,06/17/2016,02:18 PM,RESOL,N,06/21/2016,4,5220 ROCKHILL RD,64110,Western 49-63,Jackson,Metro,143261,39.031795,-94.576312,Lights,Signals,NULL,2016-06-21,2016-06-17,2024-01-30 20:56:05,DAMG7370_Lakshmi
683764,2011086674,PHONE,NHS,NHS-Animal Health and Safety-,Emergency,*Select one,04/07/2011,10:41 AM,RESOL,N,04/08/2011,1,4906 E 22ND ST,64127,East Community Team North,Jackson,East,18820,39.085511,-94.526128,Animal,NULL,NULL,2011-04-08,2011-04-07,2024-01-30 20:56:05,DAMG7370_Lakshmi
1482944,2019047357,PHONE,NHS,NHS-Solid Waste-,Dead Animal,Street,03/06/2019,06:36 PM,RESOL,N,03/07/2019,1,5400 E Gregory Blvd,64132,NULL,Jackson,Metro,29,38.999197,-94.525237,Animals,Pets,NULL,2019-03-07,2019-03-06,2024-01-30 20:56:06,DAMG7370_Lakshmi
309946,2008070474,PHONE,Public Works,Public Works-Solid Waste-,Bulky,Missed,03/27/2008,03:11 PM,RESOL,N,03/29/2008,2,4120 CLEVELAND AVE,64130,Oak Park Southeast,Jackson,East,30772,39.050578,-94.54041,Trash,NULL,NULL,2008-03-29,2008-03-27,2024-01-30 20:56:05,DAMG7370_Lakshmi
572163,2010098564,PHONE,Public Works,Public Works-Parking Division-,Illegally Parked Vehicle,Vehicle,03/15/2010,04:31 PM,RESOL,N,03/16/2010,1,408 W 8TH ST,64105,Quality Hill,Jackson,Central,122880,39.104964,-94.588489,Downtown Parking,NULL,NULL,2010-03-16,2010-03-15,2024-01-30 20:56:05,DAMG7370_Lakshmi
1499583,2019079193,"WEB  ",NHS,NHS-Solid Waste-,Trash Collection,Missed by Contractor North,04/23/2019,08:06 PM,RESOL,Y,05/16/2019,23,5515 NW 93rd St,64154,KCI & 2nd Creek,Platte,North,225680,39.262536,-94.644947,Trash,Recycling,NULL,2019-05-16,2019-04-23,2024-01-30 20:56:06,DAMG7370_Lakshmi
1148973,2016054845,PHONE,NHS,NHS-Neighborhood Preservation-,Property Maintenance,Main Structure,05/20/2016,08:48 AM,RESOL,N,05/24/2016,4,4412 N CAMPBELL ST,64116,Crestview,Clay,Shoal Creek,83618,39.17533,-94.569553,Property,Buildings,Construction,2016-05-24,2016-05-20,2024-01-30 20:56:05,DAMG7370_Lakshmi
41740,2020091774,PHONE,NHS,NHS-Animal Health and Safety-,Stray,At Large - Aggressive,07/06/2020,07:54 AM,RESOL,N,07/06/2020,0,8025 Michigan Ave,64132,Marlborough Heights/Marlborough Pride,Jackson,Metro,117119,38.981105,-94.565485,Animals,Pets,NULL,2020-07-06,2020-07-06,2024-01-30 20:56:04,DAMG7370_Lakshmi
977313,2014093475,PHONE,Water Services,Water Services-Line Maintenance-Stormwater,Catch Basin,All,07/18/2014,05:54 PM,RESOL,N,07/23/2014,5,1600 E 59th St,64110,Blue Hills,Jackson,Metro,147357,39.019872,-94.566872,Storm Water,NULL,NULL,2014-07-23,2014-07-18,2024-01-30 20:56:05,DAMG7370_Lakshmi
263685,2007133086,PHONE,Public Works,Public Works-Solid Waste-,Recycle,Bin Replacement or Damage,10/04/2007,01:53 PM,RESOL,N,10/05/2007,1,109 W 73RD ST,64114,Tower Homes,Jackson,Metro,112695,38.995585,-94.590912,Trash,NULL,NULL,2007-10-05,2007-10-04,2024-01-30 20:56:05,DAMG7370_Lakshmi
925656,2013163989,PHONE,NHS,NHS-Solid Waste-Administration,Administration,All,12/10/2013,01:19 PM,RESOL,N,12/10/2013,0,2717 Park Ave,64109,Key Coalition,Jackson,Central,26665,39.076544,-94.555653,Public Works,NULL,NULL,2013-12-10,2013-12-10,2024-01-30 20:56:05,DAMG7370_Lakshmi
1018634,2015006796,PHONE,NHS,NHS-Dangerous Buildings-,Board Up,All,01/21/2015,12:52 PM,RESOL,Y,12/10/2015,323,3217 E 32nd St,64128,Santa Fe,Jackson,East,25073,39.068496,-94.545139,Property Violations,NULL,NULL,2015-12-10,2015-01-21,2024-01-30 20:56:05,DAMG7370_Lakshmi
1440840,2018167490,"TWIR ",Water Services,Water Services-Line Maintenance-Wastewater,Sinkhole,Street,12/18/2018,09:43 AM,RESOL,Y,01/23/2019,36,212 W 36th St,64111,Hanover Place,Jackson,Central,132115,39.062314,-94.58879,Storm Water,Sewer,NULL,2019-01-23,2018-12-18,2024-01-30 20:56:06,DAMG7370_Lakshmi
932564,2014018588,PHONE,NHS,NHS-Animal Health and Safety-,Stray Confined,Confined,02/11/2014,11:24 AM,RESOL,N,02/11/2014,0,6205 NW 68TH TER,64151,Linden Park,Platte,North,163339,39.218599,-94.65286,Animal,NULL,NULL,2014-02-11,2014-02-11,2024-01-30 20:56:05,DAMG7370_Lakshmi
1108960,2015153017,"WEB  ",NHS,NHS-Neighborhood Preservation-,Property Maintenance,Main Structure,12/31/2015,03:59 AM,RESOL,Y,04/28/2016,119,2730 GROVE ST,64109,Beacon Hills,Jackson,Central,27199,39.076362,-94.566802,Property,Buildings,Construction,2016-04-28,2015-12-31,2024-01-30 20:56:05,DAMG7370_Lakshmi
9229,2019167227,PHONE,NHS,NHS-Neighborhood Preservation-,Private Property,Tree Debris,09/17/2019,11:32 AM,RESOL,Y,10/07/2019,20,5817 Marion Ave,64133,Fairway Hills,Jackson,East,63840,39.016482,-94.434002,Trees,NULL,NULL,2019-10-07,2019-09-17,2024-01-30 20:56:04,DAMG7370_Lakshmi
276503,2007149570,PHONE,Public Works,Public Works-Street and Traffic-Streetlights,Outage,Street Light,10/29/2007,09:47 AM,RESOL,N,10/30/2007,1,2803 HARRISON ST,64109,Longfellow,Jackson,Central,126748,39.075904,-94.57198,Street Light,NULL,NULL,2007-10-30,2007-10-29,2024-01-30 20:56:05,DAMG7370_Lakshmi
234539,2007075166,PHONE,NHS,NHS-Animal Health and Safety-,Emergency,*Select one,06/30/2007,10:57 AM,RESOL,N,07/02/2007,2,4251 E 62ND ST,64130,NULL,NULL,NULL,0,35.797519,-103.890579,Animal,NULL,NULL,2007-07-02,2007-06-30,2024-01-30 20:56:05,DAMG7370_Lakshmi
1347484,2018040130,PHONE,Water Services,Water Services-Meter and Field Services-,Leak,Meter,04/03/2018,09:13 AM,RESOL,N,04/11/2018,8,4600 WILLOW AVE,64133,Riss Lake,Jackson,East,234498,39.038737,-94.457087,Water,NULL,NULL,2018-04-11,2018-04-03,2024-01-30 20:56:06,DAMG7370_Lakshmi
621791,2010289967,"WEB  ",NHS,NHS-Animal Health and Safety-,Other,Non Emergency,08/11/2010,11:19 AM,RESOL,N,08/12/2010,1,6300 Swope Pkwy,64132,Swope Park Campus,Jackson,Metro,1909,39.01162,-94.543193,Animal,NULL,NULL,2010-08-12,2010-08-11,2024-01-30 20:56:05,DAMG7370_Lakshmi
291244,2008010492,PHONE,NHS,NHS-Animal Health and Safety-,Other,Non Emergency,01/14/2008,02:27 PM,RESOL,N,01/15/2008,1,2504 E 21ST ST,64127,NULL,NULL,NULL,0,35.797519,-103.890579,Animal,NULL,NULL,2008-01-15,2008-01-14,2024-01-30 20:56:05,DAMG7370_Lakshmi
555299,2010020053,PHONE,NHS,NHS-Neighborhood Preservation-,Private Property,All,01/14/2010,11:20 AM,RESOL,Y,08/25/2011,588,5400 E 25th St,64127,South Blue Valley,Jackson,East,20132,39.079919,-94.519918,Property Violations,NULL,NULL,2011-08-25,2010-01-14,2024-01-30 20:56:05,DAMG7370_Lakshmi
698405,2011137832,"WEB  ",NHS,NHS-Animal Health and Safety-,Barking Dog,All,06/11/2011,06:29 PM,RESOL,N,06/13/2011,2,3612 NW 85TH CT,64154,Coves North,Platte,North,220653,39.249677,-94.623309,Animal,NULL,NULL,2011-06-13,2011-06-11,2024-01-30 20:56:05,DAMG7370_Lakshmi
251913,2007087661,PHONE,NHS,NHS-Neighborhood Preservation-,Private Property,All,07/23/2007,10:25 AM,RESOL,Y,12/05/2007,135,4136 ARLINGTON AVE,64133,Riss Lake,Jackson,East,48374,39.046086,-94.467195,Nuisance Violations,NULL,NULL,2007-12-05,2007-07-23,2024-01-30 20:56:05,DAMG7370_Lakshmi
71216,2020026713,EMAIL,Public Works,Public Works-Street and Traffic-District 3,Pothole,District 3,02/21/2020,03:16 PM,RESOL,Y,03/05/2020,13,13320 E 139th St,64149,Longview,Jackson,South,225005,38.869006,-94.429904,Streets,Roadways,Alleys,2020-03-05,2020-02-21,2024-01-30 20:56:04,DAMG7370_Lakshmi
987755,2014096280,PHONE,NHS,NHS-Animal Health and Safety-,Owned or Stray at Large,All,07/25/2014,10:53 AM,RESOL,N,07/26/2014,1,8716 E 7th St,64125,North Blue Ridge,Jackson,East,47221,39.102695,-94.478915,Animal,NULL,NULL,2014-07-26,2014-07-25,2024-01-30 20:56:05,DAMG7370_Lakshmi
1255037,2017072805,PHONE,NHS,NHS-Animal Health and Safety-,Stray,At Large - Aggressive,06/19/2017,12:49 PM,RESOL,N,06/20/2017,1,6212 E 101st St,64134,Fairlane,Jackson,South,58427,38.941977,-94.515669,Animals,Pets,NULL,2017-06-20,2017-06-19,2024-01-30 20:56:05,DAMG7370_Lakshmi
312742,2008074547,PHONE,NHS,NHS-Solid Waste-Administration,Administration,All,04/01/2008,02:23 PM,RESOL,N,04/02/2008,1,5122 HARRIS AVE,64133,Stayton Meadows,Jackson,East,52291,39.028394,-94.451525,Public Works,NULL,NULL,2008-04-02,2008-04-01,2024-01-30 20:56:05,DAMG7370_Lakshmi
812918,2012121571,PHONE,NHS,NHS-Neighborhood Preservation-,Private Property,All,08/30/2012,08:00 AM,RESOL,Y,03/19/2013,201,8014 Campbell St,64131,Rockhill Manor,Jackson,Metro,119218,38.981845,-94.578805,Property Violations,NULL,NULL,2013-03-19,2012-08-30,2024-01-30 20:56:05,DAMG7370_Lakshmi
828199,2012143647,PHONE,NHS,NHS-Animal Health and Safety-,Investigation,All,10/11/2012,04:54 PM,RESOL,N,10/12/2012,1,816 NE 81ST ST,64118,Jefferson Highlands,Clay,Shoal Creek,93422,39.240786,-94.570298,Animal,NULL,NULL,2012-10-12,2012-10-11,2024-01-30 20:56:05,DAMG7370_Lakshmi
1372921,2018065337,PHONE,NHS,NHS-Solid Waste-Illegal Dumping,Dumping,Private Property,05/22/2018,05:18 PM,RESOL,Y,06/22/2018,31,8003 College Ave,64132,Marlborough East,Jackson,Metro,4781,38.981025,-94.549265,Trash,Recycling,NULL,2018-06-22,2018-05-22,2024-01-30 20:56:06,DAMG7370_Lakshmi
701838,2011125508,PHONE,Public Works,Public Works-Street and Traffic-Streetlights,Malfunction,Blinking Off and On,05/23/2011,09:32 AM,RESOL,N,05/24/2011,1,4107 NW PLATTE BROOKE DR,64151,Platte Brook North,Platte,North,162551,39.229995,-94.627993,Street Light,NULL,NULL,2011-05-24,2011-05-23,2024-01-30 20:56:05,DAMG7370_Lakshmi
1146214,2016058910,PHONE,Public Works,Public Works-Street and Traffic-District 1,Pothole,District 1,05/27/2016,10:49 PM,RESOL,N,05/31/2016,4,5204 N Hardesty Ave,64119,Ravenwood-Somerset,Clay,Shoal Creek,80561,39.188786,-94.516929,Streets,Roadways,Alleys,2016-05-31,2016-05-27,2024-01-30 20:56:05,DAMG7370_Lakshmi
1188443,2016112201,PHONE,NHS,NHS-Solid Waste-,Trash Collection,Missed by Contractor South,09/09/2016,06:11 PM,RESOL,N,09/12/2016,3,1107 W 77TH TER,64114,Ward Parkway,Jackson,Metro,120178,38.98794,-94.60309,Trash,Recycling,NULL,2016-09-12,2016-09-09,2024-01-30 20:56:05,DAMG7370_Lakshmi
1106979,2016002665,PHONE,Public Works,Public Works-Capital Projects-Traffic Control,Street Services,Traffic Study Request,01/08/2016,06:29 PM,RESOL,N,01/11/2016,3,638 W 39th St,64111,Valentine,Jackson,Central,129889,39.057152,-94.594969,Streets,Roadways,Alleys,2016-01-11,2016-01-08,2024-01-30 20:56:05,DAMG7370_Lakshmi
176207,2020132278,EMAIL,Public Works,Public Works-Street and Traffic-District 3,Pothole,District 3,10/06/2020,02:48 PM,RESOL,Y,10/13/2020,7,1201 W 113th St,64114,Foxcroft And Glen Arbor,Jackson,South,155900,38.923045,-94.606732,Streets,Roadways,Alleys,2020-10-13,2020-10-06,2024-01-30 20:56:04,DAMG7370_Lakshmi
1364372,2018057463,EMAIL,Public Works,Public Works-Capital Projects-Sidewalks,Damage / Dis-Repair,Private Property (ROW),05/08/2018,02:45 PM,RESOL,N,05/08/2018,0,5115 Baltimore Ave,64112,South Plaza,Jackson,Metro,143798,39.034397,-94.588181,Sidewalks,Curbs,Ditch,2018-05-08,2018-05-08,2024-01-30 20:56:06,DAMG7370_Lakshmi
324596,2008109858,PHONE,Public Works,Public Works-Street and Traffic-District 2,Street,All,05/07/2008,12:53 PM,RESOL,Y,05/28/2008,21,25 E 12TH ST,64106,CBD Downtown,Jackson,Central,12817,39.099782,-94.582431,Maintenance,NULL,NULL,2008-05-28,2008-05-07,2024-01-30 20:56:05,DAMG7370_Lakshmi
1321388,2017157492,PHONE,NHS,NHS-Neighborhood Preservation-,Property Maintenance,Main Structure,12/19/2017,03:10 PM,RESOL,Y,12/28/2017,9,7805 E 112TH ST,64134,Ruskin Heights,Jackson,South,72117,38.925039,-94.4987,Property,Buildings,Construction,2017-12-28,2017-12-19,2024-01-30 20:56:06,DAMG7370_Lakshmi
385330,2008234581,PHONE,NHS,NHS-Solid Waste-,Bulky,Appointment,09/18/2008,09:32 AM,RESOL,N,10/17/2008,29,8000 NW Mace Rd,64152,Park Forest,Platte,North,168517,39.240935,-94.680907,Trash,NULL,NULL,2008-10-17,2008-09-18,2024-01-30 20:56:05,DAMG7370_Lakshmi
650334,2010384578,PHONE,NHS,NHS-Solid Waste-,Bulky,Address Will Not Validate,12/13/2010,11:52 AM,RESOL,N,12/16/2010,3,12303  Rickey,NULL,Little Blue,NULL,East,65307,38.999883,-94.43664,Trash,NULL,NULL,2010-12-16,2010-12-13,2024-01-30 20:56:05,DAMG7370_Lakshmi
702063,2011128514,PHONE,NHS,NHS-Neighborhood Preservation-,Private Property,All,05/26/2011,10:09 AM,RESOL,N,06/23/2011,28,3493 NE 85TH TER,64156,Shoal Creek,Clay,Shoal Creek,88274,39.248545,-94.538231,Property Violations,NULL,NULL,2011-06-23,2011-05-26,2024-01-30 20:56:05,DAMG7370_Lakshmi
1221329,2017011219,PHONE,NHS,NHS-Solid Waste-,Dead Animal,Curb,01/30/2017,01:05 PM,RESOL,N,01/31/2017,1,3958 Chelsea Ave,64130,Vineyard,Jackson,East,31514,39.053481,-94.528445,Animals,Pets,NULL,2017-01-31,2017-01-30,2024-01-30 20:56:05,DAMG7370_Lakshmi
1385702,2018078524,PHONE,Water Services,Water Services-Meter and Field Services-,Leak,At Curb / In Yard,06/15/2018,03:18 PM,RESOL,N,06/16/2018,1,7620 WORNALL RD,64114,Ward Parkway,Jackson,Metro,119718,38.990144,-94.594866,Water,NULL,NULL,2018-06-16,2018-06-15,2024-01-30 20:56:06,DAMG7370_Lakshmi
664074,2011039411,PHONE,Public Works,Public Works-Street and Traffic-District 1,Street,District One,02/15/2011,08:11 AM,RESOL,N,02/16/2011,1,7103 NW BELVIDERE PKWY,64152,Park Forest,Platte,North,170399,39.232101,-94.662787,Pothole,NULL,NULL,2011-02-16,2011-02-15,2024-01-30 20:56:05,DAMG7370_Lakshmi
675160,2011056582,PHONE,Public Works,Public Works-Street and Traffic-District 2,Street,District Two,03/03/2011,11:35 AM,RESOL,N,03/08/2011,5,1135 W 41ST ST,64111,Volker,Jackson,Central,131188,39.054056,-94.600035,Pothole,NULL,NULL,2011-03-08,2011-03-03,2024-01-30 20:56:05,DAMG7370_Lakshmi
685445,2011086524,PHONE,Public Works,Public Works-Street and Traffic-Administration,Street and Traffic,Administration,04/07/2011,09:20 AM,RESOL,N,04/08/2011,1,3912 JACKSON AVE,64130,Vineyard Northwest,Jackson,East,30419,39.054041,-94.535557,Public Works,NULL,NULL,2011-04-08,2011-04-07,2024-01-30 20:56:05,DAMG7370_Lakshmi
234572,2007069004,PHONE,Water Services,Water Services-Laboratory Services-,Laboratory Service,All,06/20/2007,02:46 PM,RESOL,Y,07/09/2007,19,2618 Campbell St,64108,Longfellow,NULL,Central,125464,39.07879,-94.573998,Water Quality,NULL,NULL,2007-07-09,2007-06-20,2024-01-30 20:56:05,DAMG7370_Lakshmi
84087,2018162746,PHONE,NHS,NHS-Neighborhood Preservation-,Nuisance,Trash on Private Property,12/05/2018,02:28 PM,RESOL,Y,10/02/2020,667,1619 Topping Ave,64126,West Blue Valley,Jackson,East,6474,39.091384,-94.514585,Trash,Recycling,NULL,2020-10-02,2018-12-05,2024-01-30 20:56:04,DAMG7370_Lakshmi
935513,2014019685,PHONE,Public Works,Public Works-Solid Waste-,City,Missed,02/13/2014,09:07 AM,RESOL,N,02/14/2014,1,6012 E 9TH ST,64125,Sheffield,Jackson,East,5581,39.101418,-94.510617,Trash,NULL,NULL,2014-02-14,2014-02-13,2024-01-30 20:56:05,DAMG7370_Lakshmi
58316,2019187656,PHONE,NHS,NHS-Neighborhood Preservation-,Property Maintenance,Main Structure,11/01/2019,12:00 PM,RESOL,Y,07/10/2020,252,836 E 82nd St,64131,Rockhill Manor,Jackson,Metro,119558,38.979306,-94.579522,Property,Buildings,Construction,2020-07-10,2019-11-01,2024-01-30 20:56:04,DAMG7370_Lakshmi
82297,2020007426,EMAIL,Public Works,Public Works-Street and Traffic-Streetlights,Street Light,1 Light Out,01/17/2020,08:27 AM,RESOL,N,01/21/2020,4,8634 NE 91st Ter,64157,Shoal Creek,Clay,Shoal Creek,221186,39.259131,-94.478444,Lights,Signals,NULL,2020-01-21,2020-01-17,2024-01-30 20:56:04,DAMG7370_Lakshmi
1094590,2015135112,"WEB  ",Public Works,Public Works-Street and Traffic-Streetlights,Street Light,1 Light Out,11/12/2015,05:12 PM,RESOL,N,11/13/2015,1,7523 Oak St,64114,Tower Homes,Jackson,Metro,117768,38.991088,-94.584524,Lights,Signals,NULL,2015-11-13,2015-11-12,2024-01-30 20:56:05,DAMG7370_Lakshmi
85391,2019040491,PHONE,NHS,NHS-Neighborhood Preservation-,Nuisance,Open Storage,02/25/2019,06:06 PM,RESOL,Y,11/15/2019,263,5511 Michigan Ave,64130,Blue Hills,Jackson,Metro,147754,39.026412,-94.562988,Trash,Recycling,NULL,2019-11-15,2019-02-25,2024-01-30 20:56:04,DAMG7370_Lakshmi
479798,2009144435,PHONE,NHS,NHS-Solid Waste-,17,All,06/02/2009,10:32 AM,RESOL,N,07/29/2009,57,4507 N OAKLEY AVE,64117,Winnwood Gardens,Clay,Shoal Creek,75669,39.175665,-94.513818,Bulky Appointment,NULL,NULL,2009-07-29,2009-06-02,2024-01-30 20:56:05,DAMG7370_Lakshmi
422181,2008312687,PHONE,Public Works,Public Works-Solid Waste-,Bulky,Missed,12/23/2008,08:29 AM,RESOL,Y,12/26/2008,3,716 E 124th St,64146,Mission Lake,Jackson,South,211279,38.901856,-94.584391,Trash,NULL,NULL,2008-12-26,2008-12-23,2024-01-30 20:56:05,DAMG7370_Lakshmi
311928,2008053345,PHONE,NHS,NHS-Animal Health and Safety-,Other,Non Emergency,03/07/2008,07:45 PM,RESOL,N,03/08/2008,1,8839 FLORA AVE,64131,Legacy East,Jackson,Metro,150755,38.966174,-94.571363,Animal,NULL,NULL,2008-03-08,2008-03-07,2024-01-30 20:56:05,DAMG7370_Lakshmi
808395,2012109002,PHONE,NHS,NHS-Neighborhood Preservation-Open Entry,Board Up,All,08/10/2012,09:10 AM,RESOL,Y,09/25/2012,46,2611 E 27TH ST,64128,Santa Fe,Jackson,East,24468,39.07676,-94.551954,Property Violations,NULL,NULL,2012-09-25,2012-08-10,2024-01-30 20:56:05,DAMG7370_Lakshmi
1526987,2019099708,EMAIL,NHS,NHS-Solid Waste-Administration,Services,Feedback,05/23/2019,10:15 AM,RESOL,N,05/23/2019,0,8817 Daniel Boone Rd,64114,Santa Fe Hills,Jackson,Metro,149988,38.967889,-94.592671,Trash,Recycling,NULL,2019-05-23,2019-05-23,2024-01-30 20:56:06,DAMG7370_Lakshmi
964737,2014054950,PHONE,NHS,NHS-Neighborhood Preservation-Open Entry,Board Up,All,05/06/2014,10:54 AM,RESOL,N,05/07/2014,1,4104 E 53rd St,64130,Mount Cleveland,Jackson,Metro,35482,39.029798,-94.53735,Property Violations,NULL,NULL,2014-05-07,2014-05-06,2024-01-30 20:56:05,DAMG7370_Lakshmi
526109,2009343820,PHONE,NHS,NHS-Animal Health and Safety-,Emergency,*Select one,12/01/2009,09:24 AM,RESOL,N,12/01/2009,0,7131 INDIANA AVE,64132,Noble And Gregory Ridge,Jackson,Metro,4055,38.99637,-94.547298,Animal,NULL,NULL,2009-12-01,2009-12-01,2024-01-30 20:56:05,DAMG7370_Lakshmi
1509399,2019076301,PHONE,NHS,NHS-Solid Waste-,Trash Collection,Missed by Contractor North,04/18/2019,04:52 PM,RESOL,Y,05/07/2019,19,8505 NE 97th Ter,64157,Shoal Creek,Clay,Shoal Creek,218900,39.270081,-94.478136,Trash,Recycling,NULL,2019-05-07,2019-04-18,2024-01-30 20:56:06,DAMG7370_Lakshmi
1563164,2019175550,PHONE,Water Services,Water Services-Meter and Field Services-,No Water / Pressure,No Water,10/03/2019,04:31 PM,RESOL,N,10/04/2019,1,1316 St Louis Ave,64101,NULL,Jackson,Central,123216,39.103646,-94.600607,Water,NULL,NULL,2019-10-04,2019-10-03,2024-01-30 20:56:06,DAMG7370_Lakshmi
281728,2007188707,PHONE,NHS,NHS-Neighborhood Preservation-,Private Property,All,12/20/2007,10:00 AM,RESOL,N,12/27/2007,7,2712 E 26TH ST,64127,Washington Wheatley,Jackson,East,16403,39.079008,-94.550408,Property & Nuisance Violations,NULL,NULL,2007-12-27,2007-12-20,2024-01-30 20:56:05,DAMG7370_Lakshmi
861202,2013040760,PHONE,NHS,NHS-Solid Waste-Administration,Administration,All,03/28/2013,02:28 PM,RESOL,N,03/28/2013,0,5916 Paseo,64110,Eastern 49-63,Jackson,Metro,104986,39.019115,-94.570496,Public Works,NULL,NULL,2013-03-28,2013-03-28,2024-01-30 20:56:05,DAMG7370_Lakshmi
943025,2014032223,PHONE,Public Works,Public Works-Solid Waste-,Right of Way,All,03/17/2014,07:28 AM,RESOL,N,03/18/2014,1,7000 Lee's Summit Rd,64136,Little Blue,Jackson,East,65567,38.993669,-94.390306,Trash,NULL,NULL,2014-03-18,2014-03-17,2024-01-30 20:56:05,DAMG7370_Lakshmi
264921,2007132035,PHONE,NHS,NHS-Animal Health and Safety-,Other,Non Emergency,10/03/2007,11:02 AM,RESOL,N,10/03/2007,0,8400 WARD PKWY,64114,Ward Parkway Plaza,Jackson,Metro,121483,38.976088,-94.607622,Animal,NULL,NULL,2007-10-03,2007-10-03,2024-01-30 20:56:05,DAMG7370_Lakshmi
590695,2010167198,PHONE,NHS,NHS-Solid Waste-,Contractor,North,05/04/2010,03:56 PM,RESOL,N,05/06/2010,2,605 NE 36TH ST,64116,River View,Clay,Shoal Creek,85147,39.15963,-94.574252,Trash,NULL,NULL,2010-05-06,2010-05-04,2024-01-30 20:56:05,DAMG7370_Lakshmi
1258300,2017064969,"WEB  ",Public Works,Public Works-Capital Projects-Signs,Traffic Sign,Damaged - Non-Emergency,06/02/2017,11:23 AM,RESOL,N,06/08/2017,6,3671 Harrison Blvd,64109,Central Hyde Park,Jackson,Central,131996,39.05902,-94.572795,Signs,NULL,NULL,2017-06-08,2017-06-02,2024-01-30 20:56:05,DAMG7370_Lakshmi
799926,2012109593,PHONE,NHS,NHS-HazardousStructure,Board Up,All,08/10/2012,03:33 PM,RESOL,Y,09/23/2014,774,1528 CYPRESS AVE,64127,East Community Team North,Jackson,East,8592,39.092753,-94.53033,Property Violations,NULL,NULL,2014-09-23,2012-08-10,2024-01-30 20:56:05,DAMG7370_Lakshmi
574388,2010134328,PHONE,Public Works,Public Works-Solid Waste-,Right of Way,All,04/09/2010,02:33 PM,RESOL,N,04/12/2010,3,13805 HOLMES RD,64146,Martin City,Jackson,South,159772,38.878127,-94.583708,Trash,NULL,NULL,2010-04-12,2010-04-09,2024-01-30 20:56:05,DAMG7370_Lakshmi
527660,2009348005,PHONE,Public Works,Public Works-Solid Waste-,Leaf & Brush,Missed,12/04/2009,08:06 AM,RESOL,N,12/04/2009,0,2610 Lawndale Ave,64127,South Blue Valley,Jackson,East,20765,39.077367,-94.517079,Trash,NULL,NULL,2009-12-04,2009-12-04,2024-01-30 20:56:05,DAMG7370_Lakshmi
318781,2008096707,PHONE,Public Works,Public Works-Solid Waste-,Bulky,Missed,04/24/2008,03:37 PM,RESOL,N,04/26/2008,2,4218 E 104TH TER,64137,Royal Oaks,Jackson,South,58015,38.93703,-94.540244,Trash,NULL,NULL,2008-04-26,2008-04-24,2024-01-30 20:56:05,DAMG7370_Lakshmi
1006902,2014147511,PHONE,NHS,NHS-Animal Health and Safety-,Wildlife,All,11/21/2014,06:12 PM,RESOL,N,11/24/2014,3,1106 W 47TH ST,64112,West Plaza,Jackson,Central,140817,39.043229,-94.60023,Animal,NULL,NULL,2014-11-24,2014-11-21,2024-01-30 20:56:05,DAMG7370_Lakshmi
885509,2013090646,PHONE,Water Services,Water Services-Engineering-Water and Sewer,Engineering,Water Main Projects,06/28/2013,12:31 PM,RESOL,Y,07/16/2013,18,4800 E 63rd St,64130,Swope Parkway-Elmwood,Jackson,Metro,492,39.014493,-94.529933,Water Quality,NULL,NULL,2013-07-16,2013-06-28,2024-01-30 20:56:05,DAMG7370_Lakshmi
222475,2007028359,PHONE,Public Works,Public Works-Solid Waste-,Animal,Dead,03/29/2007,10:40 AM,RESOL,N,03/30/2007,1,6039 ROCKHILL RD,64110,Western 49-63,Jackson,Metro,105858,39.016953,-94.576329,Trash,NULL,NULL,2007-03-30,2007-03-29,2024-01-30 20:56:04,DAMG7370_Lakshmi
1327168,2018004062,PHONE,Water Services,Water Services-Meter and Field Services-,Leak,Meter,01/08/2018,01:56 PM,RESOL,Y,01/23/2018,15,2611 JARBOE ST,64108,Westside South,Jackson,Central,124521,39.080055,-94.597206,Water,NULL,NULL,2018-01-23,2018-01-08,2024-01-30 20:56:06,DAMG7370_Lakshmi
660418,2011017036,"WEB  ",Public Works,Public Works-Street and Traffic-Snow,Street,District One,01/21/2011,04:11 PM,RESOL,N,01/26/2011,5,5528 NE MEADOWBROOK RD,64119,Maple Park,Clay,Shoal Creek,81561,39.194134,-94.497065,Snow & Ice,NULL,NULL,2011-01-26,2011-01-21,2024-01-30 20:56:05,DAMG7370_Lakshmi
1301353,2017132012,PHONE,NHS,NHS-Animal Health and Safety-Admin,Services,Service Issue / Problem,10/13/2017,05:33 PM,RESOL,N,10/13/2017,0,4018 Harvard Ln,64133,Ashland Ridge,Jackson,East,48639,39.048655,-94.449595,Animals,Pets,NULL,2017-10-13,2017-10-13,2024-01-30 20:56:06,DAMG7370_Lakshmi
672578,2011064618,INSPE,NHS,NHS-Neighborhood Preservation-,Private Property,All,03/11/2011,02:47 PM,RESOL,N,04/14/2011,34,9628 WALLACE AVE,64134,Robandee South,Jackson,South,69874,38.948411,-94.491492,Property Violations,NULL,NULL,2011-04-14,2011-03-11,2024-01-30 20:56:05,DAMG7370_Lakshmi
903039,2013107274,"WEB  ",Public Works,Public Works-Street and Traffic-Streetlights,Malfunction,Day Burn,07/31/2013,03:58 PM,RESOL,Y,08/02/2013,2,3837 N WAYNE AVE,64116,River View,Clay,Shoal Creek,85818,39.164288,-94.560399,Street Light,NULL,NULL,2013-08-02,2013-07-31,2024-01-30 20:56:05,DAMG7370_Lakshmi
1044573,2015052460,PHONE,NHS,NHS-Solid Waste-Administration,Administration,All,05/15/2015,07:39 AM,RESOL,N,05/18/2015,3,8503 NE 109th Ter,64157,Shoal Creek,Clay,Shoal Creek,99371,39.291323,-94.478435,Public Works,NULL,NULL,2015-05-18,2015-05-15,2024-01-30 20:56:05,DAMG7370_Lakshmi
66242,2020059828,"WEB  ",NHS,NHS-Neighborhood Preservation-,Nuisance,Trash on Private Property,04/29/2020,06:50 PM,RESOL,N,05/09/2020,10,7600 E 88th St,64138,Fairwood And Robandee,Jackson,South,66084,38.964447,-94.498459,Trash,Recycling,NULL,2020-05-09,2020-04-29,2024-01-30 20:56:04,DAMG7370_Lakshmi
1536923,2019119582,PHONE,NHS,NHS-Animal Health and Safety-,Wildlife,Injured,06/21/2019,05:26 PM,RESOL,N,06/22/2019,1,5720 N London Ave,64151,Parkdale And Walden,Platte,North,166188,39.200323,-94.632692,Animals,Pets,NULL,2019-06-22,2019-06-21,2024-01-30 20:56:06,DAMG7370_Lakshmi
890328,2013090319,PHONE,NHS,NHS-Neighborhood Preservation-Open Entry,Board Up,All,06/28/2013,08:00 AM,RESOL,N,07/01/2013,3,5016 Garfield Ave,64130,Blue Hills,Jackson,Metro,138646,39.035178,-94.560829,Property Violations,NULL,NULL,2013-07-01,2013-06-28,2024-01-30 20:56:05,DAMG7370_Lakshmi
990591,2014129269,PHONE,NHS,NHS-Solid Waste-Administration,Administration,All,10/07/2014,10:48 AM,RESOL,N,10/07/2014,0,1526 NE 51ST TER,64118,Davidson,Clay,Shoal Creek,87275,39.187312,-94.5604,Public Works,NULL,NULL,2014-10-07,2014-10-07,2024-01-30 20:56:05,DAMG7370_Lakshmi
1443022,2018162693,PHONE,Public Works,Public Works-Capital Projects-Traffic Permits,Cut / Permit,District 2,12/05/2018,01:02 PM,RESOL,Y,12/12/2018,7,2936 Brooklyn Ave,64109,Key Coalition,Jackson,Central,26814,39.072307,-94.557697,Streets,Roadways,Alleys,2018-12-12,2018-12-05,2024-01-30 20:56:06,DAMG7370_Lakshmi
135495,2020112666,PHONE,NHS,NHS-Solid Waste-,Trash Collection,Missed by Contractor South,08/19/2020,09:14 AM,RESOL,N,08/20/2020,1,2212 E 75th St,64132,East Meyer 7,Jackson,Metro,115330,38.991305,-94.56267,Trash,Recycling,NULL,2020-08-20,2020-08-19,2024-01-30 20:56:04,DAMG7370_Lakshmi
555382,2010015280,PHONE,NHS,NHS-Neighborhood Preservation-,Private Property,All,01/12/2010,03:19 PM,RESOL,N,02/23/2010,42,809 NW 70TH ST,64118,Clayton,Clay,North,95731,39.222833,-94.59028,Property Violations,NULL,NULL,2010-02-23,2010-01-12,2024-01-30 20:56:05,DAMG7370_Lakshmi
1154735,2016075789,PHONE,Water Services,Water Services-Line Maintenance-Pipeline,Pipeline Referral,Restoration Issue,07/01/2016,02:26 PM,RESOL,N,07/19/2016,18,8716 N HULL AVE CE,64154,Coves North,Platte,North,252193,39.253785,-94.644602,Water,NULL,NULL,2016-07-19,2016-07-01,2024-01-30 20:56:05,DAMG7370_Lakshmi
1507872,2019082659,"WEB  ",Public Works,Public Works-Street and Traffic-District 3,Pothole,District 3,04/28/2019,08:36 AM,RESOL,Y,05/15/2019,17,13107 E 61st St,64133,Little Blue,Jackson,East,64484,39.009963,-94.426828,Streets,Roadways,Alleys,2019-05-15,2019-04-28,2024-01-30 20:56:06,DAMG7370_Lakshmi
1078727,2015106379,PHONE,NHS,NHS-Neighborhood Preservation-,Property Maintenance,Other Property Issue,09/02/2015,10:51 AM,RESOL,Y,02/17/2016,168,4505 BELLEVIEW AVE,64111,West Plaza,Jackson,Central,140791,39.045837,-94.598031,Property,Buildings,Construction,2016-02-17,2015-09-02,2024-01-30 20:56:05,DAMG7370_Lakshmi
449203,2009036761,PHONE,NHS,NHS-Solid Waste-,11,March,02/13/2009,10:00 AM,RESOL,N,03/12/2009,27,10518 WALNUT DR,64114,Bridlespur,Jackson,South,153908,38.936272,-94.590519,Bulky Appointment,NULL,NULL,2009-03-12,2009-02-13,2024-01-30 20:56:05,DAMG7370_Lakshmi
723253,2011193026,PHONE,NHS,NHS-Solid Waste-,Contractor,South,09/16/2011,11:31 AM,RESOL,N,09/19/2011,3,11405 MANCHESTER AVE,64134,Ruskin Heights,Jackson,South,72592,38.916379,-94.49957,Trash,NULL,NULL,2011-09-19,2011-09-16,2024-01-30 20:56:05,DAMG7370_Lakshmi
73383,2020152194,PHONE,NHS,NHS-Solid Waste-,Recycling,Missed by City,12/04/2020,01:27 PM,RESOL,N,12/07/2020,3,1600 Bennington Ave,64126,East Blue Valley,Jackson,East,6817,39.091675,-94.50595,Trash,Recycling,NULL,2020-12-07,2020-12-04,2024-01-30 20:56:04,DAMG7370_Lakshmi
647330,2010377239,VOICE,Public Works,Public Works-Solid Waste-,Animal,Dead,12/02/2010,06:34 PM,RESOL,N,12/03/2010,1,2700 Tracy Ave,64109,Beacon Hills,Jackson,Central,27235,39.077452,-94.568743,Trash,NULL,NULL,2010-12-03,2010-12-02,2024-01-30 20:56:05,DAMG7370_Lakshmi
392296,2008261732,PHONE,NHS,NHS-Solid Waste-,Bulky,Appointment,10/21/2008,10:24 AM,RESOL,N,11/08/2008,18,3531 BALES AVE,64128,Palestine West And Oak Park No,Jackson,East,27912,39.061116,-94.542576,Trash,NULL,NULL,2008-11-08,2008-10-21,2024-01-30 20:56:05,DAMG7370_Lakshmi
1383840,2018074844,EMAIL,Public Works,Public Works-Street and Traffic-Streetlights,Street Light,1 Light Out,06/09/2018,10:07 AM,RESOL,N,06/12/2018,3,4719 N CLEVELAND AVE,64119,Sherwood Estates,Clay,Shoal Creek,80459,39.180812,-94.533994,Lights,Signals,NULL,2018-06-12,2018-06-09,2024-01-30 20:56:06,DAMG7370_Lakshmi
1270610,2017075507,PHONE,Public Works,Public Works-Street and Traffic-District 3,Culvert,South,06/22/2017,01:52 PM,RESOL,N,07/06/2017,14,11214 Hickman Mills Dr,64137,Hickman Mills,Jackson,South,61523,38.920895,-94.524045,Storm Water,Sewer,NULL,2017-07-06,2017-06-22,2024-01-30 20:56:05,DAMG7370_Lakshmi
1155357,2016060321,PHONE,NHS,NHS-Neighborhood Preservation-Abatement,Nuisance,Land Bank,06/01/2016,12:00 PM,RESOL,Y,07/11/2016,40,1005 E 32ND TER,64109,North Hyde Park,Jackson,Central,128135,39.067886,-94.572618,Trash,Recycling,NULL,2016-07-11,2016-06-01,2024-01-30 20:56:05,DAMG7370_Lakshmi
677616,2011070536,PHONE,Public Works,Public Works-Capital Projects-Traffic Control,Traffic Study,Traffic,03/18/2011,12:00 PM,RESOL,N,03/22/2011,4,409 LAWNDALE AVE,64123,South Indian Mound,Jackson,East,45241,39.108294,-94.515122,Traffic Study,NULL,NULL,2011-03-22,2011-03-18,2024-01-30 20:56:05,DAMG7370_Lakshmi
881153,2013067974,PHONE,NHS,NHS-Neighborhood Preservation-,Private Property,All,05/21/2013,03:11 PM,RESOL,Y,08/22/2013,93,7726 Sni-A-Bar Rd,64129,Eastwood Hills East,Jackson,East,50745,39.031895,-94.490543,Property Violations,NULL,NULL,2013-08-22,2013-05-21,2024-01-30 20:56:05,DAMG7370_Lakshmi
934569,2014005625,PHONE,Water Services,Water Services-Line Maintenance-Wastewater,Restoration,Turf,01/14/2014,12:52 PM,RESOL,N,03/10/2014,55,7209 Summit St,64114,Ward Parkway,Jackson,Metro,110638,38.99764,-94.59819,Water Services,NULL,NULL,2014-03-10,2014-01-14,2024-01-30 20:56:05,DAMG7370_Lakshmi
1232103,2017038405,EMAIL,NHS,NHS-Neighborhood Preservation-,Parked on Unapproved Surface,Car Private Property,04/06/2017,03:46 PM,RESOL,Y,03/27/2018,355,10715 Newton Ave,64134,Stratford Estates,Jackson,South,59326,38.928818,-94.512056,Vehicles,Parking,NULL,2018-03-27,2017-04-06,2024-01-30 20:56:05,DAMG7370_Lakshmi
247191,2007094193,PHONE,NHS,NHS-Neighborhood Preservation-,Illegal Dumping,All,08/03/2007,07:59 PM,RESOL,N,08/09/2007,6,605 W 56TH ST,64113,Ward Estates,Jackson,Metro,142975,39.026236,-94.595176,Trash,NULL,NULL,2007-08-09,2007-08-03,2024-01-30 20:56:05,DAMG7370_Lakshmi
429876,2009003125,PHONE,NHS,NHS-Solid Waste-Administration,Administration,All,01/06/2009,08:51 AM,RESOL,N,01/06/2009,0,1924 E 72nd St,64132,East Meyer 7,Jackson,Metro,115214,38.996797,-94.563891,Public Works,NULL,NULL,2009-01-06,2009-01-06,2024-01-30 20:56:05,DAMG7370_Lakshmi
645244,2010383992,PHONE,Water Services,Water Services-Line Maintenance-Pipeline,Repair,Main Leak,12/12/2010,09:50 AM,RESOL,N,02/04/2011,54,8100 E US 40 HWY,64129,Blue Valley Industrial,Jackson,East,47759,39.063677,-94.489197,Water Leak,NULL,NULL,2011-02-04,2010-12-12,2024-01-30 20:56:05,DAMG7370_Lakshmi
452483,2009095802,PHONE,NHS,NHS-Solid Waste-,11,All,04/20/2009,09:02 AM,RESOL,N,06/12/2009,53,8137 Belleview Ave,64114,West Waldo,NULL,Metro,120996,38.979998,-94.601447,Bulky Appointment,NULL,NULL,2009-06-12,2009-04-20,2024-01-30 20:56:05,DAMG7370_Lakshmi
1076427,2015101588,PHONE,Water Services,Water Services-Line Maintenance-Stormwater,Storm Drain / Catch Basin,Damaged / Broken,08/24/2015,09:40 AM,RESOL,N,08/25/2015,1,1700 E 18th St,64108,18th And Vine And Downtown East,Jackson,Central,225904,39.091421,-94.561564,Storm Water,Sewer,NULL,2015-08-25,2015-08-24,2024-01-30 20:56:05,DAMG7370_Lakshmi
1475305,2019034509,PHONE,Water Services,Water Services-Meter and Field Services-,Leak,At Curb / In Yard,02/15/2019,07:24 AM,RESOL,Y,02/20/2019,5,3130 Broadway Blvd,64111,Valentine,Jackson,Central,129245,39.069893,-94.590672,Water,NULL,NULL,2019-02-20,2019-02-15,2024-01-30 20:56:06,DAMG7370_Lakshmi
